,gender,sentences
1801,any,پریس کونسل فرقہ_وارانہ مضمون ، بےبنیاد خبر شائع کرنے ، نسلی تفریق پھیلانے ، خواتین کے خلاف تفریق کرنے کے لئے اخبارات کے خلاف کاروائی کر سکتی ہے ۔
1802,f,صحافت قارئین کو بتاتی ہے کہ اس کے آس_پاس اردگرد کیا ہو رہا ہے ۔
1803,,صحافت ایک صنعت ہے ایک کاروبار ہے اور اسی کے ساتھ ساتھ وہ ایک مشن بھی ہے ۔
1804,,دیگر صنعتوں کی طرح صحافت صنعت بھی فائدہ کمانے کی کوشش کرتی ہے لیکن دیگر صنعتوں کی طرح اس کا محض ایک مقصد مانا جاتا ہے ۔
1805,any,"صحافت کے دو اہم مقاصد ہیں , پہلا ، اطلاع دینا یعنی حادثے کی رپورٹ کرنا اور دوسرا خبر پر تشریح پیش کرنا اور خبر پر مبنی رائے بنانا ۔"
1806,m,فیچر کسی بھی ہمعصر موضوع پر لکھا جاتا ہے ۔
1807,,سمدھن جی اب آپ چاہیں ناراض ہو جائیں ، ہم آپ کو آج نہیں جانے دینگے ۔
1808,any,ارے ہاں پریم بیٹا ، آخر کب تک یہاں بیٹھے رہینگے ؟
1809,any,بتاؤ تو صحیح ، کرنا کیا ہے بھئی ؟
1810,,بڑا آسان سا گیم ہے ، وہاں پر بھولا جی میوزک بجائیں گے ، یہ تکیہ ہم لوگ یہاں پر پاس کریں گے ۔
1811,,جب بھی میوزک رکے گا یہ تکیہ جس کے بھی ہاتھ میں ہوگا وہ پھنسے گا اور پھر جو بھی سزا ہم اسے دینا چاہیں گے ہم دینگے اور اسے ماننی بھی پڑے گی ۔
1812,m,ہم وہاں بیٹھ کر دیکھیں گے کہ کوئی چیٹنگ نہ کرے ۔
1813,,بھئی کمال کرتے ہیں ڈاکٹر صاحب ، فولادی جگر ہے اتنی جلدی فیل تھوڑے ہی ہوگا ۔
1814,any,بھابھی جی ! ہمیں آپ سے ایک شکایت ہے ، آپ اتنے دن یہاں رہے ، ایک بار بھی ہمارے گھر کھانے پر نہیں آئے ۔
1815,any,ارے بھائی ایک منٹ ، آپ لوگوں کو ٹھیک سے رخصت تو کر دیں ۔
1816,,سمدھن جی ! یہ من بھی کتنا باورا ہے ، جتنا پاتا ہے اس سے زیادہ پانے کی خواہش رکھتا ہے ۔
1817,,ایک دن تو ہم نے آپ سب کو روک لیا ، اب جی چاہتا ہے ایک دن اور روک لیں ۔
1818,,نشا کے ساتھ ایک فوٹو تو دلائیے تاکہ یاد تو رہے کہ اتنے دن ہمارے ساتھ کتنے پیار سے رہی ۔
1819,any,جی رہی ہو ؟
1820,,اب کوئی بہانا بھی تو نہیں جس سے میں تمھیں روک سکوں ۔
1821,m,جیسے ہی فیکٹری کا افتتاح ہو جائے ، میں بھابھی سے اپنی شادی کی بات کرونگا ۔
1822,any,ارے میرے پیارے بھائیو ، دیکھ کیا رہے ہو ؟
1823,,ہمارے پریم بھیّا آج بڑے صاحب بن گئے ہیں ، سلام کرو ۔
1824,m,بس اسی کا ڈر تھا مجھے ۔
1825,,ارے ان نوکروں کو تو میں خوب اچھی طرح سے جانتی ہوں ، یہ بیماری تو بہانہ ہے بہانہ ، پیسے اینٹھنے کی اسکیم ہے سمجھی ۔
1826,,بھابھی ! ہم اپنی قسم کھا کر کہتے ہیں یہ تار جھوٹا نہیں ہے ، خریدا ہوا نہیں ہے ۔
1827,any,سن ، جب تیری بھابھی ٹھیک ہو جائے نہ ، تو سب سے پہلے ان سے کہنا کہ تو نے اپنے لئے چمیلی ڈھونڈ لی ہے ۔
1828,,بہو ! کل کلّو چلا گیا ، آج تم لوگ چلے جاؤ گے ، ہمارا من کیسے لگے گا ۔
1829,,اسیلئے تو کہتی ہوں کاکا جی ، ہماری فیکٹری کا کام شروع ہو گیا ہے ، اب ہمارے لئے ایک دیورانی لے آئیے نہ ۔
1830,,چلو بہو ! آج سے اس کے لئے دلھن چننے کی ذمہ_داری تمھاری ۔
1831,,آج آپ کی شادی کی بات کیا چلی ، موسم نے جادو کر دیا ۔
1832,,کاکا جی نے آپ کی باگ_ڈور اب ہمارے ہاتھ میں دے دی ہے ، یہ بتائیے جناب لومیرج پسند کریں گے یا ارینجڈمیرج ؟
1833,,دیکھو منّا ! آپ کے چاچا آپ کے پاپا سے دو قدم آگے نکلے ، چپکے چپکے آپ کے لئے ایک چاچی بھی ڈھونڈ لی ۔
1834,any,یعنی کہ آپ نے اور آپ کی میڈم نے مل کر پہلے سے ہی یہ پروگرام طے کر رکھا ہے ۔
1835,,ارے ! اگر وہ نیچے آ رہی ہے تو چل ہم اس کے پاس چلتے ہیں ۔
1836,,کھا لے ٹفی ، تجھے کھلانے والی اب واپس نہیں آئے گی ۔
1837,,وہ تو بےرحم تھی ، چار دن کا موہ جگا کر ہمیں اکیلا چھوڑ گئی ۔
1838,,پتہ نہیں کیا جادو تھا اس بچی میں ، اس کے بنا تو جینا ہی بھول گئے ۔
1839,,ارے جگن ! جگن ! سبھی ڈاکٹروں نے جواب دے دیا تھا ، کہہ دیا تھا کہ ہماری بھابھی اب کبھی ٹھیک نہیں ہوگی ۔
1840,,لیکن ، ہمیں بھروسہ تھا ، ہمیں بھروسہ تھا انھیں کچھ نہیں ہو سکتا ۔
1841,f,پوجا بھابھی نے ان کے لئے دعا کی تھی نہ بھیّا جی اور وہی ہوا ، ان کی آنکھیں کھلی ، وہ مسکرائی ۔
1842,m,ہم نے ان کو یہی کہا یہ سب کرشمہ اس بھابھی کا ہے جس کا ہاتھ ہمارے سر پر ہمیشہ ہے ۔
1843,,مالک ! مالک ! ہمارے آنسوؤں کے لئے جان دے گئی بھابھی ، اپنی دعا میں ہماری بھابھی کو زندگی دے گئی بھابھی ، زندگی دے گئی ۔
1844,m,بڑے بھیّا ! پوچھو اس خدا سے اچھے لوگوں کو اپنے پاس کیوں بلا لیتے ہیں ؟
1845,f,کیوں بلا لیتے ہیں ؟
1846,,للّو ! تیری پوجا بھابھی تو شفقت کی دیوی تھی ، ممتا کا خزانہ تھا اس میں ۔
1847,,وہ بھی تو پیار کا بھوکا ہے ، اسے بھی تو پیار چاہیئے للّو ، اسے بھی تو پیار چاہیئے ۔
1848,any,ممتا کی بات کہہ رہے ہو ، اس پر تو ہمارے راج کا حق تھا نہ ؟ حق ؟
1849,,پوجا کے جانے کے بعد ہمیں اس کی اتنی کمی محسوس ہو رہی ہے تو ذرا سوچو بیچارے راجیش پر کیا بیت رہی ہوگی ۔
1850,,وہ خود کو بھلے ہی کچھ نہ کہے لیکن اتنے دنوں سے اس کی حالت تو ہم لوگ دیکھ ہی رہے ہیں ۔
1851,,اندر ہی اندر اسے فکر کھائے جا رہی ہے اور اس کی پریشانی کی وجہ ہے منے کی پرورش ۔
1852,,راجیش بیٹا ! تجھے اپنے منے کے مستقبل کے لئے پریشان ہونے کی بالکل ضرورت نہیں ۔
1853,,راجیش کا بیاہ اس وقت سویٹی سے ہوتا تو آج یہ دن دیکھنے کو نہ ملتا ۔
1854,f,ارے ، کسی اور کے بچے کو سینے سے لگا کر رکھنے کے لئے اپنی تہذیب کی پہچان ہونی چاہیئے ، سمجھی تم ؟
1855,f,آجکل کون سی لڑکی سوتیلی ماں بننا پسند کریگی ؟
1856,m,کون سے ماں _ باپ ایسے حالات میں اپنی بیٹی راجیش کو دینگے ۔
1857,,دیویدی جی کے ذریعہ کی گئی تقریر کی بات شروع میں کہی جا چکی ہے ۔
1858,,آگے کی اہم لائنوں کو دیکھئے - اگر دیویدی جی نہ اٹھ کھڑے ہوتے تو جیسے غیرمنظم ، مخالف قواعد اور بےہودہ زبان چاروں جانب دکھائی پڑتی اس کی روایت جلد نہ رکتی ۔
1859,,۱۶ جنوری ۱۸۹۹ کو گپت جی نے ` بھارت - متر ` کی ادارت سنبھالی ۔
1860,f,ان کو چلانے کی ذمہ_داری انھیں پر تھی ۔
1861,,اسلئے اخبار کو انھوں نے اپنے مطابق ایک نیا نظام دیا ۔
1862,,گپت جی چونکہ شعورِ عہد کے تئیں بیدار تھے اور ان کی ذاتی ایمانداری مستحکم تھی اسلئے فطری تھا کہ شدید قومیت ہی اخبار کی پالیسی بنے ۔
1863,m,بالمکند گپت مہاویرپرساد دیوید کے ہمعصر تھے ۔
1864,,لیکن ان کا مضمون لکھنے کا اسلوب بھارتیندو عہد کا ہے ۔
1865,any,زبان میں پہلے سے اب شفافیت آ چکی تھی ۔
1866,,جملوں کی ترتیب ایکدم مانوس ہے ، رفتار اور یتی کا ویسا ہی دھیان رکھا گیا ہے جیسے آزاد نظم میں ۔
1867,m,گپت جی چھوٹے اور چبھتے ہوئے جملے لکھنے میں بےمثال تھے ۔
1868,any,انھوں نے صحافت سے سیکھ لیا تھا کہ طویل جملے اور بامحاورہ آسان زبان ، تاثر کے نظریے سے نہایت مفید ہوتی ہے ۔
1869,,کاشی میں جنمے پراڈکرجی کو صحافت کے شعبے میں داخلہ دلوانے کا سہرا ویسے تو ان کے ماما جناب گنیش سکھارام دیوسکر کو ہے لیکن ` ہتوارتا ` سے ` بھرت متر ` میں ملا کر انھیں ایک نئے عہد کا آغاز کرنے کا موقع مدیر اعلیٰ پنڈت امبیکا پرساد واجپئی نے ہی دیا ۔
1870,m,بنگال میں تب صحافت کا فن کافی تیز تھا ۔
1871,m,اس وقت کے بنگال کے ایک نایاب صحافی تھے ، پنچکوڑی بنرجی ۔
1872,any,وہ متعدد اسلوب میں لکھ سکتے تھے ۔
1873,,انھیں کبھی پراڑکر جی کے باپ نے پڑھایا تھا اسلئے وہ پراڑکر جی سے خصوصی انسیت رکھتے تھے ۔
1874,,انھوں نے نوجوان پراڑکر کو صحافت کی ابتدائی تعلیم دی تھی ۔
1875,,نوجوانوں میں جس لگن سے انھوں نے مطالعہ کیا تھا اور ماما اودیسکر جی کی ترغیب سے ایک ہاتھ میں گیتا اور دوسرے میں ` پستول ` لے کر جس انقلابی مستقبل کا ذکر کیا اس کے لئے نیا میڈیم لازمی تھا اور یہ میڈیم بننے کی قوت ان جیسے مفکر کے لئے صحافت میں ہی نہاں تھی ۔
1876,,پراڑکر جی نے نہ صرف ہندی صحافت کو نئی راہ دی بلکہ انھوں نے ہندی نثر کا خاکہ دلکش اور موثر بنایا ۔
1877,,انھوں نے نئے لفظ گڑھے اور نئے محاوروں کو رائج کیا ۔
1878,any,` آج ` میں چلائے گئے آپ کے سیکڑوں لفظ ہندی میں چل پڑے ۔
1879,,مسٹر کے مقام پر ` شری ` اور ` میرس ` کی جگہ ` سروشری ` کا استعمال آپ نے ہی چلایا جو بہت رائج ہوا ۔
1880,,پھر حکومتِ ہند نے بھی اسے قبول کیا ۔
1881,,ہندی قواعد کے متعدد بنیادی اصول آپ کے ساتھ ہی چلے گئے ۔
1882,any,` میں ` اور `` کو `` کے استعمال سے متعلق آپ کے قواعد و اصول خاص طور پر قابل ذکر ہیں ۔
1883,m,ہندی صحافت کے شعبے میں گنیش شنکر ودیارتھی کا تعاون قابلِ یادگار تھا ۔
1884,m,وہ ججھارو فطرت کے وقف اور سخت_جاں صحافی تھے ۔
1885,m,صحافی ہونے کے ساتھ - ساتھ وہ مجاہد آزادی بھی تھے جو مادر وطن کو آزاد کرنے کے لئے ہمیشہ کوشاں تھے ۔
1886,,کانپور سے شائع ہونے والے اخبار ` پرتاپ ` کے ذریعہ گنیش شنکر ودیارتھی کی شخصیت میں مزید نکھار آنا شروع ہوا اور وہ ایک بیدار ، ہونہار اور منجھے ہوئے صحافی کے روپ میں مشہور ہوئے ۔
1887,,` پرتاپ ` پہلے ہفتہ_وار تھا لیکن بعد میں وہ روزنامہ ہو گیا ۔
1888,,۱۹۲۰ سے انھیں اس روزنامے کا مدیر اعلیٰ مقرر کیا گیا ۔
1889,m,گنیش شنکر ودیارتھی ہندی صحافت کے ابتدائی دور کے اہم صحافی تھے جو صحافیوں کی آزادی ، خودمختاری اور تنظیم کے لئے ہمیشہ جوجھتے رہتے تھے ۔
1890,m,` سماچار سدھاورشن ` کے مدیر شیام بابو سندر بنگالی ہونے کے باوجود ہندی کے پیشرووں میں اپنا اہم مقام رکھتے ہیں ۔
1891,,ذولسانی اخبار ` سماچار سدھاورشن ` میں ہندی کے ساتھ ساتھ بنگلہ زبان کا بھی مواد ہوا کرتا تھا ۔
1892,,اگرچہ پرانی روایت پالیسی کے حامی تھے لیکن نئے روزنامہ ہندی کے نفاذ میں بھی آپ نے مکمل تعاون کیا اور صحافتی دنیا میں قابل ذکر رول ادا کیا ۔
1893,m,پرتاپ نارائن مشر ہندی ، بنگالی ، سنسکرت ، انگریزی ، فارسی وغیرہ زبانوں میں ماہر قوم_پرست تھے ۔
1894,,اولوالعزم مدن موہن مالویہ جی کے ساتھ انھوں نے ` ہندوستھان ` کی ادارت سنہ ۱۸۸۹ میں کی ۔
1895,,اس سے قبل ۱۵ مارچ ۱۸۸۳ کو انھوں نے ` براہمن ` نامی ایک رسالہ نکالا ۔
1896,any,عوام کی زبان میں عوام کے لئے عوامی مفاد کے جذبات کی بنیاد پر شائع ` براہمن ` رسالہ ایک قسم سے موجودہ عوام کے گلے کی ہڈی بن گیا تھا ۔
1897,m,تقریباً ۳۲ کتابوں کے خالق جناب مشر بھارتیندو بابو ہریش چند کے بڑے پرستار تھے ۔
1898,any,بھارتیندو منڈل کے اس بہترین شاعر اور صحافی کا انتقال ۱۸۹۴ میں ہو گیا ۔
1899,,چٹیلے مزاح ، حقیقی کہاوت ، بہادری اور حبالوطنی کے لئے مشرا جی کو ہمیشہ یاد کیا جاتا رہےگا ۔
1900,,کانپور اور کاشی میں مطالعہ کرنے کے بعد امبیکاپرشاد واجپیئی نے کلکتہ کے الہ_آباد بینک میں ۱۹۰۲ سے ۱۹۰۵ تک نوکری کی ۔
1901,,` ہندی بنگواسی ` میں لگ_بھگ ڈیڑھ سال تک خدمت کرنے کے بعد ۱۹۰۷ میں واجپیئی جی نے ` نرسنگھ ` نامی ماہانہ رسالے کی اشاعت شروع کی جو ایک سال تک چلی ۔
1902,,۱۹۰۹ - ۱۰ میں وہ نیشنل کالج میں ہندی کے پرنسپل مقرر ہوئے ۔
1903,,۱۹۱۱ سے ۱۹۱۹ تک ` بھرتمتر ` کی قابل ذکر خدمات آپ نے صحافت کو آگے بڑھایا ۔
1904,,` جاسوس ` نامی پرچہ کے مدیر ناشر اور مخصوص مصنف گوپال رام گہمری نے تقریباً ۲۰۰ ناول لکھے ۔
1905,,جس طرح دیوکانندن کھتری نے عیاری طلسمی ناولوں کا احیا کیا اسی طرح انگریز جاسوسی ناولوں سے ترغیب پا کر گہمری جی نے ہندی میں جاسوسی کہانیوں اور ناولوں کا ڈھیر لگا دیا ۔
1906,,آپ نے ۱۹۴۶ تک ہندی کی خدمت کی ۔
1907,,ان کے مطابق انجمن ترقی پسند مصنفین کا قیام ۱۹۳۶ میں ہوا اور پریم چند ، ملک راج آنند ، سجادظہیر جیسے لوگ تنظیم کی قیادت میں رہے ۔
1908,m,میرے دوست پرنےکرشن نے اپنے مضمون ` ` ترقی_پسند تحریک کے 57 سال ` ` میں لکھا :
1909,f,` ` سجادظہیر کی ۱۹۳۶ میں بنائی گئی تنظیم کی اہمیت یہ تھی کہ وہ پہلی عظیم کوشش تھی جس میں اس پورے دائرے کی تخلیقی و انقلابی امکان کو روبہ_عمل کرنے کا خواب دکھایا ۔ ` `
1910,any,اب ذرا ایک بیان خود انجمن ترقی_پسند مصنفین کے بنیادگزاروں میں سے ایک ملک راج آنند کی زبانی سن لیں :
1911,,۱۹۳۵ میں لندن میں نومبر کے کہرے بھرے دنوں کے دوران ۱۹۳۱ کے مالی بحران کے مدنظر ہندوستان میں ہمارے جن اقدار کو نقصان پہنچا اور جس طرح ہندوستانی عوام میں ناامیدی چھائی ، اس سے دوچار ہم میں سے کچھ ساتھیوں نے انجمن ترقی_پسند مصنفین کا قیام ( لندن میں ) کیا ۔
1912,m,لندن میں ہم ہر ہفتے ادبی نشست کرتے رہے ۔
1913,,حالانکہ کل_ہند انجمن ترقی_پسند مصنفین کی کانفرنس اپریل ۱۹۳۶ میں لکھنو میں ہوئی ۔ ` `
1914,,ملک راج آنند کی بات صحیح مانی جائے یا موجودہ صدر پنلن کی ، یا دیگر قلمکاروں کی جو انجمن ترقی_پسند مصنفین کے قیام ۱۰ اپریل ۱۹۳۶ ثابت کرنے پر آمادہ ہیں ؟
1915,m,آخر وجہ کیا ہے اس بات کی کہ اتنے چھوٹے سے وقفے میں ایسی مبہم حالت بن جائے ؟
1916,any,دراصل ، اس کے تار جڑے ہیں اوپر اٹھائے گئے پہلے سوال سے کہ پریم چند کمیونسٹ تھے یا نہیں ؟
1917,any,ظاہر ہے کہ لندن میں جن لوگوں نے انجمن ترقی_پسند مصنفین کا قیام کیا ان میں بیشتر انگلینڈ میں تعلیم حاصل کرنے والے ہندوستانی ادیب اور قلمکار تھے ۔
1918,,وہ زیادہ_تر کمیونسٹ تھے اور دبی زبان میں یہ کہہ لوں کہ ان میں بیشتر اشراف یعنی ایلیٹ تھے ۔
1919,m,۱۹۳۰ کی دہائی آتے آتے پریم چند ہندوستانی ادیبوں میں خصوصاً ہندی اردو قارئین میں بلامبالغہ سب سے بڑا نام بن چکے تھے ۔
1920,any,انجمن ترقی_پسند مصنفین کے قیام میں پریم چند کا نام جڑنا تنظیم کے لئے بڑی تعظیم پانے جیسی بات تھی ۔
1921,,لہٰذا لکھنو کے سمینار کی صدارت کرنے والے پریم چند کو انجمن ترقی_پسند مصنفین کا بنیادگزار ہی مشہور کر دیا گیا ۔
1922,m,انجمن ترقی_پسند مصنفین کا سیدھا تعلق ہندوستانی کمیونسٹ پارٹی سے تھا ۔
1923,any,چنانچہ پریم چند مصنفین کی کانفرنس کی صدارت بھی کر گئے تھے ( اور جنھیں بعد میں کچھ نے انجمن مصنفین کے بنیادگزار کے روپ میں بھی قائم کر دیا ) ، ان کا نام کمیونسٹ ہونا بھی ضروری ہو گیا ۔
1924,f,تب قواعد شروع ہوئی پریم چند کے مضامین اور حوالوں کو بنیاد بنا کر انھیں کمیونسٹ ثابت کرنے کی ۔
1925,m,یقیناً پریم چند شروع میں بولشیوک انقلاب کے قائل ہوئے تھے ۔
1926,m,پریم چند جن کسانوں اور متاثرہ طبقے کے حامی تھے وہ نظریہ بولشیوک انقلاب اور کمیونسٹ خیالات سے جا ملتا تھا ۔
1927,,مگر پریم چند نے کبھی خود کو کمیونسٹ نہیں بتایا ۔
1928,f,نہ ان کے ادب میں پرتشدد بولشیوک انقلاب کی بازگشت ملی ۔
1929,any,ملا تشدد کا پیغام اور خونی انقلاب سے نفرت جو انھیں مارکس کے نہیں گاندھی بابا کے قریب لے جاتا تھا ۔
1930,any,پریم چند کو کمیونسٹ اعلان کرنا اسی طرح سے ہے جیسے جواہر لعل نہرو کو گاندھی سے الگ کر ان پر لال بلّا لگا دیا جائے ۔
1931,f,ہندوستانی کمیونسٹ پارٹی کی پہل پر ۱۹۳۶ میں ہی آل_انڈیا اسٹوڈنٹس فیڈریشن کی تشکیل ہوئی جس کا افتتاح نہرو نے کیا ۔
1932,,گاندھی رابندرناتھ ٹیگور ، تیج بہادر سپرو ، خان عبدالغفّار خاں وغیرہ نے پیغام بھیجے اور مقررین میں گووند بلبھ پنت بھی شامل تھے ۔
1933,f,اب وہ پہل تو کمیونسٹ پارٹی کی تھی لیکن جو نام ابھی گنے گئے ان میں کون کمیونسٹ تھا ؟
1934,f,انجمن ترقی_پسند مصنفین کے سمینار کی صدارت پریم چند نے ویسے ہی کی جیسے آل_انڈیا اسٹوڈینٹس فیڈریشن کے اجلاس کا افتتاح جواہرلعل نہرو نے کیا ۔
1935,m,اس حساب سے تو نہرو اور دیگر لوگوں سمیت گوندولبھ پنت کو بھی کمیونسٹ قرار دے دینا چاہیئے ؟
1936,m,پریم چند کو کمیونسٹ ثابت کرنے کے جگاڑ میں بارہا ان کے ` مہاجنی_تہذیب ` مضمون کا ذکر کیا جاتا ہے ۔
1937,f,بےشک پریم چند نے ` نئی تہذیب کا سورج دوردراز مغرب سے طلوع ` کی ستائش کی ۔
1938,m,یہ ایسا وقت تھا جب پہلے عالمی_جنگ کے بعد اچانک امید کی ایک کرن دکھی جس میں سرمایہ_داری کے ، استحصال کی ، غلامی کی زنجیریں ٹوٹتی نظر آئیں ۔
1939,any,اس نئی روشنی نے تمام ایسے لوگوں کے دلوں میں جگہ بنانی شروع کر دی جو مستحصِل ، جاگیردار اور سرمایہ_دارانہ نظام کے خلاف تھے یا خود استحصال_زدہ تھے ۔
1940,m,ان کی نظروں میں استحصال_زدہ سماج کیوں اونچا درجہ نہ پاتا ۔
1941,any,اس نئے ابھرتے نظام نے تو ان کو بھی پرامید کر دیا تھا جو جانتے بھی نہیں تھے کہ کمیونزم ہے کیا ۔
1942,f,ان کے لئے تو بس بھوک سے آزادی ہی سب کچھ تھی ۔
1943,m,پریم چند نے کہا ، خوش_قسمت ہے وہ تہذیب ، جو مالداری اور ذاتی املاک کا خاتمہ کر رہی ہے اور جلد ہی یا دیر سے دنیا اس کی تقلید ضرور کرے گی -
1944,any,یہ تہذیب فلاں ملک کے سماجی تخلیق یا دھرم و مذہب سے میل نہیں کھاتی یا اس ماحول کے مطابق نہیں ہے یہ دلیل نہایت بےربط ہے ۔
1945,m,بالکل صحیح کہا شہنشاہِ_ناول نے ۔
1946,f,یہی امید ہونی چاہیئے عظیم قلمکار سے ۔
1947,m,اور نظام بھی ایسا ہی ہونا چاہیئے ۔
1948,any,بھوک اور غلامی سے آزاد کرنے والی ۔
1949,,لیکن کیا اتنا کافی ہوگا پریم چند کو کمیونسٹ ثابت کرنے کے لئے ؟
1950,any,یعنی ان کے لئے اہم موضوع استحصال ، مہاجنی اور سرمایہ_داری سے آزادی ہے ۔
1951,,لیکن وہ مذہبوں تک کی تعریف کر رہے ہیں اسی سانس میں ۔
1952,m,اس کا مطلب یہ ہوا کہ عیسائیت یا بدھ مذہب کے ذریعہ استحصال ، مہاجنی اور سرمایہ_داری سے آزادی ملے تو وہ بھی اتنی ہی تعظیم کے حقدار ہونگے ۔
1953,m,خود ذاتی زندگی میں پریم چند تمام ہندو روایات کے معتقد تھے ۔
1954,any,سچائی یہ ہے کہ پریم_آشرم ، سیواسدن جیسے ناول اور متعدد کہانیاں اکثر ان کو گاندھی کی طرف لے جاتی ہیں نا کہ کمیونسٹ کی طرف ۔
1955,m,۱۹۳۶ میں ہوئی انجمن ترقی پسند مصنفین کی کانفرنس میں جہاں ایک طرف مولانا حسرت موہانی جیسے آدمی نے کمیونسٹ خیالات کی نشر و اشاعت کی بات کی وہیں پریم چند نے اپنی تقریر میں ایک بار بھی ایسا کوئی بیان نہیں دیا ۔
1956,any,کوئی اس کی وجہ بتا سکتا ہے ؟
1957,any,پریم چند کو کہانی_کار ہی رہنے دینے میں ہم سب کی بھلائی ہے ۔
1958,any,` ` ادب سماج کے آگے چلنے والی مشعل ` ہمیشہ رہے گی اس کے لئے پریم چند کا کمیونسٹ ہونا ضروری نہیں ہے ۔
1959,f,ہمارے پچھلے ستاون برس کے دوست اشوک ( واجپیئی ، کبھی کبھی ، جن_ستّا ۹ جون ) نے نوبل انعام کی ایک صدی ` کی شروعات ہی ایک کثیر رائج ابہام سے کی ہے ۔
1960,,اخباروں کا بیجا استعمال کرنے کے لئے کچھ ریاستوں میں ایک نیا مجرمانہ سلسلہ شروع ہوا ہے ۔
