,gender,sentences
548,m,موٹے طور پر مضمون ، کالم اور فیچر میں کوئی فرق نہیں ہوتا ہے ۔
549,m,اخبارات میں شائع مضمون ، کالم اور فیچر عموماً حالات حاضرہ ہوتے ہیں ۔
550,,آسان اور رواں لہجے میں لکھے جاتے ہیں اور عوام کو خبروں میں نہاں معنی کے متعلق سمجھاتے ہیں ۔
551,m,پھر بھی ان میں باریک فرق ہوتا ہے ۔
552,m,مضمون نسبتاً سنجیدہ موضوع پر لکھے جاتے ہیں ۔
553,any,فیچر صحافت کے شعبہ میں ایک نیا طرز ہے ۔
554,any,اس کا تیزی سے فروغ ہو رہا ہے ۔
555,f,پچھلے کچھ برسوں سے اس طرز نے نئی بلندیاں حاصل کی ہیں ۔
556,any,فیچر کو ہندوستانی صحافت میں خاص مقام دلانے کا سہرا ` سنڈے ` ، ` انڈیا ٹوڈے ` اور ` آوٹ لُک ` میگزین کو ہے ۔
557,m,انھوں نے عوامی اہمیت کے متعدد موضوع پر فیچر شائع کر کے متعلقہ موضوع پر عوام کا دھیان کھینچنے کے ساتھ ساتھ حکومت کو کاروائی کرنے پر مجبور کیا ۔
558,any,مضمون اور فیچر میں بڑی یکسانیت ہے ۔
559,,دونوں اطلاعات کو زیادہ واضح کرنے ، واقعات کا تجزیہ کرنے اور ان پر رائے ظاہر کرنے کے لئے لکھے جاتے ہیں ۔
560,m,دونوں عوامی رائے بنانے کا کام کرتے ہیں ۔
561,any,مضمون کبھی فیچر کی صفات اخذ کر لیتا ہے ۔
562,m,کبھی فیچر مضمون سا لگنے لگتا ہے ۔
563,m,فیچر کئی قسم کے ہوتے ہیں جیسے ان مسائل سے جڑے ، آدمی سے متعلق ، افسانوی ، شور شرابے والے ، تصاویری ، تفریحی ، بہادرانہ مہم سے متعلق اور یہ طنزیہ فیچر تفریح کے ساتھ اطلاع فراہم کرتے ہیں ۔
564,,قارئین کے تجسس کو جگاتا ہے اور انھیں مزید پڑھنے کی ترغیب دیتا ہے ۔
565,any,فیچر لکھنے کے لئے مضمون_نگار کے پاس لامحدود تجربہ ، زبان پر مکمل عبور کے ساتھ علم کا خزانہ ہونا لازمی ہے ۔
566,any,فیچر کا اہم مقصد قارئین کو دقیق سے دقیق مسائل سے متعلق جانکاری آسان سے آسان زبان میں نہایت دلچسپ ڈھنگ سے دینا ہے ۔
567,,کبھی - کبھی فیچر لکھتے وقت اس میں ڈرامائیت دی جاتی ہے تو کبھی تفریحی واقعات سے فیچر کی شروعات کی جاتی ہے ۔
568,m,بیشتر فیچر لکھنے میں چھوٹی کہانی کے طرز کا استعمال کیا جاتا ہے ۔
569,m,کبھی - کبھی کسی دلکش مثال سے فیچر شروع کیا جاتا ہے ۔
570,any,فیچر کی خصوصیت اس کا لچیلاپن ، روانی اور دلکش زبان اور نقاشی ہے ۔
571,any,فیچر کی اہمیت اس بات میں ہے کہ وہ اکثر کسی بھی موقع پر شائع کی جا سکتی ہے ۔
572,m,موقع نہیں فیچر کا اپنا خاکہ اسے اہمیت دیتا ہے ۔
573,m,پھر بھی کچھ خاص مواقع پر بھی فیچر کئے جا سکتے ہیں ۔
574,f,دنیا کی پہلی خبر ایجنسی کا قیام ۱۸۳۵ میں چارلس ہواس نے فرانس میں کی تھی ۔
575,f,۱۸۴۵ میں کچھ امریکی اخباروں نے میکسکو جنگ کی خبر حاصل کرنے کے لئے ایک تنظیم بنائی ۔
576,m,یہ تجربہ کیا گیا کہ یہ کام اکیلے کسی اخبار کے بس کا نہیں ہے ۔
577,any,اس مسابقت کو ٹالنے کے لئے ۱۸۶۵ میں ان ایجنسیوں نے مل کر کام کرنے کا ایک سمجھوتہ کر لیا ۔
578,any,۱۸۷۲ میں امریکی خبر ایجنسی نیویارک ایسوسیئیٹیڈ پریس بھی اس سمجھوتہ میں شامل ہو گئی ۔
579,any,ان چار ایجنسیوں نے دنیا کو چار حصوں میں بانٹ لیا ۔
580,any,ہواس ایجنسی کو فرانس ، اٹلی ، ،اسپین ، پرتگال ، سوئٹزرلینڈ اور وسط و جنوبی امریکہ دئے گئے ۔
581,any,رائٹر کو گریٹ برٹین اور پورا برطانوی سامراج دیا گیا ۔
582,m,رائٹر اور ہواس کو کچھ علاقہ مشترکہ طور سے دیا گیا ۔
583,f,برطانوی خبررساں ایجنسی رائٹر ۱۸۵۸ میں عمل میں آئی ۔
584,any,وجود میں آنے کے کچھ ہی وقت کے بعد یہ ہندوستان میں اخبار دینے والی اہم ایجنسی بن گئی ۔
585,any,۱۸۶۰ میں ` بامبے ٹائمز ` نے ڈاکر سے رائٹر کی خبریں حاصل کرنا شروع کر دیا تھا ۔
586,m,پہلا ہندوستانی اخبار جس نے رائٹر سے تار خدمات لینا شروع کی ` بنگالی ` تھا ۔
587,any,یہ بات ۱۹۰۰ کی ہے ۔
588,,لہٰذا ملکی باشندوں کو مستقل مصدقہ اور صحیح خبر دینے کے لئے ۱۹۱۰ میں ایسوسیئیٹیڈ پریس آف انڈیا کا قیام کیا گیا ۔
589,m,یہ خبر ایجنسی شروع کرنے کا مکمل سہرا تجربہ_کار اور سینئر صحافی کے_سی_رائے کو جاتا ہے ۔
590,any,رائٹر نے ایک نئی کمپنی ایسٹرن نیوز ایجنسی بنا کر ۱۹۱۵ میں اس پر قبضہ کر لیا ۔
591,m,ایسوسیئیٹیڈ پریس آف انڈیا کا یہ انتظام متعدد قوم_پرستوں کو پسند نہیں آیا ۔
592,m,ان کا مستحکم خیال تھا کہ برطانوی ماتحتی میں کام کرنے والی اس قسم کی ایجنسی ہندستانیوں کی خواہشات ، آرزوں کو کبھی ظاہر نہیں کر سکتی ۔
593,m,اسی سال پہلی ستمبر کو کلکتہ کے کچھ اخبارات کی مشترکہ کوششوں سے ایک نئی ایجنسی یونائیٹیڈ پریس آف انڈیا کا قیام کیا گیا ۔
594,m,ایسوسیئیٹیڈ پریس آف انڈیا کی سخت مسابقت کے باوجود اس ایجنسی نے دنیا بھر کی متعدد خبر ایجنسیوں کے ساتھ تعاون سمجھوتے کئے ۔
595,m,آزادی کے حصول کے وقت رائٹر خبر ایجنسی اور اس کی معاون ایسوسیئیٹیڈ پریس آف انڈیا خبر ایجنسی کا ملک میں خبروں کی تقسیم پر غلبہ تھا ۔
596,m,غیرملکی اخباروں پر رائٹر کا قبضہ تھا ۔
597,f,پریس ٹرسٹ کی تشکیل سماچار ٹرسٹ کے روپ میں کی گئی ۔
598,any,سُپرن_ورما کی فلم ` آتما ` بیٹی ماں اور باپ کا ہارر ٹراینگل ہے ۔
599,m,دو برس پہلے ممبئی پر ہوئے دہشت_گردانہ حملے کے پس_منظر پر رام_گوپال ورما لے کر آئے ہیں ` دی اٹیکس آف 26 / 11 ` ۔
600,any,ان کے مطابق ، ممبئی پر حملے کی یادیں آج بھی دل دہلا دیتی ہیں ۔
601,m,این_ایس_جی کمانڈو اور ممبئی پولس کی چوکسی کے چلتے گنہگاروں کو پکڑا گیا تھا ۔
602,,میں نے فلم کے ذریعہ بس یہ دکھانے کی کوشش کی ہے کہ اس حادثے کو کیسے انجام دیا گیا ۔
603,f,ممبئی پولس_کمشنر راکیش موریا اور متاثرین پر کیا بیتی ۔
604,f,ہم نے سی_ایس_ٹی کولابا واقع لیوپولڈ کیفے پر ہوئے حملوں کو مرکز میں رکھ کر فلم بنائی ہے ۔
605,f,ان لوکیشن پر جا کر ہم نے شوٹنگ بھی کی ۔
606,m,تاج ہوٹل کو دکھانے کے لئے ہم نے سیٹ ڈیزائن کیا ۔
607,,ممبئی کے اس وقت کے کمشنر راکیش موریا کی اداکاری میں دکھیں گے ناناپاٹیکر ۔
608,m,انھوں نے بتایا کہ راکیش موریا کو مرکز میں رکھ کر فلم بنی ہے لیکن یہ بایوپک نہیں ہے ۔
609,any,فلم ممبئی کو منسوب ہے ۔
610,,یہ نہ ناظرین کو رُلائے گی نہ ہنسائے گی بلکہ سوچنے پر مجبور کرے گی کہ حملہ_آور کس دنیا کے انسان ہیں ؟
611,any,وہ کیسے درندے بن جاتے ہیں ۔
612,any,پچھلے چار دہائیوں سے بگ_بی یعنی امیتابھ بچن ناظرین کے دلوں پر حکومت کر رہے ہیں ۔
613,any,زنجیر ( 1973 ) کا اینگری_ینگ_مین ہو یا شعلے ( 1975 ) کا بہادر جے ، مقدر کا سکندر ( 1978 ) کا دمدار سکندر ہو یا سلسلہ ( 1981 ) کا اموشنل عاشق ، کالیا ( 1981 ) کا کلّوڈان ہو یا نمک_حلال ( 1982 ) کا کامیڈِن ، دیوار ( 1975 ) کا وجےورما ہو یا ڈان ( 1978 ) کا وجے ، امیتابھ_بچن کی شروعاتی فلموں کو بھلا کون بھول سکتا ہے ۔
614,m,جتنی مقبولیت ان کی فلموں کو ملتی تھی لوگوں کا اتنا ہی پیار ان فلموں کے پوسٹروں اور گانوں کو بھی ملتا تھا ۔
615,m,فلم پوسٹروں پر امیتابھ_بچن کے ڈانس ، ماردھاڑ یا رومانس کا انداز لوگوں کو بےوجہ کھینچتا تھا ۔
616,,ان کے فینس فلمی پوسٹر کو اکھاڑنے اور انھیں اپنے گھر لے جانے کے پھیر میں بھی لگے رہتے تھے ۔
617,m,گانوں سے لے کر ان کی فلموں کے ڈائلاگ تک لوگوں کی زبان پر ہوتے تھے ۔
618,any,اینگری ینگ_مین کے دور والی امیتابھ بچن کی فلموں کی وہ مقبولیت آج بھی قائم ہے ۔
619,m,ان کی اسی مقبولیت کو دیکھتے ہوئے ان کی کچھ خاص فلموں کے پوسٹر اور لابی_آرٹ اور ایل_پی ریکارڈس کی آن_لائن فروخت کا انعقاد کیا گیا ہے ۔
620,any,چار پانچ سال پہلے تک دہلی اور ممبئی کے سیکنڈہینڈ مارکیٹ میں ایسی چیزیں آسانی سے مل جاتی تھیں ۔
621,,لیکن بڑھتی مانگ کے سبب یہ اب بازار سے غائب ہونے لگی ہیں اور ان کو یکجا کرنا اب مشکل کام ہے ۔
622,,حالانکہ فلمی یادگار اشیاء کا ٹرینڈ اپنے ملک میں نیا ہی ہے ۔
623,,ویسے غیرملکوں میں تو یہ چلن اسٹیٹس کے نام سے جانا جاتا ہے اور ایل_پی ریکارڈرس یعنی لانگ پلئینگ رکارڈس فلموں کے گانے اور ڈائلاگس سننے کے لئے استعمال کئے جاتے تھے ۔
624,m,آج بھی چھوٹے شہروں میں لابی کارڈس کا ہی انتظام ہوتا ہے ۔
625,any,یہ الگ بات ہے کہ ایل_پی ریکارڈس کی جگہ کیسیٹ ، سی_ڈی ، پین_ڈرائیو اور متعدد کمپیوٹرائزڈ آلات نے لے لی ہے ۔
626,f,اپنے یہاں بھی اب فلم سے جڑی یادگار اشیاء کے ذخیرے میں لوگوں کی دلچسپی پچھلی دہائی میں بڑھی ہے ۔
627,any,ایسے ہی لوگوں کے لئے ہے بگ_بی کے پوسٹر اور لابی_آرٹ کی آن_لائن سیل ۔
628,f,ڈریم_آن_لائن کی ڈائریکٹر رموناسنگھ جو سیلیبریٹی آئٹمس اور فلمی میموریبل پروڈکٹس کی آن_لائن سیل کرتی ہیں ۔
629,m,انھوں نے بتایا کہ امیتابھ_بچن سے جڑی ایسی سیل کا ہٹ ہونا طے ہے ۔
630,any,غور طلب ہے کہ امتیابھ_بچّن کے ۶۰ ویں سالگرہ کے موقع پر رمونا نے بھی ایک ایسی ہی سیل لگائی تھی ۔
631,,حالانکہ وہ بھی اس بات سے متفق ہیں کہ ایسی اشیاء کو یکجا کرنا اب اتنا آسان نہیں رہا ۔
632,m,انھوں نے بتایا کہ پہلے پرانی دہلی اور ممبئی میں ایسے پوسٹر آسانی سے مل جاتے تھے اب ماحول ویسا نہیں ہے ۔
633,m,خصوصاً شعلے ، دیوار وغیرہ فلموں کے پوسٹر مشکل سے ہی ملتے ہیں ۔
634,m,اس کے متعلق یامنی نے بتایا کہ ایسی آن_لائن فلم سیل کے لئے امتیابھ بچّن سے بہتر فی_الحال اور کچھ نظر نہیں آتا ۔
635,any,ملک کے علاوہ غیرممالک میں بھی ان کی مقبولیت بےمثال ہے ۔
636,any,یہی وجہ ہے کہ این_آر_آئی ایسی اشیاء کے سب سے بڑے خریدار ہیں ۔
637,f,اس کلیکشن کی قیمت کچھ ہزار سے شروع ہوتی ہے ۔
638,any,سب سے مہنگا آئٹم ` شعلے ` کا یاک پوسٹر ہے جس کے لئے قیمت ۹۸۰۰ روپئے رکھی گئی ہے ۔
639,any,ایک اور دمدار آئٹم ہے فلم ` کالیا ` کا ایل_پی جس میں گانوں کے ساتھ ساتھ فلم کے دمدار مکالمے بھی ہیں ۔
640,,ایسے تمام آئٹمس اس سیل میں رکھے گئے ہیں جن پر ویب_سائٹ کے ` دی_اسٹوری ` حصّے کے ` بالی_ووڈ بگ_بی ` کے تحت نظر ڈالی جا سکتی ہے ۔
641,any,یہ آن_لائن سیل سائٹ پر ۱۱ مارچ کو ختم ہو رہی ہے ۔
642,,جیکی بھگنانی کی لانچنگ تو بہت بڑھیا طریقے سے ہوئی تھی لیکن اتنی ہی تیزی سے وہ گمنامی میں بھی کھوتے چلے گئے ۔
643,,مشہور پروڈیوسر واشو بھگنانی کے بیٹے جلد ہی فلم ` رنگریز ` میں دکھیں گے ۔
644,,اور اس فلم کے لئے انھوں نے چرچا میں آنے کا بہت بہتر طریقہ کھوجا ہے ۔
645,,جیکی نے یوٹیوب پر مشہور ہوئے پاپ سانگ گنگنم اسٹائل کے رائٹس خرید لئے ہیں اور اسے اپنی آنے والی فلم کے لئے شوٹ بھی کر ڈالا ہے ۔
646,any,جیکی کا کہنا ہے کہ یہ ان کے والد واشو کو ان کی جانب سے تحفہ ہے ۔
647,any,دیکھنا ہے کہ یہ تحفہ رنگریز کو ہٹ کرانے میں کام آتا ہے یا انھیں اپنے والد کو متاثر کرنے کا کوئی اور طریقہ تلاش کرنا ہوگا ۔
648,any,کچھ اتا پتا معلوم ہے تیرے کو ؟
649,,کچھ نہیں ، اور اندھیرے میں ان کا تھوبڑا تک نہیں دکھا اور آجکل گلی میں نوراتری کا ڈانڈیا چل رہا ہے ، اسے بھیڑ میں پہچاننا بھی مشکل ہے ۔
650,any,تم میں سے مکٹ بہاری کون ہے ؟
651,,مکٹ بہاری ! چپ _ چاپ یہاں سے اپنا راشنکارڈ ٹرانسفر کروا لے اور صبح کے بعد یہاں نظر مت آنا ۔
652,,تار آیا ہے ، منا بھیّا جلدی گھر آ جاؤ ، بہت بڑی مصیبت آ پڑی ہے ۔
653,,ساری دوکانیں لٹ گئی اور آج تک ہماری پولس فورس کو یہ پتہ نہیں چلا کہ وہ لوگ کون تھے ؟
654,,صرف اتنا پتہ ہے کہ لوٹیا نام کے خطرناک مجرم کی گینگ تھی ، جس کی تلاش پولس کو پہلے سے ہے ، مگر وہ موہنی کو کہاں لے کر گیا ہے اس کا پتہ تک نہیں چل سکا ۔
655,,وہاں سے جو موٹرسائکلیں برآمد ہوئی تھیں ان کے مالکوں کا کچھ پتہ چلا ؟
656,f,سر ! وہ سب چوری کی ہوئی موٹر سائکلیں تھیں ۔
657,any,سر وائرلس پر ایک پیغام ملا ہے کہ ایک شہربدر اپنے علاقے میں داخل ہوا ہے ۔
658,any,کون ہے وہ ؟
659,any,منا نام ہے اس کا ۔
660,f,آج سے سال پہلے اس علاقے سے اسے شہربدر کا حکم ہوا تھا ۔
661,f,یہ رہی اس کی فائل ۔
662,,یہ تو مہیش دیشمکھ ہے ، منا کیسے ہو گیا ؟
663,,سر ! وہ اس علاقے میں منا کے نام سے جانا جاتا ہے ، اس سے پہلے خون کے جرم میں ایک سال کی سزا کاٹ چکا ہے ۔
664,,فائل کہتی ہے کہ یہ خطرناک مجرم ہے ، مگر میری یادداشت کہتی ہے کہ یہ معصوم ، جذباتی مگر جوشیلا نوجوان تھا جو اپنے ملک کے لئے مر مٹنے کو تیار تھا ۔
665,m,آپ اسے جانتے ہیں سر ؟
666,m,جانتا تھا دو سال پہلے میری پوسٹنگ ناسک میں تھی ۔
667,m,میرے تھانے کے سامنے سنسان گلی میں ایک بینک تھا ، جس میں اس کے ماں _ باپ دونوں نوکری کرتے تھے ۔
668,any,مجھے وہ دن ابھی تک یاد ہے جس دن میں مہیش سے پہلی بار ملا تھا ۔
669,m,بابو جی ! بابو جی ! میں نے آپ سے کہا تھا نہ کہ میں بیسٹ نیوی کیڈٹ کا کپ جیت کر دکھاؤں گا ، دیکھئے ۔
670,,بیسٹ نیوی کیڈٹ کا کپ ؟
671,,ہاں ماں ! بیسٹ نیوی کیڈٹ کپ ، آئی ہیو ڈن اٹ ڈیڈ ، آئی ہیو ڈن اٹ ۔
672,f,دیشمکھ صاحب ! اب تو مٹھائی کھلانی پڑے گی ، آپ کی تمنا آپ کے بیٹے نے پوری کر دی ہے ۔
673,,ہاں ، میری تمنا تو پوری ہوئی ، اب مہیش کا خواب بھی تو پورا ہونے دیجئے ۔
674,m,کیا بننا چاہتے ہو مہیش ؟
675,,میں نودل میں شامل ہونا چاہتا ہوں سر ، ایڈمرل بننا چاہتا ہوں ۔
676,,اچھا ، دیٹس ویری گڈ ۔
677,,بچپن سے ہی نہ جانے اس کے دماغ میں کیا گھس گیا ہے ، دیش کے لئے مر مٹنے کی باتیں کرتا رہتا ہے ۔
678,any,ضرور پچھلے جنم میں حب_الوطن رہا ہوگا ، جو ملک کی آزادی کے لئے شہید ہو گیا ۔
679,,اچھا ماں میں چلتا ہوں ، شام کو گھر پر ملینگے ، اچھا ۔
680,,دیکھو ، میں بیس سال سے اس بینک کا نمک کھا رہا ہوں اور ان کے پیسوں کی حفاظت کرنا میرا فرض ہے ۔
681,,فرض کے ليے مجھے اگر جان بھی دینی پڑی تو مجھے اس کی فکر نہیں ۔
682,,وہ عورت بینک کے اندر جا رہی ہے سر ! ان کی جان کو خطرہ ہو سکتا ہے سر ۔
683,,تم ایسا کرو یہاں سے چلے جاوء ، راستے میں اگر پولس ملے تو میرے پاس بھیج دینا ۔
684,,سر ! میری ماں اور بابو جی اندر پھنسے ہوئے ہیں اور میں یہاں سے چلا جاؤں ۔
685,,دیکھو ان لوگوں کے پاس بندوقیں ہیں ، کبھی بھی گولی چل سکتی ہے اور تمھاری جان کو خطرہ ہو سکتا ہے ، سمجھے ۔
686,,کیا برائیوں اور گناہوں کے خلاف لڑنے اور جان دینے کا حق صرف آپ وردی والوں کو ہے ، ہم لوگوں کو نہیں ؟
687,,کیوں سر ؟
688,any,ویسے میں نے اپنی جان ملک کے نام اسی دن لکھ دی تھی سر جس دن میں نے یہ وردی پہنی تھی ۔
689,any,سر ! اس عورت اور بچی کو بینک کے اندر جانے سے روکنا بہت ضروری ہے سر ۔
690,,آپ کی وردی دیکھ کر ڈاکو گولی چلا سکتے ہیں ، میں جا کر عورت کو واپس لے آتا ہوں سر ۔
691,,پلیز گو می آرڈر سر ! آپ مجھے حکم دیجئے ، پلیز سر ۔
692,,مہیش کی سب سے خوشی کا دن منٹوں میں سب سے دکھی دنوں میں بدل گیا تھا ، زندگی کو اس سے بڑا مذاق کرتے میں نے نہیں دیکھا تھا ۔
693,,کچھ دنوں میں مہیش اپنی بہن کو لے کر ممبئ چلا گیا تھا ، مگر اس دن کے بعد محسوس ہونے لگا کہ میرے درد کو سہنے کی طاقت بڑھ گئ ہے ۔
694,,خیر ، شہر کا کونا کونا چھان مارو اور باہر جانے والے راستے بند کر دو ، اس آدمی کا پکڑا جانا میرے لیے بہت ضروری ہے ۔
695,,کیونکہ میں یہ جاننا چاہتا ہوں کہ یہ مہیش سے منا کیسے بن گیا ؟
696,,جیوتی ! ابھی ایک سال پورے ہونے میں چار دن باقی ہیں ، ابھی تک شہربدر کا سکہ میرے ماتھے پر لگا ہوا ہے ۔
697,,پولس میرے پیچھے کتے کے موافق پڑی ہوئی ہے اور تم جانتی ہو جب تک میں سزا کاٹ نہیں لیتا ، میں بمبئ واپس نہیں آ سکتا ۔
698,any,بتاؤ کس کے لئے بلایا مجھے ؟
699,any,کسی بھی انتخابی علاقہ کی صحیح تصویر جاننے کے لئے سب سے پہلے تو ذات ، مذہب ، پارٹی کے تعصبات سے دور رہنا ضروری ہے ۔
700,,نامہ_نگار کا کام کسی ذات ، مذہب یا پارٹی کے امیدوار کو نہ کامیاب کرنا ہے ، نہ ناکام کرنا ہے ۔
701,,کوئی امیدوار کسی اخبار کے جتانے سے نہ جیتتا ہے ، نہ ہارتا ہے ۔
702,m,وہ اخبار کے رول کو اس معاملے میں بہت پیچیدہ وجوہات سے لیتا ہے ۔
703,,اسلئے ایک نامہ_نگار کو یہ بھرم نہیں ہونا چاہیئے کہ اس کی ایک یا دو رپورٹ کسی پارٹی کے امیدوار کی قسمت کا فیصلہ کر سکتی ہے ۔
704,,اسلئے جب نامہ_نگار کسی انتخابی حلقہ میں جائیں تو اپنے سارے تعصبات یا بدگمانی ایک طرف رکھ کر جائیں ۔
705,m,دوسرا بھرم ذاتی مساوات کی بنیاد پر کھڑا ہوتا ہے ۔
706,any,مان لیجئے ایک انتخابی حلقہ میں کئی سیاسی پارٹیوں کے امیدوار اہم طور سے میدان میں ہیں ۔
707,m,اب آپ جس امیدوار یا اس کے حامی کے پاس جائینگے تو وہ ذاتی جوڑ - توڑ ، جوڑ - بقایا لگا کر بتائےگا کہ ماحول اس کی حمایت میں ہے ۔
708,,لیکن سب سے زیادہ ذات - پات بہار میں ہے اور یہ لازمی نہیں ہے کہ کوئی امیدوار ذات کی بنیاد پر جیتے ۔
709,,کچھ رائےدہندگان کسی خاص پارٹی کے تئیں ایماندار ہوتے ہیں ، کچھ رائےدہندگان اپنی ذات کے امیداوار سے ناراض ہوتے ہیں ، کچھ علاقہ کی اندیکھی کے سبب کسی خاص امیدوار کو حمایت دینا یا نہیں دینا چاہتے ہیں ۔
710,any,کئی مرتبہ کسی امیدوار کا کوئی تبصرہ یا اس کا عوامی سلوک رکاوٹ یا وسیلہ بن جاتا ہے ۔
711,f,اسلئے نسلی مساوات کی بنیاد پر کسی بھی امیدوار کی جیت یا ہار طے نہیں ہوتی ۔
712,f,عموماً نسل تمام عادلانہ عناصر میں سے ایک ہوتی ہے ۔
713,any,اسلئے انتخابات کو اپنے عینک سے نہ دیکھیں ۔
714,any,اہم یہ ہے کہ اسے دوسرے کے عینک سے دیکھیں ۔
715,any,آپ اس سچائی کو بدل نہیں سکتے ۔
716,any,اسلئے اپنی رپورٹ میں اس سچائی کو ظاہر کریں ۔
717,any,یہ سچائی آپ تبھی ظاہر کر پائینگے جب آپ اسے دیکھ سکینگے ۔
718,m,اسے دیکھ سکینگے ، جب آپ پارٹی بندی ، ذات _ بندی ، انفرادی ، فرقہ _ وارانہ تعصبات سے دور ہونگے ۔
719,m,جب آپ لالچ یا دھمکی یا بہکاوے سے دور ہونگے ۔
720,,آپ انتخابی میدان میں استعمال ہونے نہیں ، حقائق کا مدلل ڈھنگ سے استعمال کرنے کے لئے جاتے ہیں ۔
721,,اپنی آنکھیں اور دماغ بند کرنے نہیں ، کھولنے جاتے ہیں ۔
722,,اپنے تخیلات اور خوابوں کی تعبیر کرنے نہیں ، حقائق اور سچائیوں کا سامنا کرنے جاتے ہیں ۔
723,m,اسلئے رائےدہندہ کے روپ میں آپ اپنے فیصلے کو انتخابی رپورٹ لکھنے پر حاوی نہ ہونے دیں ۔
724,any,اپنے دونوں رول کو الگ - الگ دیکھیں ۔
725,,ایک کا رول دوسرے پر دوسرے کا رول پہلے پر نہ لادیں ۔
726,any,پھر وہ کہنا شاید لازمی ہے کہ رپورٹ میں فیصلے نہ دیں ۔
727,,رپورٹ ، رپورٹ ہوتی ہے فیصلہ نہیں ۔
728,,لیکن اس کا یہ مطلب نہیں کہ آپ حقائق کو مدلل و پراعتماد طور سے نہ رکھیں اور انتخابات کی ایک مکمل تصویر نہ دیں ۔
729,any,ہر اہم امیدوار کے انتخابی دفتر میں جائیں ۔
