,gender,sentences
1058,,اور ویسے بھی ، ان لڑکیوں کے ساتھ تو میں صرف ٹائم_پاس کرتا ہوں کیونکہ ابھی تک وہ نہیں ملی نا ۔
1059,,کیا ہے کہ ابھی تک ایسی لڑکی نہیں ملی جسے دیکھ کر کچھ ہونے لگتا ہے ۔
1060,,جب وہ چلے تو سب دیکھتے رہ جائیں ، جب وہ رکے تو وقت رک جائے ۔
1061,,وہ ملیگی تو کیا کروگے ؟
1062,any,اس کے سامنے جھک کے ، اپنی باہیں پھیلا کے کہوں گا کہ اے ! تم جو بھی ہو ، آئی لو یو ۔
1063,any,اسلیے ٹینا ، تمھارا فرسٹ ڈے ہے آج کالج میں ؟
1064,m,کیسا لگا آج یہاں کالج میں فرسٹ ڈے ؟
1065,,کیوں ؟
1066,m,کچھ ۔ کچھ ہوا ؟ نا ،
1067,any,میرے ٹائپ کی نہیں ہے ۔
1068,,ہندوستانی نہیں ہے نا ، لندن میں پلی بڑھی ہوئی ہے اور یہ لندن والیاں کچھ عجیب سی ہوتی ہیں ۔
1069,f,دیکھو ، لڑکی تو وہ ہوتی ہے ، جسے گھر میں اپنی ماں کے پاس لے جایا جا سکے ۔
1070,m,ایسے تو تمھیں کوئی نہیں ملنے والا ہے ، سمجھے !
1071,,اگر کوئی اور نہیں ملی نا ، تو میں تم سے شادی کر لونگا ۔
1072,any,ویسے بھی تم سے تو کوئی شادی کرنے والا ہے نہیں ۔
1073,any,ہمارے کالج کا ایک رول ہے ، ہم ہر ایک نئے طالبعلم کو گواتے ہیں ۔
1074,any,راہول ! یہ پرنسپل صاحب کی بیٹی ہے ۔
1075,,تو کیا ہوا ، ہم اپنا رول کسی کے لئے نہیں توڑ سکتے ۔
1076,any,دیکھو ، تم ہمارے لئے اور اس سارے کالج کے لئے ہندی میں ایک گانا گاؤ ۔
1077,,کیوں ؟
1078,any,لندن جا کر ہندی بھول گئی ہو کیا ؟
1079,any,راہول ! یہ ہندی میں گانا کیسے گا سکتی ہے ؟
1080,f,لندن میں رہنے سے ، وہاں پڑھنے لکھنے سے ، میں اپنی تہذیب نہیں بھولی ۔
1081,m,آج ہم کچھ نیا شروع کرنے والے ہیں ۔
1082,,لیکن شروع کرنے سے پہلے میں تم سب سے کچھ پوچھنا چاہتی ہوں ، کہ تم سب پیار کے بارے میں کیا جانتے ہو ؟
1083,any,پیار دوستی ہے ۔
1084,,اگر وہ میری سب سے اچھی دوست نہیں بن سکتی ، تو میں اس سے کبھی پیار کر ہی نہیں سکتا ۔
1085,m,کیونکہ دوستی ، بنا تو پیار ہوتا ہی نہیں ۔
1086,m,کل کے کالج کمپٹیشن میں ہمارا کالج بیسٹ ہوگا ، ملہوترہ ۔
1087,m,دوسرے کالج کے اسٹوڈنٹ دیکھتے ہی رہ جائینگے ۔
1088,f,انجلی ! راہول کو تم کب سے جانتی ہو ؟
1089,any,راہول تمھارا سب سے اچھا دوست ہے نا ؟
1090,f,تم اس سے پیار نہیں کرتی ؟
1091,m,میرے ڈیڈ کہا کرتے تھے ، مرد کا سر صرف تین عورتوں کے سامنے جھکتا ہے ۔
1092,,اپنی ماں کے سامنے ، ایک دُرگا ماں کے سامنے اور ۔۔۔ ۔
1093,,راہول تم یہاں اس وقت ؟
1094,any,ان میں ' وگیان پرگتی ' اور ' آوشکار ' اہم ہیں ۔
1095,f,` وگیان پرگتی ` کی لگ_بھگ ایک لاکھ کاپیاں شائع کی جاتی ہیں ۔
1096,any,ان دونوں رسائل کی ڈیزائن ، طباعت کا اعلیٰ میعار ہے ۔
1097,f,بیشتر ہندی روزنامہ اور اخبار و رسائل وقت وقت پر سائنسی اشیا شائع کرتی ہیں ۔
1098,m,ہندی کے کچھ رسائل سائنس ، زراعت ، مویشیی پروری ، ماحولیات اور جنگلات پر مستقل کالم بھی شائع کرتے ہیں ۔
1099,m,متعدد ہندی روزنامہ اخبار اپنے ہفتہ_وار ایڈیشن میں سائنس پر دلچسپ مواد دیتے ہیں ۔
1100,m,اس جانب ` نوبھارت ٹائمز ` اور ` ہندوستان ` نے قابل ذکر کام کیا ہے ۔
1101,,کرکٹ میچ کا آنکھوں دیکھا حال سنانے میں ہندی کھیل مبصرین کے سامنے ترجمہ ، لفظیات اور محاوروں وغیرہ کے متعدد مسائل آئے ۔
1102,,لیکن انھوں نے تجربہ اور ` غلطی کرو اور اس سے سیکھو ` طریقہ کا استعمال کرتے ہوئے ان مشکلات پر فتح حاصل کی ۔
1103,m,اب تو ہندی میں نہ صرف کرکٹ کا ، بلکہ لگ_بھگ سبھی کھیلوں کا اتنا اچھا حال سناتے ہیں کہ کچھ کھیل صحافی اسے سن کر کھیل کی رپورٹنگ کر دیتے ہیں ۔
1104,,ہندی میں کھیل سے متعلق کچھ رسائل نکلے ۔
1105,,لیکن ان سبھی کی اشاعت کچھ وقت بعد بند ہو گئی ۔
1106,any,ان میں ` کھیل بھارتی ` کا نام قابل ذکر ہے ۔
1107,f,` کھیل بھارتی ` کے علاوہ کچھ وقت تک ` اسپورٹس ویک ` نے ` کھیل یگ ` کی بھی اشاعت کی ۔
1108,m,` کرکٹ سمراٹ ` نامی رسالہ بھی کچھ وقت اچھا چلا ۔
1109,m,اس وقت ` کھیل کھلاڑی ` کے علاوہ ہندی میں شاید ہی کوئی دیگر کھیل رسالہ نکلتا ہو ۔
1110,any,خواتین میں بیداری لانے اور انھیں جدوجہد آزادی میں شامل کرنے کا سہرا گاندھی جی کو ہے ۔
1111,m,گاندھی جی پہلے لیڈر تھے جو خواتین اور مردوں کے درمیان کسی قسم کی تفریق یا امتیاز قبول کرنے کو تیار نہیں تھے ۔
1112,f,انھوں نے سبھی مرد و عورت کو جدوجہد آزادی اور تخلیقی امور میں شامل ہونے کی اپیل کی ۔
1113,m,صحافی پیشے میں خواتین کی آمد کا اعلان کرنے والا اور سماجی بیداری پھیلانے والا ہندی کا پہلا رسالہ ` بال بودھنی ` تھا ۔
1114,m,اس کی اشاعت بھارتیندو ہریش چند نے پہلی جنوری ۱۸۷۴ کو کیا تھا ۔
1115,f,"اس کے پہلے شمارے کے پہلے صفحے پر یہ گذارش شائع ہوئی تھی , ' میری پیاری بہنو ، میں تمھاری نئی بہن ، ` بال بودھنی ` آج تم لوگوں سے ملنے آئی ہوں اور میری یہ خواہش ہے کہ تم لوگوں سے ہر ماہ ایک بار ملوں ' ۔"
1116,m,بیسویں صدی کی دوسری دہائی کے آغاز میں سدرشن آچاریہ نے الہ_آباد سے ` گرہ لکشمی ` رسالہ شائع کیا ۔
1117,f,اسی برس بنارس سے بابو راو وشنو پراڈکر اور شانتی پریہ دیویدی کی ادارت میں خواتین کے لیے مفید رسالہ ` کملا ` کی اشاعت شروع ہوئی ۔
1118,m,یہ اپنے وقت کا سب سے عمدہ خواتین افادیت رسالہ تھا ۔
1119,f,اسی وقت گووِند شاستری دگویکر نے بنارس سے ` گرہستھ ` رسالے کی اشاعت شروع کی ۔
1120,,آزادی کے بعد خواتین کے رسائل کا اور فروغ ہوا ۔
1121,f,بینیٹ کولمین کمپنی ( ٹائمز آف انڈیا ) گروپ نے انگریزی میں ` فمینا ` نکال کر اس کی شروعات کی ۔
1122,,پچھلی چار دہائیوں کے دوران ` فیمینا ` کی طرز پر ہندی میں ` واما ` نکالنے کی بھی کوشش کی گئی لیکن وہ کامیاب نہیں ہوئی ۔
1123,f,` فیمینا ` کی طرز پر انگریزی میں ` سیوا ` بھی نکلتی ہے ۔
1124,m,انگریزی کی خواتین صحافیوں کے طرز پر الہ_آباد کے دوست پرکاشن نے ` منورما ` کی اشاعت شروع کیا ۔
1125,f,اسی طرح دلی پریس نے ` گرہ شوبھا ` کی اشاعت شروع کی ۔
1126,any,ادھر خاندانی جھگڑے کے سبب ` منورما ` کی اشاعت بند ہے ۔
1127,f,ادھر ہیمامالنی کی ادارت میں `` میری سہیلی `` اشاعت شروع ہوئی ہے ۔
1128,m,متعدد خواتین تنظیمیں اپنا رسالہ نکالتے ہیں ۔
1129,any,مدھوکشور کی ادارت میں ` مانوشی ` نکل رہی ہے ۔
1130,any,بھوپال سے ` انوسوئیا ` کی اشاعت ہو رہی ہے ۔
1131,f,مہیلا دکشتا سمیتی ` جننی ` نام سے ایک رسالہ نکالتی ہے ۔
1132,,اوشا رائے نے خواتین کے مسائل اور تعلیم ، صحت اور ماحولیات سے جڑے موضوعات پر بڑے اچھے ڈھنگ سے روشنی ڈالی ہے ۔
1133,any,شہناز انکلی سریا سلامتی سے متعلق معاملوں کی ماہر ہیں ۔
1134,f,تولین سنگھ ہمعصر سیاست کا بہترین تجزیہ کرتی ہیں ۔
1135,f,مرنال پانڈے متعدد اخبارات و رسائل کی ادارت کے روپ میں نسائی معاملات ، مرد و عورت غیرہمواریت اور خواتین کی پسماندگی پر ہندی اور انگریزی میں برابر لکھتی رہی ہیں ۔
1136,any,کومی کپور ` انڈین ایکسپریس ` کی مقامی مدیر ہیں ۔
1137,any,این_ڈی_ٹی_وی کی برکھادت نے تو جوکھم_بھری جگہوں میں جاکر یہ ثابت کر دیا ہے کہ اب خواتین کسی شعبہ میں پیچھے نہیں ہیں ۔
1138,f,ہندی فلمی رسالے کی شروعات عجب ڈھنگ سے ہوئی ۔
1139,f,شروع میں ہرایک فلم کے بارے میں دو چار صفحہ کی ایک کتاب شائع کی جاتی تھی ۔
1140,m,اس میں فلم کے اداکار و اداکارائیں کے ناموں کے ساتھ فلم کی کہانی کی تلخیص اور فلم کے سبھی گانے ہوتے تھے ۔
1141,,فلم سے متعلق اس شور شرابے اور بھوک نے دہلی میں فلم رسائل کو جنم دیا ۔
1142,f,"دہلی ۱۹۳۲ میں لیکھرام کی ادارت میں ہفتہ_وار "" رنگ_بھومی "" کی اشاعت شروع ہوئی ۔"
1143,f,اس کی قیمت دو پیسہ تھی ۔
1144,m,سنا ہے کہ بہو کے والد کالج میں پروفیسر ہیں تو پھر لین_دین کی کیا بات ہوئی ہوگی ؟
1145,,عمر بھر ان کی طرح پروفیسری کرتے رہے ہونگے ، جوڑنے کا تو موقع ہی نہیں ملا ہوگا ۔
1146,,ایسا مت کہو خدا ، وہ اچھے خاصے خاندانی رئیس ہیں ۔
1147,,اگر میری سویٹی آتی تو اتنا لاتی اتنا لاتی کہ تجوری میں رکھتے رکھتے تھک جاتے ، لاکھوں کا ہے یہ میرا راجیش ۔
1148,any,ارے راجیش ! یہاں آؤ یار یہ جو تمھارے سسر جی ہیں نہ ، بڑے دلچسپ انسان ہیں ۔
1149,,آپ کو بجانا وجانا بھی نہیں آتا ہے ، صرف پوز لے کر کھڑے ہیں ۔
1150,,لوگ کہتے ہیں بڑا اچھا بجا لیتے ہیں ، باقی آپ سنئے گا ، فیصلہ کیجئے گا ۔
1151,,بھیّا جی ! بھیّا جی ! آپ کو اور بی_بی جی کو نیچے بلایا ہے ، بڑے بھیّا کا تلک ہونے جا رہا ہے ۔
1152,any,بات ان دنوں کی ہے ڈاکٹر صاحب ! جب ہم تینوں ساتھ میں پڑھا کرتے تھے ۔
1153,,ان کے کاکا ، ہم اور ہماری محترمہ ۔
1154,,ویسے تو ان کی مسکراہٹ کا آج بھی جواب نہیں لیکن ، اس زمانے میں ہر کوئی ان کی ایک جھلک کا دیوانہ تھا ۔
1155,,اگر یہیں پر سب دکھا دینگی تو شادی میں کیا خاطر کرینگی ؟
1156,m,جی ، ہمارے یہاں کی خاطر تو جب آپ آئینگے تب پتہ چلیگا ۔
1157,m,آپ تو آئینگے ہی ؟
1158,,اجی آئینگے کیوں نہیں اور جب ہم آئینگے تو آتش_بازیاں ہونگی ۔
1159,,بھیّا ! اگر آپ ہمارا کام کرینگے تو ہم اپنی امّی جی سے یعنی کہ آپ کی خالہ سے کہینگے کہ وہ آپ کے لئے ایک خوبصورت سی دلھن چن کر لائیں ۔
1160,,باجی وہاں بیٹھیں گی امّی ، یہ سیٹ تو ان کے بھائی ۔ برادروں کے لئے ہے ۔
1161,m,ذرا انھیں پتہ تو چلے ہمارے یہاں کی خاطرداری کیسی ہے ؟
1162,,بھولا پرساد جی ہندی ادب میں کالیداس کی شکنتلا پر ریسرچ کر رہے ہیں ، ویسے انھیں اپنی شکنتلا کی بھی تلاش ہے ۔
1163,m,باجی ، لڑکے والوں نے بہنوئی جی کے جوتے ایک لال و پیلے مٹھائی کے ڈبے میں چھپا دئے ہیں ۔
1164,f,مان گئے بھیّا جی ، ایسی جگہ چنی ہے جوتے کے چھپانے کی کہ کسی کو شک ہی نہیں ہو سکتا ۔
1165,,ہائے بھگوان ! ہے مرلی منوہر ! آپ تو کرشموں کے دھنی ہیں ، نرالے سے نرالا کھیل کھیل سکتے ہیں ۔
1166,any,بھگوان ! کوئی ایسا کرشمہ کر دو کہ بازی لے جائیں ہم اور الّو بنیں وہ ۔
1167,,للّو ! مجھے لگتا ہے کہ یہ ہمیں کہیں لے جانا چاہ رہا ہے ، شاید اسے معلوم ہے جوتے کہاں ہیں ۔
1168,,للّو ! ایک کام کرتے ہیں ، اب اس ڈبے کی جگہ یہ ڈبہ چھپا اور سن جوتوں کو ایسی جگہ چھپانا جہاں انھیں ڈھونڈتے ڈھونڈتے نانی یاد آ جائے ۔
1169,,بچّیوں ، بچّیوں ، میری بات سنو ، چلو پانچ سو روپئے میں بات پکی کرتے ہیں ۔
1170,,ہم لوگ پورے ایک ہزار ایک لینگے بہنوئی جی سے ، تبھی جوتے واپس ملیں گے ۔
1171,,ارے یار ! کمال کر رہا ہے تو ، یہاں ہمیں مدد کرنے کے بجائے وہاں بیٹھا بیٹھا پپیتا کھا رہا ہے ، ارے کچھ تو بول ۔
1172,,ماما جی ، پہلے آپ سودا ۔ وودا کر لو ، ہم تو آخر میں بولیں گے ۔
1173,,نشا جی ! اگر شادی میں ہنسی مذاق میں مجھ سے کوئی بھول ہوئی ہو تو مجھے معاف کر دیجئے گا ۔
1174,,تم ادھر آؤ ، تم کہاں چلے ؟
1175,,خوش ہو نا ، یہ رشتہ تمھیں نے کروایا ہے دے دیا بھنڈار پروفیسر صاحب نے ؟
1176,,کیا ہے مامی جی ، جب بھابھی کے ساتھ ان سب چیزوں کو تول کر دیکھا تو ان کا وزن ہماری بھابھی کے مقابلے رتّی بھر بھی نہیں نکلا ، چھوڑ کر آئے ۔
1177,,نہیں ، نہیں مالک ! آپ نے ہمیں عزت دی ، اتنی اچھی بھوجی لا کر دی ، بس ہم گنگا نہا آئے ۔
1178,,تو ہی تو کہتا ہے نا کہ پوجا کی شکل بالکل تیری اپنی بھابھی سے ملتی ہے ، بس یہی سمجھ لے کہ تیرے سامنے وہی کھڑی ہے اور تجھے دے رہی ہے ۔
1179,,دیکھو بھابھی سب سے زیادہ پیار اپنے دیور سے رکھتی ہے اسلئے دھیان رہے تیری بھابھی کو کبھی اس کے مائکے کی یاد نہ ستائے ، سمجھا ؟
1180,,چمیلی اسے کچھ سمجھا ، اتنی مشکل سے آج چھٹّی کے دن بھیّا کو کرکٹ کھیلنے کے لئے راضی کیا ہے ۔
1181,,ہے پریم ! کرکٹ فیلڈ پر صرف دیکھنے کی اجازت نہیں ہوتی ، ساتھ میں کھیلنا پڑتا ہے ۔
1182,m,سب کا دھیان ہمارے نئے کھلاڑی کی طرف جنھوں نے پہلی ہی گیند میں منجھے ہوئے کھلاڑی کو کلین بولڈ کر دیا ۔
1183,,ہمارے نئے کھلاڑی بیٹنگ کی طرف مڑتے ہوئے ، اب میچ نے بڑا ہی دلچسپ موڑ لے لیا ہے ۔
1184,any,ہمارے نئے کھلاڑی بڑی ہی خوداعتمادی کے ساتھ اپنی کریز پر ڈٹ گئے ہیں ۔
1185,,حلوائی سے بھی بات _ چیت ہو گئی ہے ، کہہ دیا ہے کہ بہو کی گودبھرائی کا فنکشن ہے ، سب کام صحیح وقت پر ہو جانا چاہیئے ۔
1186,m,بھائی واہ ، بہو ! للّو کو انگریزی سکھا کر ایک دم انگلش_مین بنا دیا ہے ۔
1187,m,بہو ! ذرا پوچھیں تو ہمارے سمدھی لوگ فنکشن کے لئے کب آ رہے ہیں ؟
1188,any,جی ، ایسا ہے کہ ان کے کالج کے امتحانات ملتوی ہوتے ہوتے ابھی انھیں تاریخوں سے شروع ہو رہے ہیں ۔
1189,any,اوہو ! کیا لڑکی ہے یہ ؟
1190,,نشا ! اٹھ بیٹا ، پریم آتا ہی ہوگا ۔
1191,,انتظار ؟
1192,m,ہم نے تو نہیں کیا ۔
1193,,تو کیا آپ چھت پر کھڑی دن میں تارے گن رہی تھیں ؟
1194,m,لوگ کہتے ہیں خوبصورت لڑکیاں جب جھوٹ بولتی ہیں تو اور بھی خوبصورت لگتی ہیں ۔
1195,any,ویسے جیکی نے اس گانے کے رائٹس خریدنے میں اپنی ساری سیونگ خرچ کر ڈالی ہے ۔
1196,,` رنگریز ` تمل فلم کا ری_میک ہے اس میں جیکی کے اپوزٹ پریاآنند ہیروئن ہیں ۔
1197,any,انوشکاشرما کے سر سے شاہ_رخ خان کا بھوت اتر ہی نہیں رہا ہے ۔
1198,f,وہ کہتی ہیں کہ شاہ_رخ خان کو لوگ سمجھ نہیں پاتے اسلئے انھیں گھمنڈی کہتے ہیں ۔
1199,m,شاہ_رخ خان کی اچھی دوست بن چکی انوشکاشرما کے ساتھ بھی فلم ` پی_کے ` میں آ رہی ہیں اور اب انڈسٹری کی خان تکڑی میں سلمان خان ہی رہ گئے ہیں جن کے ساتھ فلم کرنے کے لئے انوشکا بےچین ہیں ۔
1200,any,ان کا کہنا ہے کہ وہ بس آفر کا انتظار کر رہی ہیں اگر سلمان کے ساتھ کام کرنے کا موقع ملا اور اسکرپٹ اچھی لگی تو وہ اسے چھوڑنے والی نہیں ۔
1201,,اگر انوشکا کو سلمان کے ساتھ فلم مل جاتی ہے تو ایک طرح سے وہ کرینہ اور کیٹرینہ کو پیچھے چھوڑ دیں گی ۔
1202,,کیونکہ کیٹرینہ کی لسٹ میں تین خان تو ہیں لیکن اچھی ایکٹنگ کے لئے تعریف نہیں ہے ۔
1203,,لیکن انوشکا اس معاملے میں ان سے کافی الگ ہیں ۔
1204,any,سونل چوہان ان دنوں کافی چرچا میں ہیں ۔
1205,any,فلم ` جنّت ` سے کیرئر شروع کرنے والی سونل اپنی خوبصورتی اور فٹنس کی وجہ سے آجکل چرچا میں ہیں ۔
1206,f,سونل چوہان جلد ہی نیل نتن مکیش کے ساتھ فلم ` تھری_جی ` میں دکھائی دیں گی ۔
1207,,فلم میں سونل کی ریڈہاٹ بکنی کی بھی چرچا ہے اور نیل کے ساتھ ان کے تیس کِسیز کی بھی ۔
1208,,حالانکہ سونل کسنگ سینس کی خبر کو جھوٹ بتاتی ہیں لیکن اپنی بکنی باڈی کا چرچا بھی کرنا نہیں بھولتی ۔
1209,,چرچا اس بات کی ہے کہ بکنی سین میں سونل غضب کی چھریری لگ رہی ہیں ۔
1210,,اور ان کے چھریرے جسم کو دیکھ کر یہ سوچنا بھی فطری ہے کہ انھوں نے خوب ڈائٹنگ کی ہوگی ۔
1211,,لیکن سونل کا کہنا ہے کہ وہ ڈائٹنگ جیسے پروڈکٹس سے بالکل پرہیز کرتی ہیں ۔
1212,f,ہاں وہ فٹنس کے لئے جم ضرور کرتی ہیں ۔
1213,any,ان کا فٹنس منتر ہے ہر چیز کھاؤ لیکن جم میں کیلوری جلاؤ
1214,f,وہ کہتی ہے کہ چار دن جم ضرور جانا چاہیئے ۔
1215,,جم میں جا کر ہی انھوں نے اپنے جسم کو اتنا پرکشش بنا لیا ورنہ انھیں کھانے کے معاملے میں کنٹرول کرنا بالکل پسند نہیں NULL ۔
1216,f,آج سونل خود ہی خود پر فریفتہ رہتی ہیں ۔
1217,any,ان کے مطابق انھیں اپنی باڈی میں ان کے لمبے پیر خاص پسند ہیں ۔
1218,,ویسے سونل تن کی ہی نہیں من کی بھی خوبصورت ایکٹریس ہیں ۔
1219,any,پھر خبریں آئیں تھیں کہ نیل انھیں شادی تک کے لئے پرپوز کر چکے ہیں اور سونل ان کی دیوانگی سے ناراض ہو کر دوستی توڑ چکی ہیں ۔
1220,m,اس دوستی کی کیمسٹری کا اصلاً امتحان تو فلم ` تفریحی ` ہی ہوگا ۔
1221,,` تھری_جی ` ایک ہارر تھرلر فلم ہے اور ۱۵ مارچ کو ریلیز ہونی ہے ۔
1222,any,بہت زیادہ وقت نہیں گزرا ہے ۔
1223,any,محض تین چار برس پہلے تک بالی_ووڈ کے پروڈیوسر و ڈائریکٹر سمجھ نہیں پا رہے تھے کہ ہندوستانی ناظرین آخر دیکھنا کیا چاہتے ہیں ؟
1224,any,سبھی تجربہ کرنے میں لگے تھے ۔
1225,,لیکن ہندوستانی ناظرین کو جو بات پسند آئی وہ تھی بڑے پردے پر چھوٹے قصبے کی لوکیشنس ۔
1226,,یعنی بالی_ووڈ فلموں میں ہندوستانی دیہات اور قصبوں کی فلمبندی ۔
1227,any,یہ ٹرینڈ کہاں سے شروع ہوا ، کچھ صحیح سے نہیں بتایا جا سکتا کیونکہ ہمارے یہاں پہلے بھی ایسی فلمیں بنتی رہی ہیں ۔
1228,,دماغ پر زور نہیں ڈالنا پڑتا اور ` ` لگان ` ` ، ` ` سودیش ` ` اور ` ` غدر ` ` جیسی بہترین و کامیاب فلموں کی یاد ذہن میں تازہ ہو جاتی ہے ۔
1229,m,یہ بتایا جاتا ہے کہ دیہات اور قصبے تو پہلے بھی ناظرین کو پسند آتے رہے ہیں ۔
1230,any,حالانکہ سورج برجاتیا کی ` ویواہ ` اور ` ہم ساتھ ساتھ ہیں ` میں بھی گاؤں کے لوکیشنس تھے لیکن پرکاش_جھا تو جیسے قسم کھا کر آئے ہیں کہ اپنی زیادہ_تر فلموں کی زمین گاؤں یا قصبوں پر مبنی ہی بنائیں گے ۔
1231,f,اس کے علاوہ ہماری بلیک اینڈ وہائٹ فلمیں تو گاؤں کی کہانیوں پر ہی بنتی تھیں ۔
1232,any,بہرحال ایسی فلموں کا سلسلہ سا چل نکلنے یا اسے ایک ٹرینڈ کی طرح تجربہ کرنے کی شروعات کی بات کریں تو ۲۰۱۰ میں ریلیز ہوئی ` دبنگ ` اور ` پیپلی لائیو ` کی کامیابی اس کی انسپریشن کی وجہ مانا جا سکتا ہے ۔
1233,any,دونوں میں ہندوستانی گاؤں کی اس کے اصل روپ میں فلمبندی کی گئی تھی ۔
1234,any,دراصل اس سے پہلے بنی زیادہ_تر فلمیں اگر گاؤں یا قصبے بھی گئے تو اس کا رنگ و روغن کر اس قدر خوبصورت بنا دیا گیا کہ گاؤں میں بھی شہروں کے نقوش نظر آنے لگے ۔
1235,,لیکن ` ` دبنگ ` ` نے گاؤں کو اسی انداز میں دکھایا جیسا وہ اصل میں تھا ۔
1236,any,` پیپلی_لائیو ` میں گاؤں والوں کی مجبوریاں اور فقدان میں جینے کی مجبوری کو بڑی زندہ_دلی سے اتارا گیا پردے پر ۔
1237,any,ان دونوں فلموں نے بالی_ووڈ فلمساز و ہدایتکار کو سوچنے پر مجبور کر دیا کہ ایسے موضوعات پر فلمیں بنائی جائیں جو ناظرین کو پسند آئیں ۔
1238,any,انھیں محسوس ہوا کہ گاؤں اور قصبوں کی حقیقت لوگ دیکھنا چاہ رہے ہیں ۔
1239,any,بس ، پھر کیا شروع ہو گیا سلسلہ ۔
1240,any,بڑے پردے پر گاؤں اور قصبوں سے جڑی کہانیاں دکھانے کا ۔
1241,,کچھ چلیں اور کچھ پِٹ گئیں ۔
1242,any,لیکن جو بھی پٹیں وہ کہیں نہ کہیں کمزور مکالمے اور ایکٹنگ کی وجہ سے نہ کہ چھوٹے قصبوں پر مبنی کہانیوں کی وجہ سے ۔
1243,f,یعنی چھوٹے قصبے تو اب بھی ہٹ تھے ۔
1244,m,پچھلے دنوں جانےمانے تخلیق_کار چیتن بھگت اور فلمساز و ہدایتکار ناگیش کُکُنر نے نیشنل جیوگرافک چینل کے ساتھ مل کر ہندوستانی گاؤں کی سیر پر نکلنے کے موقع کو خاص بتایا ۔
1245,f,کیسی باتیں کرتی ہے تو ، بھائی بہن کے اور بہن بھائی کے کام نہیں آئے گی تو کون آئے گا ، بتا کیا کام ہے ؟
1246,,یہ ہے میری فرینڈ موہنی ، اسے تجھ سے کچھ کام تھا ۔
