treedepth,sentences
3,ڈیر پاپا ! معذرت ، دادی اور میں ، آپ کو بنا بتائے چلے گئے ۔
5,پیارے خدا ! مہربانی کر کے آپ ابّا کو خوش رکھئے اور اتنا دے دیجئے کہ وہ مجھے یاد نہ کریں ۔
3,آپ تو جانتے ہیں ، وہ میرے بنا کچھ نہیں کر سکتے ۔
4,اب میں خدا سے ممی کے لئے کیا مانگوں ، وہ انھیں کے پاس تو ہیں ۔
3,وہ جو چاہتی ہیں ان سے مانگ سکتی ہیں ۔
2,انجلی ! تم کہاں چلی گئی ہو ؟
4,تم جانتی ہو کہ تمھارے بنا میں کتنا اکیلا ہو جاؤنگا ۔
2,یہ انجلی کون ہیں ؟
3,انجلی ! میری آٹھ سال کی بیٹی ہے ۔
3,انجلی ! تمھاری صحت تو ٹھیک ہے نا ؟
2,مجھے ٹینا کے بارے میں پتہ نہیں تھا ۔
3,کیسے پتہ ہوتا ، تم تو غائب ہی ہو گئی ۔
6,جب مجھے میرے دوست کی ضرورت تھی ، تم تو تھی ہی نہیں ۔
2,لڑکیاں باسکٹ _ بال نہیں کھیل سکتیں ۔
3,اس نے تم سے سچ کہا اور تم اس سے لڑنے لگی ؟
1,کیوں ؟
2,روز کالج میں مس انجلی آپ کو باسکٹ _ بال میں ہرا نہیں دیتی تھی کیا ؟
3,روز روز نہیں ہراتی تھیں ، کبھی - کبھی ہراتی تھی ۔
0,یاد کرو انجلی ! تم روز ہارتی تھی ۔
3,میں ، تمھیں ابھی اسی وقت چیلنج کرتی ہوں ، میرے ساتھ کھیلو ۔
6,ہائے ٹینا ! آج اگر تم یہاں ہوتی نہ ، تو تم فخر سے کہہ سکتی کہ انجلی میری بیٹی ہے ۔
4,کیونکہ وہ بہت اچھی ہے اور کیوں نہ ہو ، اس کا نام انجلی جو ہے ۔
8,لیکن پتہ ہے ، اس کی سب سے اچھی بات کیا ہے ، کہ وہ بالکل تمھاری جیسی ہے ۔
2,انجلی بہت ہی پیاری لگ رہی ہے نا اس فوٹو میں ؟
5,وہ یہاں نہیں اسلئے روز اس کی فوٹو دیکھ دیکھ کر تو خوش ہو جاتا ہے ۔
4,امن ! شادی تو دسمبر میں ہو رہی ہے نا ، تو لندن کیوں نہیں ہو کر آتا ؟
6,لیکن مجھے ایسا لگتا ہے کہ وہ مجھ سے پیار نہیں کرتی ۔
3,مرد بہت کمزور ہوتے ہیں بیٹی ، بہت کمزور ہوتے ہیں ۔
4,یہ اصول تو بنا لیتے ہیں ، لیکن بھول جاتے ہیں دل کے آگے کوئی اصول نہیں ہوتا ۔
7,اور ہم ان ضدّی ، کمزور مردوں کو احساس دلاتے ہیں کہ دل کے رشتے دھڑکنوں سے بنتے ہیں ، اصولوں سے نہیں ۔
5,لیکن یہ دل کے رشتے ، دل کی بات کہہ دینے سے بنتے ہیں بیٹی ۔
4,تم اپنے دل کی بات کہہ دو انجلی ۔
4,کبھی کبھی دل کی بات کہنے سے دل ٹوٹ بھی سکتا ہے ۔
3,نہ کہو گی ، تو کون سا آباد رہے گا ؟
5,امن نے بتایا کہ تمھاری شادی ہونے والی ہے ۔
2,امن ! میں آج رات کو ہی واپس جانا چاہتی ہوں ۔
4,تم نے یہ ٹینا کو کیا دیا تھا ، جب وہ ایک نئی زندگی شروع کرنے جا رہی تھی ۔
2,آج تم بھی ایک نئی زندگی شروع کرنے جا رہی ہو ۔
5,میں جانتا ہوں کہ تم اور راہل ایک ساتھ خوش رہو گے ۔
4,آپ شادی کی تیاریاں شروع کر دیجئے ، میں اب اور انتظار نہیں کرنا چاہتی ۔
5,لیکن انجلی ! باباجی نے تو کہا تھا کہ دسمبر کے پہلے کوئی تاریخ نہیں ہے ۔
3,ماں ! خوشیاں تاریخ نہیں ، تقدیر لاتی ہے ، جسے کوئی نہیں بدل سکتا ۔
7,انجلی نے اتنی جلدی شادی کا فیصلہ کیا کہ مجھے پوری تیاری کرنے کا وقت نہیں ملا ۔
7,تم جانتی ہو ، میں نے ہمیشہ تمھاری آنکھوں میں وہ پیار دیکھنا چاہا جو میری آنکھوں میں ہے ۔
4,اور آج مجھے وہ پیار دکھائی دیا ہے ، لیکن وہ میرے لئے نہیں ۔
4,جب سے تم نے پیار کو سمجھا ہے ، پیار کو جانا ہے ، صرف اسی سے پیار کیا ۔
6,راہول ہی تمھارا پہلا پیار ہے اور پہلا پیار کیا ہوتا ہے وہ مجھ سے پوچھو اور تم میرے لئے سب گنوانے جا رہی تھی ۔
5,میں اس پیار کے بیچ کیسے آ سکتا ہوں ، یہ تو کبھی میرا تھا ہی نہیں ۔
3,اس کے بارے میں مصنفوں نے نہ جانے کیا - کیا لکھا ہے ۔
9,کچھ نے یہاں تک لکھا کہ جہاں گھاس کا ایک نشان بھی پیدا نہیں ہوتا ہے ، وہاں اتنی بڑی فوج کو تعینات کرنے یا اس کی حفاظت کرنے کا کیا مطلب ہے ۔
4,ایسے مصنف بھول گئے کہ اس زمرے میں سیاچن ہی محض ایک مقام نہیں ہے ۔
6,دیکھا جائے تو جب بھی دفاعی رپورٹنگ کی بات ہوتی ہے سب سے پہلے جنگ کا خیال سامنے آتا ہے ۔
3,لیکن اب وقت بدل گیا ہے ۔
4,دفاعی رپورٹنگ کو اسلئے ہم دو حصوں میں بانٹ سکتے ہیں ، ایک جنگ کے دوران اور دوسرا امن کے دوران ۔
2,پہلے ہم جنگی عہد کو لیتے ہیں ۔
3,کسی بھی فوجی آپریشن یا جنگ کے دوران کوئی بھی نامہ_نگار جائز منظوری کے بنا اس علاقہ میں نہیں جا سکتا ہے ۔
5,ایسے سبھی علاقے پوری طرح فوج کے ماتحت ہوتے ہیں اور وہاں جانے کے لئے متعلقہ حکومت کی اجازت لینا ضروری ہے ۔
4,کچھ ممالک دفاعی نامہ_نگاروں یا جنگی نامہ_نگاروں کو فوجی وردی دیتے ہیں اور انھیں علاقہ میں لے جاتے ہیں ۔
4,اس حالت میں سارا آپریشن ایریا فوج کے تحت ہوتا ہے اور انھیں کے ہدایت کے مطابق چلنا ہوتا ہے ۔
2,فوج کے ساتھ مارچ کرنا ہوتا ہے ۔
3,"` جنگی علاقہ ` میں عموماً جو خبریں بھیجی جاتی ہیں , انھیں متعلقہ افسر ` سنسر ` کرتا ہے ۔"
6,کوئی ملک نہیں چاہتا کہ کوئی بھی ایسی خبر باہر جائے ، جو ان کے دشمن کو فائدہ پہنچا سکے ۔
4,دفاعی رپورٹنگ کرتے وقت ملک کے اپنے نامہ_نگاروں کو قومی مفاد پر دھیان دینا نہایت ضروری ہے ۔
5,یہ اصول ایسا نہیں کہ فقط ہندوستانی نامہ_نگاروں کے لئے ہے ۔
5,فاکلینڈ جنگ کے دوران برطانوی نامہ_نگار اپنے ملک کے مفاد اور ارجنٹینا کے نامہ_نگار اپنے قومی مفاد کا دھیان رکھتے تھے ۔
3,دوران جنگ فوج کی ہدایت پر پوری طرح عمل ہونا چاہیئے ۔
3,اپنی انفرادی حفاظت کے لئے یہ لازمی ہے ۔
4,جگہ - جگہ بارودی سرنگیں بچھی ہوتی ہیں ، بمباری ہو رہی ہے ، ایسے میں ذرا سی لاپرواہی مہلک ثابت ہو سکتی ہے ۔
5,فوجیوں کو مختلف زرائع سے میدان جنگ کی جانب بھیجا جاتا ہے اور ایک انفارمیشن تیار کی جاتی ہے ۔
4,یہ ایک ایسی حالت ہے جسے بہت احتیاط سے رپورٹ کرنا ہوتا ہے ۔
3,کس علاقہ میں کس قسم کی حرکت ہو رہی ہے ۔
5,جنوری ۱۹۸۵ میں ہند و پاک کے درمیان اچانک تناو بڑھ گیا تھا اور دونوں جانب سے نقل و حرکت شروع ہو گئی تھی لیکن تبھی جنرل ضیا نے کرکٹ سفارت کی چال چلی اور جنگ ٹل گئی ۔
6,فوج کے جوانوں کے حوصلوں کو بنائے رکھنے کے لئے اور ساتھ ہی کسی قوم کے حوصلہ کو بنائے رکھنے کے لئے فوجیوں کی حرکتوں کے متعلق خبریں دئے جاتے ہیں ۔
2,آجکل اس میں ایک نیا موضوع منسلک ہو گیا ہے ۔
5,دہشتگردانہ حادثات ، بغاوت کی کاروائیوں وغیرہ سے نمٹنے کے لئے فوج کو تعینات کرنا پڑتا ہے ۔
7,دیکھا جائے تو فوجیوں کے لئے یہ کام نہایت مشکل ہیں اور ان کی رپورٹنگ بھی صحیح ڈھنگ سے ہو ، یہ ضروری ہے ۔
3,قدرتی آفات کے وقت بھی فوج کی مدد لی جاتی ہے ۔
2,سیلاب ہو ، برف کے تودے گریں یا کوئی اور مصیبت NULL ، سب سے پہلے فوج کو یاد کیا جاتا ہے ۔
2,ان دونوں حالات کو دیکھا جانا چاہیئے ۔
6,جب باغیوں سے نمٹنے کی بات ہوتی ہے تو زنا تک کے الزام لگتے ہیں ۔
7,جس مقام پر ہر پل گولی لگنے کا ڈر ہو ، دہشتگردوں کے نشانے پر جان ہو ، کیا وہاں عصمت_دری کیا جانا ممکن ہے ؟
7,کتنے نامہ_نگار ہیں جو ہماری فوج کی مختلف بٹالینوں اور ان کی روایتوں کو جانتے ہیں ؟
7,دنیا میں کس طرح سے جدید_ترین اسلحہ ، جنگی جہاز ، لڑاکو طیارہ ، دفاعی ساز و سامان ، رڈار ، میزائلیں وغیرہ کا فروغ ہو رہا ہے اس پر بھی نظر رکھنا ضروری ہے ۔
3,اس کے لئے دنیا کی مشہور ` جینس ویکلی ` سب سے مفید کتاب ہے ۔
5,بلواسٹار آپریشن کے دوران بی_بی_سی کے نامہ_نگار تک نے تو ایک غلطی کی کہ آرمی پرسنل کیرئر کو جنگی ٹینک سمجھا ۔
8,یہ بھی سمجھ ہونی چاہیئے کہ فوج کے تینوں حصوں میں برّی فوج کا اول ، بحری فوج کا دوم اور فضائی فوج کا تیسرا مقام ہے ۔
5,اخبارات میں وہی خبر تفصیل سے دی جاتی ہے ، جس کی عوام کو بھوک ہوتی ہے ۔
3,یوں تو کسی بھی خبر کی کوئی ٹھوس توضیح ہمیں نہیں ملتی ہے ۔
6,انگریزی کا ` نیو ` لیٹن کے نواں اور سنسکرت کے نو لفظ کا ایک ہی مطلب ہے ۔ نوین ۔
4,حقیقت میں خبر وہ NULL ، جو نئی ہو ۔
4,ایک اندازے کے مطابق ۳۰ سے ۳۵ فیصد خبروں کا تعلق براہ_راست یا بالواسطہ جرم سے ہوتا ہے ۔
6,سوال اٹھتا ہے آخر آج کے سماج میں قتل یا جرم یا بھاری حادثوں کے تئیں عوام کی اتنی دلچسپی کیوں ہے ؟
6,ایسے حادثات سے بھری لاکھوں کتابوں یا اخبار و رسائل کی اتنی مانگ کیوں ہے ؟
2,الکٹرانک میڈیا میں بھی مجرمانہ سیریل کیوں زیادہ مقبول ہیں ؟
6,اس سوال کا حل کھوجنے سے قبل یہ جان لینا بھی ضروری ہے کہ جرم کیا ہے ؟
7,سوال اٹھتا ہے کہ کیا مذہب کے خلاف کیا گیا عمل جرم نہیں ہے ؟
2,وہ بھی ہے ، کیونکہ مذہب کے خلاف کئے گئے کسی بھی امر کو ہم `` گناہ `` کا نام دیتے ہیں ۔
3,قانون کی زبان میں ` ` گناہ ` ` بھی جرم ہے ۔
4,اسی طرح انھوں نے چودھری دیوی لال کی کہی ہوئی باتوں کو ` انڈین ایکسپریس ` میں لفظ بہ لفظ چھاپ دیا ۔
4,شوری کے مطابق ` تہلکہ ٹیپ ` میں اپنائے گئے طریقے مناسب نہیں ہیں ۔
2,غیرمعمولی حالت میں غیرمعمولی تدبیر کرنی ہوتی ہے ۔
8,جہاں تک بدعنوانی کو سامنے لانے کے لیے `` لیک `` سے ہٹکر کام کرنے کا سوال ہے زیادہ_تر لوگوں کا ماننا ہے کہ ` تہلکہ ڈاٹ کام ` نے ملک کی خدمت کی ہے جبکہ کچھ لوگ اس کے ذریعہ اپنائے گئے طریقوں کو لیکر پریشان ہیں ۔
5,ہر مدیر اپنے اخبار کی اشاعتی تعداد بڑھانے کے لئے مضامین کا ایسا سلسلہ شائع کرنا چاہتا ہے جو لوگوں کی نظروں میں چڑھ جائے ۔
3,عموماً مدیر اخبار کا اداریہ خود لکھتے ہیں ۔
3,مدیر اخبار کی پالیسی کو واضح کرتا ہے ۔
4,کچھ مدیر اپنے معاون مدیروں کو ہدایات دے کر ان سے اداریہ لکھاتے ہیں ۔
3,ہر مدیر روزانہ اپنے معاون کے ساتھ بیٹھک کرتا ہے ۔
7,اس میٹینگ میں گزشتہ دن کے اخبار کا تجزیہ کیا جاتا ہے اور اگلے دن کے اخبار میں کیا دیا جائےگا اس کا منصوبہ بنایا جاتا ہے ۔
5,میٹینگ میں مدیر اکثر اہم خبر کہاں پر کیسے شائع کی جائیگی اس کا تعین بھی کیا کرتا ہے ۔
3,عموماً یہ کام اخبار کے مدیر کرتے ہیں ۔
2,چھوٹے اخبار میں تو مدیر سب کو جانتا ہے ۔
5,بڑے میں یہ ممکن نہیں ہے کہ وہ سب کو جانے ۔
3,بڑے اخبار میں مدیر اپنے کچھ حقوق اپنے معاون کو دے دیتا ہے ۔
2,بڑے اخبار میں بیشتر کام میٹینگ کے ذریعہ کیا جاتا ہے ۔
3,ہر ایک اخبار میں مدیر کے بعد مشترکہ مدیر یا معاون مدیر ہوتے ہیں ۔
3,مدیر کے تعطیل پر جانے پر یہی مدیر کی جانب سے کام نمٹاتے ہیں ۔
4,ہر اخبار میں ایک یا دو اخبار کے مدیر ہوتے ہیں ۔
5,عموماً ایک خبر مدیر دن کے لئے اور ایک رات کے لئے ہوتا ہے ۔
5,اخباری مدیر کون سی خبریں جائیںگی اس کا تعین کرتے ہیں ۔
3,رات کی خبر مدیر شہری اشاعت کے اخبار کو حتمی روپ دیتا ہے ۔
3,کبھی کبھی اسے پہلے صفحہ کی خبروں میں بنیادی تبدیلی کرنی پڑتی ہے ۔
6,کبھی کبھی ایسے مواقع بھی آتے ہیں جب پورا چھپا صفحہ بدلنا پڑتا ہے ۔
3,عموماً معاون مدیر یا اہم نائب مدیر ان کاموں کو بھی دیکھتے ہیں ۔
5,اخبار میں کتنے ہی معاون مدیر ، فیچرنگار اور نائب مدیر کیوں نہ ہوں اخبار کی پوری ذمہ_داری مدیر کی ہوتی ہے ۔
3,مدیر کا کام بڑا جوکھم_بھرا ہے ۔
3,ان میں سب سے اہم ہے ہتک_عزت کا مقدمہ ۔
3,سبھی اخبارات کے قانونی مشیر ہوتے ہیں ۔
2,یہ اخبار کو متنازعہ موضوعات میں مشورہ دیتے ہیں ۔
6,ہتک_عزت کے دائرے میں آنے والی خبریں بھی شائع کی جا سکتی ہیں بشرطیکہ وہ سچ ہوں ان کی اشاعت عوامی مفاد میں ہو اور ان کی اشاعت غلط ارادے سے نہ کی گئی ہو ۔
7,وکیل کا کام یہ بتانا نہیں ہے کہ کیا شائع کیا جائے اور کیا نہیں ۔
3,اس کا کام فقط قانونی حالت واضح کرنا ہے ۔
3,ہتک_عزت کے سوا ملزم کو قصوروار ٹھہرانا عدالت کی خلاف_ورزی ہے ۔
9,"مان لیجئے ایک شخص کو قتل کے الزام میں گرفتار کیا جاتا ہے , اب اگر اخبار میں خبر چھپتی ہے کہ قاتل پکڑا گیا تو یہ عدالت کی خلاف_ورزی ہے ۔"
6,پکڑا گیا شخص جب تک کہ اس کا جرم ثابت نہیں ہو جاتا ملزم ہے یعنی اس پر جرم کرنے کا الزام ہے ۔
4,الزام عدالت سے تصدیق ہونا ہے لہٰذا ایسے آدمیوں کو قاتل کہنا کسی نظر سے مناسب نہیں ہے ۔
3,پارلیمنٹ کی خبر بھی بڑی احتیاط سے شائع کی جانی چاہیئے ۔
6,پارلیمنٹ کو اپنے حقوق اور خصوصی حقوق کا تحفظ کرنے کے لئے عدالت کی طرح حق ہیں ۔
6,اس تعلق سے ایک مشکل دقت یہ ہوتی ہے کہ یہ پارلیمنٹ ممبران کے افسران کو ابھی تک منسلک نہیں کیا گیا ہے ۔
7,مدیر کو اس بات کا بھی دھیان رکھنا پڑتا ہے کہ اس کے رسالے کے خلاف پریس کونسل میں شکایت نہ کر دی جائے ۔
6,پریس کونسل کو جرمانہ اور جیل بھیجنے کا حق تو نہیں ہے لیکن اسے متعلقہ خبر کی مذمت کرنے کا لازمی حق ہے ۔
5,پریس کونسل فرقہ_وارانہ مضمون ، بےبنیاد خبر شائع کرنے ، نسلی تفریق پھیلانے ، خواتین کے خلاف تفریق کرنے کے لئے اخبارات کے خلاف کاروائی کر سکتی ہے ۔
6,صحافت قارئین کو بتاتی ہے کہ اس کے آس_پاس اردگرد کیا ہو رہا ہے ۔
3,صحافت ایک صنعت ہے ایک کاروبار ہے اور اسی کے ساتھ ساتھ وہ ایک مشن بھی ہے ۔
5,دیگر صنعتوں کی طرح صحافت صنعت بھی فائدہ کمانے کی کوشش کرتی ہے لیکن دیگر صنعتوں کی طرح اس کا محض ایک مقصد مانا جاتا ہے ۔
8,"صحافت کے دو اہم مقاصد ہیں , پہلا ، اطلاع دینا یعنی حادثے کی رپورٹ کرنا اور دوسرا خبر پر تشریح پیش کرنا اور خبر پر مبنی رائے بنانا ۔"
2,فیچر کسی بھی ہمعصر موضوع پر لکھا جاتا ہے ۔
3,سمدھن جی اب آپ چاہیں ناراض ہو جائیں ، ہم آپ کو آج نہیں جانے دینگے ۔
2,ارے ہاں پریم بیٹا ، آخر کب تک یہاں بیٹھے رہینگے ؟
3,بتاؤ تو صحیح ، کرنا کیا ہے بھئی ؟
3,بڑا آسان سا گیم ہے ، وہاں پر بھولا جی میوزک بجائیں گے ، یہ تکیہ ہم لوگ یہاں پر پاس کریں گے ۔
6,جب بھی میوزک رکے گا یہ تکیہ جس کے بھی ہاتھ میں ہوگا وہ پھنسے گا اور پھر جو بھی سزا ہم اسے دینا چاہیں گے ہم دینگے اور اسے ماننی بھی پڑے گی ۔
4,ہم وہاں بیٹھ کر دیکھیں گے کہ کوئی چیٹنگ نہ کرے ۔
3,بھئی کمال کرتے ہیں ڈاکٹر صاحب ، فولادی جگر ہے اتنی جلدی فیل تھوڑے ہی ہوگا ۔
6,بھابھی جی ! ہمیں آپ سے ایک شکایت ہے ، آپ اتنے دن یہاں رہے ، ایک بار بھی ہمارے گھر کھانے پر نہیں آئے ۔
2,ارے بھائی ایک منٹ ، آپ لوگوں کو ٹھیک سے رخصت تو کر دیں ۔
6,سمدھن جی ! یہ من بھی کتنا باورا ہے ، جتنا پاتا ہے اس سے زیادہ پانے کی خواہش رکھتا ہے ۔
4,ایک دن تو ہم نے آپ سب کو روک لیا ، اب جی چاہتا ہے ایک دن اور روک لیں ۔
5,نشا کے ساتھ ایک فوٹو تو دلائیے تاکہ یاد تو رہے کہ اتنے دن ہمارے ساتھ کتنے پیار سے رہی ۔
1,جی رہی ہو ؟
4,اب کوئی بہانا بھی تو نہیں جس سے میں تمھیں روک سکوں ۔
5,جیسے ہی فیکٹری کا افتتاح ہو جائے ، میں بھابھی سے اپنی شادی کی بات کرونگا ۔
2,ارے میرے پیارے بھائیو ، دیکھ کیا رہے ہو ؟
4,ہمارے پریم بھیّا آج بڑے صاحب بن گئے ہیں ، سلام کرو ۔
3,بس اسی کا ڈر تھا مجھے ۔
4,ارے ان نوکروں کو تو میں خوب اچھی طرح سے جانتی ہوں ، یہ بیماری تو بہانہ ہے بہانہ ، پیسے اینٹھنے کی اسکیم ہے سمجھی ۔
5,بھابھی ! ہم اپنی قسم کھا کر کہتے ہیں یہ تار جھوٹا نہیں ہے ، خریدا ہوا نہیں ہے ۔
5,سن ، جب تیری بھابھی ٹھیک ہو جائے نہ ، تو سب سے پہلے ان سے کہنا کہ تو نے اپنے لئے چمیلی ڈھونڈ لی ہے ۔
4,بہو ! کل کلّو چلا گیا ، آج تم لوگ چلے جاؤ گے ، ہمارا من کیسے لگے گا ۔
5,اسیلئے تو کہتی ہوں کاکا جی ، ہماری فیکٹری کا کام شروع ہو گیا ہے ، اب ہمارے لئے ایک دیورانی لے آئیے نہ ۔
4,چلو بہو ! آج سے اس کے لئے دلھن چننے کی ذمہ_داری تمھاری ۔
5,آج آپ کی شادی کی بات کیا چلی ، موسم نے جادو کر دیا ۔
6,کاکا جی نے آپ کی باگ_ڈور اب ہمارے ہاتھ میں دے دی ہے ، یہ بتائیے جناب لومیرج پسند کریں گے یا ارینجڈمیرج ؟
4,دیکھو منّا ! آپ کے چاچا آپ کے پاپا سے دو قدم آگے نکلے ، چپکے چپکے آپ کے لئے ایک چاچی بھی ڈھونڈ لی ۔
5,یعنی کہ آپ نے اور آپ کی میڈم نے مل کر پہلے سے ہی یہ پروگرام طے کر رکھا ہے ۔
5,ارے ! اگر وہ نیچے آ رہی ہے تو چل ہم اس کے پاس چلتے ہیں ۔
4,کھا لے ٹفی ، تجھے کھلانے والی اب واپس نہیں آئے گی ۔
5,وہ تو بےرحم تھی ، چار دن کا موہ جگا کر ہمیں اکیلا چھوڑ گئی ۔
3,پتہ نہیں کیا جادو تھا اس بچی میں ، اس کے بنا تو جینا ہی بھول گئے ۔
6,ارے جگن ! جگن ! سبھی ڈاکٹروں نے جواب دے دیا تھا ، کہہ دیا تھا کہ ہماری بھابھی اب کبھی ٹھیک نہیں ہوگی ۔
4,لیکن ، ہمیں بھروسہ تھا ، ہمیں بھروسہ تھا انھیں کچھ نہیں ہو سکتا ۔
2,پوجا بھابھی نے ان کے لئے دعا کی تھی نہ بھیّا جی اور وہی ہوا ، ان کی آنکھیں کھلی ، وہ مسکرائی ۔
8,ہم نے ان کو یہی کہا یہ سب کرشمہ اس بھابھی کا ہے جس کا ہاتھ ہمارے سر پر ہمیشہ ہے ۔
4,مالک ! مالک ! ہمارے آنسوؤں کے لئے جان دے گئی بھابھی ، اپنی دعا میں ہماری بھابھی کو زندگی دے گئی بھابھی ، زندگی دے گئی ۔
4,بڑے بھیّا ! پوچھو اس خدا سے اچھے لوگوں کو اپنے پاس کیوں بلا لیتے ہیں ؟
1,کیوں بلا لیتے ہیں ؟
4,للّو ! تیری پوجا بھابھی تو شفقت کی دیوی تھی ، ممتا کا خزانہ تھا اس میں ۔
4,وہ بھی تو پیار کا بھوکا ہے ، اسے بھی تو پیار چاہیئے للّو ، اسے بھی تو پیار چاہیئے ۔
3,ممتا کی بات کہہ رہے ہو ، اس پر تو ہمارے راج کا حق تھا نہ ؟ حق ؟
5,پوجا کے جانے کے بعد ہمیں اس کی اتنی کمی محسوس ہو رہی ہے تو ذرا سوچو بیچارے راجیش پر کیا بیت رہی ہوگی ۔
4,وہ خود کو بھلے ہی کچھ نہ کہے لیکن اتنے دنوں سے اس کی حالت تو ہم لوگ دیکھ ہی رہے ہیں ۔
5,اندر ہی اندر اسے فکر کھائے جا رہی ہے اور اس کی پریشانی کی وجہ ہے منے کی پرورش ۔
6,راجیش بیٹا ! تجھے اپنے منے کے مستقبل کے لئے پریشان ہونے کی بالکل ضرورت نہیں ۔
4,راجیش کا بیاہ اس وقت سویٹی سے ہوتا تو آج یہ دن دیکھنے کو نہ ملتا ۔
4,ارے ، کسی اور کے بچے کو سینے سے لگا کر رکھنے کے لئے اپنی تہذیب کی پہچان ہونی چاہیئے ، سمجھی تم ؟
3,آجکل کون سی لڑکی سوتیلی ماں بننا پسند کریگی ؟
3,کون سے ماں _ باپ ایسے حالات میں اپنی بیٹی راجیش کو دینگے ۔
4,دیویدی جی کے ذریعہ کی گئی تقریر کی بات شروع میں کہی جا چکی ہے ۔
9,آگے کی اہم لائنوں کو دیکھئے - اگر دیویدی جی نہ اٹھ کھڑے ہوتے تو جیسے غیرمنظم ، مخالف قواعد اور بےہودہ زبان چاروں جانب دکھائی پڑتی اس کی روایت جلد نہ رکتی ۔
3,۱۶ جنوری ۱۸۹۹ کو گپت جی نے ` بھارت - متر ` کی ادارت سنبھالی ۔
4,ان کو چلانے کی ذمہ_داری انھیں پر تھی ۔
3,اسلئے اخبار کو انھوں نے اپنے مطابق ایک نیا نظام دیا ۔
10,گپت جی چونکہ شعورِ عہد کے تئیں بیدار تھے اور ان کی ذاتی ایمانداری مستحکم تھی اسلئے فطری تھا کہ شدید قومیت ہی اخبار کی پالیسی بنے ۔
