senlen,sentences
15,ಯಾರು ಈ ಪಾಪವನ್ನು ಮಾಡಿದ್ದಾರೋ ಅವರು ಇಂದಿನಿಂದ ೭ ದಿನಗಳ ಒಳಗೆ ಸರ್ಪರಾಜ ಆದ ತಕ್ಷಕನಿಂದ ಮರಣ ಹೊಂದಲಿ .
11,"ಮನುಷ್ಯನು ಸಣ್ಣ ವಿಷಯಕ್ಕೆಲ್ಲ ಕೋಪಿಸಿಕೊಳ್ಳಬಾರದು , ಮತ್ತು ಇಂತಹ ವಿಷಯಕ್ಕೆಲ್ಲ ಶಾಪವನ್ನು ಹಾಕಬಾರದು ."
14,"ಮಹಾರಾಜ ಪರೀಕ್ಷಿತರು ವಿಷ್ಣುವಿನ ಅವತಾರ ಆಗಿದ್ದು , ರಾಜನಲ್ಲಿ ಕ್ಷಮೆಯನ್ನು ಯಾಚಿಸಿ ಅವರಿಗೆ ಶಾಪದಿಂದ ವಿಮುಕ್ತನ್ನಾಗಿ ಮಾಡು ."
9,ತಾವು ರಾಜನನ್ನು ಆದರದಿಂದ ಆಶ್ರಮಕ್ಕೆ ಬರಮಾಡಿಕೊಳ್ಳದೇ ಇರಲು ಕ್ಷಮೆಯನ್ನು ಕೋರಬೇಕು .
8,"ಶೃಂಗಿ ಹಾಕಿದ ಶಾಪವನ್ನೂ , ಅದರ ಪರಿಹಾರವನ್ನು ಸೂಚಿಸಿಬೇಕು ."
10,ಋಷಿಗಳು ಶಾಪಕ್ಕೆ ಪರಿಹಾರವಾಗಿ ಒಂದು ವಾರ ಭಾಗವತ ಪಠಣ ಮಾಡಲು ಹೇಳಿದ್ದಾರೆ .
15,ಸಂಪೂರ್ಣ ಲೌಕಿಕ ಮತ್ತು ಅಲೌಕಿಕ ಸುಖ ಕೊಡುವ ಭಗವಾನ ನಾರಾಯಣನನ್ನು ಬಿಟ್ಟರೆ ಯಾರೂ ನಿನ್ನ ದುಃಖ ದೂರ ಮಾಡಲಾರರು .
6,ಅದಕ್ಕಾಗಿ ನೀನು ಅವನ ಭಕ್ತಿ ಮಾಡು .
9,ಹೇ ರಾಜಕುಮಾರ ! ನನಗೆ ನಿನ್ನ ಅಂತಃಕರಣದಲ್ಲಿ ಇರುವುದು ತಿಳಿದಿದೆ .
5,ನಿನ್ನ ಇಚ್ಛೆಗಳು ಪೂರ್ಣ ಆಗಲಿ .
14,ಸಮಸ್ಥ ಪ್ರಕಾರದ ಸರ್ವೋತ್ತಮ ಐಶ್ವರ್ಯದ ಭೋಗ ಮತ್ತು ಕೊನೆಯ ಸಮಯದಲ್ಲಿ ನಿನಗೆ ನನ್ನ ಲೋಕ ಪ್ರಾಪ್ತಿ ಆಗುವುದು .
13,"ಈ ಬಳ್ಳಿಯನ್ನು ಕಿತ್ತು ಹಾಕಿರಿ , ಇಲ್ಲವಾದರೆ ಮುಂದೆ ಒಂದು ದಿನ ನಮಗೆ ಕಷ್ಟ ಆಗುವುದು ."
8,ಇಷ್ಟು ಚಿಕ್ಕದಾದ ಬಳ್ಳಿಯು ನಮಗೆ ಹೇಗೆ ಕಷ್ಟದಾಯಕ ಆಗುವುದು ?
18,ಮೆಲ್ಲಮೆಲ್ಲನೆ ಈ ಬಳ್ಳಿಯು ಕೊಂಬೆಗೆ ಹತ್ತಿಕೊಂಡು ಒಂದು ದೊಡ್ಡರೂಪವನ್ನು ಧಾರಣ ಮಾಡಿ ಕೆಳಗಿನಿಂದ ಮೇಲಿನ ತನಕ ಮರದ ಮೇಲೆ ಏರಲು ಸಹಾಯಕ ಆಗುವುದು .
8,ಆಗ ನಮ್ಮ ಮೇಲೆ ಕಣ್ಣಿಟ್ಟಿರುವವರು ಸಹಜವಾಗಿ ನಮ್ಮನ್ನು ಕೊಲ್ಲಬಹುದು .
5,ನಮ್ಮಿಂದ ತಪ್ಪಾಯಿತು ನಮ್ಮನ್ನು ಕ್ಷಮಿಸು .
8,ನಮ್ಮೆಲ್ಲರನ್ನು ಸಂಕಟದಿಂದ ದೂರ ಮಾಡಲು ಏನಾದರೂ ಉಪಾಯ ಹೇಳು .
6,ನನಗೆ ಶೀಘ್ರವಾಗಿ ಈಶ್ವರನ ದರ್ಶನ ಮಾಡಿಸಿಕೊಡಿ .
10,"ನೀವು ಪಕ್ಷಪಾತ ಮಾಡುತ್ತೀರಿ , ನನ್ನ ಗುರುಬಂಧುಗಳಿಗೆ ಹೆಚ್ಚು ಜ್ಞಾನ ಕೊಡುತ್ತೀರಿ ."
6,"ಗುರುಗಳೇ , ಯಾವಾಗ ನಾನು ಉಸಿರಾಡುತ್ತೇನೆ ?"
6,"ಇಲ್ಲವಾದರೆ ಸಾಯುತ್ತೇನೆ , ಅಂತ ಅನಿಸಿತು ."
9,ನೀನು ಶ್ವಾಸಕ್ಕಾಗಿ ಹೇಗೆ ಚಡಪಡಿಸಿದೆ ಹಾಗೆಯೇ ಈಶ್ವರನ ದರ್ಶನಕ್ಕಾಗಿ ಚಡಪಡಿಸಲಿಲ್ಲಾ !
5,ಸಂದೇಹ ಒಂದು ವಿಘ್ನ ಇದೆ .
4,ಅದನ್ನು ದೂರ ಮಾಡು .
4,ನೀನು ಸರಿಯಾಗಿ ನಡೆಯುತ್ತಿಲ್ಲ .
7,ಅದಕ್ಕಾಗಿ ನನಗೆ ಪಲ್ಲಕಿಯಲ್ಲಿ ಕುಳಿತುಕೊಳ್ಳಲು ಕಷ್ಟ ಆಗುತ್ತಿದೆ .
8,ನೀನು ನನ್ನ ಶರೀರಕ್ಕೆ ಹೊಡೆಯಬಹುದು ಆದರೆ ಆತ್ಮಕ್ಕೆ ಅಲ್ಲ .
5,ಅದಕ್ಕಾಗಿ ನಾನು ಮೌನ ಆಗಿರುತ್ತೇನೆ .
14,"ರಾಜಾ ನಿನಗೆ ಕಲ್ಯಾಣ ಆಗಲಿ , ಕಪಿಲಮುನಿಗಳ ಆಶ್ರಮಕ್ಕೆ ಉಪದೇಶ ಕೇಳಲು ಹೊರಟಿರುವೆ ಅಹಂಕಾರವನ್ನು ತ್ಯಾಗ ಮಾಡು ."
12,ಅರೇ ನಮ್ಮ ವಿರುದ್ಧ ಮಾತಾನಾಡಿ ತೋರಿಸು ನಂತರ ನಾವು ನಿನ್ನನ್ನು ಏನು ಮಾಡುತ್ತೇವೆ ನೋಡು !
12,ಮಗನೇ ನೀನು ಮುಸಲ್ಮಾನ ಆಗು ನೀನು ಜೀವಂತವಾಗಿ ಉಳಿದರೆ ಜೀವಿಸುವುದಕ್ಕೆ ಏನಾದರೂ ಅರ್ಥ ಉಳಿಯಬಹುದು .
9,"ಮೃಕಂಡ , ನಿನಗೆ ಬೇಕಾದ ವರವನ್ನು ಕೇಳು ಅದನ್ನು ಅನುಗ್ರಹಿಸುವೆನು ."
12,"ನಿನಗೆ ನೂರು ವರ್ಷ ಆಯುಷ್ಯ ಉಳ್ಳ , ಅಶಿಸ್ತಿನ , ದುರ್ನಡತೆಯ ಮಗ ಬೇಕೋ ?"
15,"ಹದಿನಾರು ವರ್ಷ ಮಾತ್ರ ಬದುಕುವ ಒಳ್ಳೆಯ ಸ್ವಭಾವದ , ಶಿಸ್ತಿನ , ನನ್ನಲ್ಲಿ ಭಕ್ತಿ ಇರುವ ಬಾಲಕ ಬೇಕೋ ."
9,ನನಗೆ ತಮ್ಮಲ್ಲಿ ಭಕ್ತಿ ಇಟ್ಟು ಸದಾ ಪೂಜಿಸುವ ಮಗುವೇ ಬೇಕು ?
6,ಅವನು ಅಲ್ಪಾಯುಷಿ ಆದರೂ ಚಿಂತೆ ಇಲ್ಲ .
3,ನೀವು ಚಿಂತಿಸಬೇಡಿ .
9,ನಾನು ಶಿವನನ್ನು ಮೆಚ್ಚಿಸಿ ಅವನ ಅನುಗ್ರಹದಿಂದ ಯಮನನ್ನು ಜಯಿಸಿ ಹಿಂದಿರುಗುತ್ತೇನೆ .
6,ನಿಮ್ಮ ಆಶೀರ್ವಾದ ನನ್ನ ಮೇಲೆ ಇರಲಿ .
9,"ಮಗುವೇ ನೀನು ಯಮನಿಗೆ ಭಯಪಡದಿರು , ನಿನ್ನ ಪೂಜೆಯನ್ನು ಮುಂದುವರಿಸು ."
9,ಸ್ವಾಮಿ ಮಾರ್ಕಂಡೇಯನ ಬಳಿ ಹೋಗಲು ನಮಗೆ ತುಂಬಾ ಹೆದರಿಕೆ ಆಗುತ್ತಿದೆ .
10,ದಧೀಚಿ ಋಷಿಯ ಬೆನ್ನಿನ ಮೂಳೆಯಿಂದ ಆಯುಧವನ್ನು ಮಾಡಿದರೆ ಅದರಿಂದ ರಾಕ್ಷಸನನ್ನು ವಧಿಸಬಹುದು .
6,ನಾವು ನಿಮ್ಮ ಕಡೆ ಯಾಚಕರಾಗಿ ಬಂದಿದ್ದೇವೆ .
9,ವ್ರತ್ರಾಸುರ ಎಂಬ ರಾಕ್ಷಸನನ್ನು ಸಾಯಿಸಲು ನಮಗೆ ಒಂದು ಆಯುಧವನ್ನು ತಯಾರಿಸಬೇಕಾಗಿದೆ .
6,ಆ ಆಯುಧಕ್ಕಾಗಿ ನಿಮ್ಮ ಮೂಳೆಗಳು ಬೇಕಾಗಿದೆ .
8,ನಿಮ್ಮ ಸಹಾಯ ಇಲ್ಲದೆ ನಮಗೆ ಇದು ಸಾಧ್ಯ ಇಲ್ಲ .
9,"ಇವನಿಗಾಗಿ ಆಶ್ರಮದ ಬಾಗಿಲು ಮುಚ್ಚಿವೆ , ಇವನು ಇಲ್ಲಿಂದ ಹೊರಡಬೇಕು ."
8,ತನ್ನ ಮರಣವು ಮನುಷ್ಯನಿಂದ ಆಗಲಿ ಪ್ರಾಣಿಗಳಿಂದ ಆಗಲಿ ಬರಕೂಡದು .
5,ಹಗಲು ಅಥವಾ ರಾತ್ರಿಯಲ್ಲಿ ಬರಬಾರದು .
6,ಮನೆಯಲ್ಲಿ ಅಥವಾ ಮನೆಯ ಹೊರಗೆ ಬರಬಾರದು .
15,ಬೆಟ್ಟದ ಎತ್ತರದ ಭಾಗದಿಂದ ಆಳವಾದ ಕಂದಕದಲ್ಲಿ ಪ್ರಹ್ಲಾದನನ್ನು ನೂಕಿ ಹಾಗೂ ಹೀಗೆ ಮಾಡಿದ ನಂತರ ಬಂದು ನನಗೆ ತಿಳಿಸಿ .
4,ನಾನು ಕರ್ನಾಟಕದಲ್ಲಿ ಇದ್ದೀನಿ .
9,ನೀನು ನನ್ನನ್ನು ಪಂಢರಪುರಕ್ಕೆ ಕರೆದುಕೊಂಡು ಹೋಗಿ ನನ್ನ ಸ್ಥಾಪನೆಯನ್ನು ಮಾಡು .
10,ಈ ಮಾಲೆಯ ಯಾವ ಮಣಿಯಲ್ಲಿ ನನಗೆ ರಾಮನು ಕಾಣುತ್ತಾನೆ ಎಂದು ನೋಡುತ್ತಿದ್ದೆ .
8,ಯಾವ ಮಣಿಯಲ್ಲಿ ರಾಮನು ಕಾಣಲಿಲ್ಲವೊ ಅದನ್ನು ನಾನು ಒಡೆದುಹಾಕಿದೆ .
9,ನೋಡು ನನ್ನ ಬಳಿ ಬ್ರಹ್ಮಶಿರ ಎಂಬ ಮಹಾ ಅಸ್ತ್ರ ಇದೆ .
9,ಅದನ್ನು ನಿನ್ನ ಶತೃವಿನ ಮೇಲೆ ಪ್ರಯೋಗಿಸಿದರೆ ಅವನ ನಾಶ ನಿಶ್ಚಿತ .
6,ನಾನು ನಿನಗೆ ಈ ಅಸ್ತ್ರವನ್ನು ಕೊಡುತ್ತೇನೆ .
6,ನೀನು ನನಗೆ ನಿನ್ನ ಸುದರ್ಶನವನ್ನು ಕೊಡುವೆಯಾ ?
4,ಈ ವ್ಯಾಪರಕ್ಕೆ ಒಪ್ಪುವೆಯಾ ?
15,"ನಾನು ಕುಂಕುಮ ಯಾಕೆ ಹಚ್ಚುತ್ತೇನೆ ಎಂದರೆ , ಇದರಿಂದ ನಿನ್ನ ಸ್ವಾಮಿಯ ಅಂದರೆ ಶ್ರೀರಾಮನ ಆಯುಷ್ಯವು ಹೆಚ್ಚಾಗಲಿ ಎಂದು ."
6,ನಮಗೆ ಗೋವರ್ಧನ ಪರ್ವತದಿಂದ ಮಳೆ ಬರುತ್ತಿದೆ .
9,ಅದಕ್ಕಾಗಿ ನಾವು ಇನ್ನು ಮುಂದೆ ಇಂದ್ರದೇವನ ಪೂಜೆ ಮಾಡುವುದು ಬೇಡ .
5,ಗೋವರ್ಧನ ಪರ್ವತದ ಪೂಜೆ ಮಾಡೋಣ .
11,"ಅರೇ , ನಾವು ಯಾವ ಪರ್ವತವನ್ನು ಪೂಜಿಸಿದ್ದೇವೆಯೋ ಅವರೇ ನಮ್ಮ ರಕ್ಷಣೆಯನ್ನು ಮಾಡುವರು !"
4,ನಾವು ಎಲ್ಲರೂ ಸಂಘಟಿತರಾಗೋಣ .
12,"ಮಹಾಪ್ರಭೂ , ಒಂದು ದೊಡ್ಡ ಗಿಡುಗವು ನನ್ನನ್ನು ಹಿಡಿದು ತಿನ್ನಬೇಕು ಎಂದು ಅಟ್ಟಿಸಿಕೊಂಡು ಬರುತ್ತಿದೆ ."
5,ನಾನು ಪ್ರಾಣಭಯದಿಂದ ತತ್ತರಿಸಿ ಹೋಗಿದ್ದೇನೆ .
10,ಆದುದರಿಂದ ದಯಾಳು ಆದ ತಾವು ನನಗೆ ಆಶ್ರಯ ಕೊಟ್ಟು ನನ್ನನ್ನು ರಕ್ಷಿಸಿರಿ .
9,"ಎಲೈ ಗಿಡುಗನೇ , ನಾನು ಈ ಪಕ್ಷಿಗೆ ಅಭಯವನ್ನು ಇತ್ತಿದ್ದೇನೆ ."
10,"ಆದುದರಿಂದ ಏನೇ ಆದರೂ ಸರಿ , ಅದನ್ನು ನಿನಗೆ ಬಿಟ್ಟು ಕೊಡಲಾರೆ ."
9,"ಚಕ್ರವರ್ತಿಯೇ , ನೀನು ಧರ್ಮಾಚರಣೆಗೆ ಮತ್ತು ತ್ಯಾಗಕ್ಕೆ ಪ್ರಸಿದ್ಧ ಆಗಿರುವೆ ."
11,ನಿನ್ನ ಬಳಿಗೆ ಹಸಿದು ಬಂದಿರುವವರಿಗೆ ನ್ಯಾಯವಾಗಿ ಸಿಗಬೇಕಾದ ಆಹಾರವು ಸಿಗದಂತೆ ಮಾಡುವುದು ನ್ಯಾಯ ?
7,"ಎಲೈ ಗಿಡುಗನೇ , ನೀನು ಹಸಿದಿರುವೆ ಅಲ್ಲವೇ ?"
6,ನಿನ್ನ ಹಸಿವನ್ನು ನೀಗಿಸಿದರೆ ಆಯಿತು ಅಲ್ಲವೇ ?
5,ಅದಕ್ಕಾಗಿ ಬೇಕಾದಷ್ಟು ಮಾಂಸವನ್ನು ಕೊಡಿಸುವೆ .
3,ಸರಿ ನಡಿ .
8,ಹಾಗಿದ್ದರೆ ನಾವು ಮನೆ ಮನೆಗೆ ಹೋಗಿ ಭಿಕ್ಷೆ ಬೇಡೋಣ .
5,ನನಗೆ ರಾಜ್ಯದಿಂದ ಏನು ಲಾಭ ?
8,ಹಾಗಾಗಿ ನನಗೆ ನೀನು ನೀಡಿರುವ ರಾಜ್ಯವನ್ನು ನಾನು ಇಟ್ಟುಕೊಳ್ಳುವುದಿಲ್ಲ .
8,ಇಂದಿನಿಂದ ನಾನು ನಿನ್ನನ್ನು ನನ್ನ ರಾಜ್ಯವನ್ನು ನೋಡಿಕೊಳ್ಳಲು ನೇಮಿಸುತ್ತೇನೆ .
9,ಅರೇ ನೀನು ಸಹ ನಿನ್ನ ಸ್ವಾಮಿ ಶಿವಾಜಿಯಂತೆ ಗಡಿಬಿಡಿ ಮಾಡುತ್ತೀಯ .
8,ಅದಕ್ಕೆ ಕೈ ಸುಟ್ಟುಕೊಂಡೆ ಮತ್ತು ಸ್ವಲ್ಪ ಅನ್ನವನ್ನು ಬೀಳಿಸಿದೆ .
19,ರಾಜ್ಯವನ್ನು ಉಳಿಸಿಕೊಳ್ಳಬೇಕು ಎಂಬ ಕಾರಣದಿಂದ ತನ್ನ ಮನೆಯ ಹೆಣ್ಣು ಮಕ್ಕಳನ್ನು ಮೊಗಲರಿಗೆ ಮದುವೆ ಮಾಡಿಕೊಟ್ಟಂತಹ ಸ್ವಾಭಿಮಾನ ಶೂನ್ಯ ರಾಜಪೂತನೊಂದಿಗೆ ನಾನು ಕುಳಿತು ಊಟ ಮಾಡುವುದಿಲ್ಲ .
11,ಮಹಾರಾಣಾಪ್ರತಾಪ ! ಯುದ್ಧದಲ್ಲಿ ನಿನ್ನ ಸರ್ವನಾಶ ಮಾಡದಿದ್ದರೆ ನನ್ನ ಹೆಸರು ಮಾನಸಿಂಗನೇ ಅಲ್ಲ !
7,"ಅಣ್ಣಾ , ನಾನು ಮೊಗಲರ ಸೈನ್ಯದಲ್ಲಿ ಇದ್ದೀನಿ ."
6,ನಾನು ನಿಮ್ಮ ಕುದುರೆಗಿಂತಲೂ ತುಚ್ಛ ಆಗಿದ್ದೇನೆ .
12,"ಸರಿ ಹಾಗಿದ್ದರೆ , ನಾಳೆಯೇ ನಾವು ಕರ್ಣ ಮತ್ತು ಧರ್ಮರಾಜರ ಬಳಿ ಹೋಗಿ ಪರೀಕ್ಷಿಸೋಣ ."
8,ರಾಜ್ಯದಲ್ಲಿ ತಕ್ಷಣ ಒಂದು ಬೃಹತ್ ನಿರ್ಮಾಣ ಕಾರ್ಯ ಮಾಡಬೇಕಿದೆ .
4,ಅದಕ್ಕಾಗಿ ಕಟ್ಟಿಗೆ ಬೇಕಾಗಿದೆ .
7,ಮಳೆಯ ಕಾರಣದಿಂದಾಗಿ ಎಲ್ಲಾ ಕಟ್ಟಿಗೆಗಳು ಒದ್ದೆಯಾಗಿ ಬಿಟ್ಟಿದೆ .
5,ಹಾಗಾಗಿ ನಾವು ಕಟ್ಟಿಗೆಯನ್ನು ತರಲಿಲ್ಲ .
18,"ಕರ್ಣಾ , ಇಷ್ಟು ಸಣ್ಣ ವಿಷಯಕ್ಕಾಗಿ ನೀನು ಚಂದನದ ಮರದ , ಕರಕುಶಲ ಕೆತ್ತನೆಯನ್ನು ಮಾಡಲಾಗಿರುವ , ಸುಂದರವಾದ ಮಂಚವನ್ನು ಏಕೆ ಮುರಿದೆ ?"
16,ಈ ವಸ್ತುಗಳನ್ನು ಪುನಃ ಮಾಡಿಸಿಕೊಳ್ಳಬಹುದು ಆದರೆ ಯಾರಿಗಾದರೂ ಸಹಾಯ ಮಾಡುವಂತಹ ಅವಕಾಶವನ್ನು ಕಳೆದುಕೊಂಡರೆ ಅದಕ್ಕಿಂತ ದುಃಖದ ವಿಷಯ ಏನು ಇದೆ ?
12,"ಸರ್ , ನೀವು ನಮ್ಮನ್ನು ಆಗಿನಿಂದ ನೋಡುತ್ತಿದ್ದೀರಿ , ನೀವು ಒಂದು ಬಾರಿ ಪ್ರಯತ್ನಿಸುವಿರೇ ?"
16,"ಸ್ವಾಮೀಜಿ , ನಾನು ಒಂದು ಮುಚ್ಚಿದ ಕೋಣೆಯಲ್ಲಿ ಗಂಟೆಗಟ್ಟೆಲೆ ಕುಳಿತು ಧ್ಯಾನ ಮಾಡುತ್ತೇನೆ , ಆದರೆ ನನಗೆ ಮನಃಶಾಂತಿ ಸಿಗಲಿಲ್ಲ ."
7,ಮೊಟ್ಟಮೊದಲು ನೀನು ನಿನ್ನ ಕೋಣೆಯ ಬಾಗಿಲನ್ನು ತೆರೆದಿಡು .
17,"ಅನಂತರ ಹೊರಗೆ ದುಃಖದಲ್ಲಿ ಇರುವವರನ್ನು , ಅನಾರೋಗ್ಯದಿಂದ ಬಳಲುವವರನ್ನು ಹಾಗೂ ಹಸಿದವರನ್ನು ನೋಡಿ ಅವರಿಗೆ ನಿನ್ನಿಂದ ಸಾಧ್ಯ ಆದಷ್ಟು ಸಹಾಯ ಮಾಡು ."
6,ಈ ಪ್ರಶ್ನೆ ಅತ್ಯಂತ ಮಹತ್ವದ್ದು ಆಗಿದೆ .
8,ಈ ಪ್ರಶ್ನೆಗೆ ಉತ್ತರಿಸದ ಅಭ್ಯರ್ಥಿಗಳಿಗೆ ಉನ್ನತ ಪದವಿಯನ್ನು ನಿರಾಕರಿಸಲಾಗುವುದು .
15,ನಾನು ಯಾವ ಸಮಾಜದಿಂದ ಬಂದಿದ್ದೀನೋ ಅಲ್ಲಿ ಎಲ್ಲರೂ ಬ್ರಿಟಿಷರು ಎಂದರೆ ತುಂಬಾ ಕಟ್ಟುನಿಟ್ಟಾಗಿ ಸಮಯ ಪಾಲಿಸುತ್ತಾರೆ ಎಂದು ತಿಳಿಯುತ್ತಾರೆ .
7,ಆದರೆ ಇಂದು ಅದು ಸುಳ್ಳು ಎಂದು ತಿಳಿಯಿತು .
12,ಮೂರು ದಿವಸ ಪ್ರಯತ್ನ ಮಾಡಿದರೂ ನಾನು ನಿಮಗೆ ಒಂದು ಸೂತ್ರವನ್ನೂ ಕಲಿಸಲು ವಿಫಲ ಆಗಿದ್ದೇನೆ .
11,ಆದ್ದರಿಂದ ನೀವು ನನ್ನ ಬಳಿ ಕಲಿಯುವುದರ ಲಾಭ ಇಲ್ಲ ಎಂದು ನನಗೆ ಅನಿಸುತ್ತದೆ .
4,"ಮಹಾಶಯರೇ , ಕ್ಷಮಿಸಿರಿ ."
6,ನಮಗೆ ನಿಮ್ಮ ಬಗ್ಗೆ ಸಂಶಯ ಇದೆ .
10,ನಿಮ್ಮ ಹತ್ತಿರ ಘಾತಕ ಆಯುಧಗಳು ಇವೆ ಎಂದು ನಿಶ್ಚಿತ ಸುಳಿವು ಸಿಕ್ಕಿದೆ .
5,ಆದ್ದರಿಂದ ನಿಮ್ಮ ತಪಾಸಣೆಯನ್ನು ಮಾಡುತ್ತೇವೆ .
5,ನಿಮಗೆ ಸಿಕ್ಕ ಸುಳಿವು ತಪ್ಪಲ್ಲ .
6,ನನ್ನ ಬಳಿ ಘಾತಕ ಆಯುಧ ಇದೆ .
9,ನಿನಗೆ ಇವನ ಬಗ್ಗೆ ಕಾಳಜಿ ಇದೆ ಎಂದು ನನಗೆ ಅನಿಸುವುದಿಲ್ಲ .
12,ಕಾಳಜಿ ಇದ್ದರೆ ನೀನು ಇವನನ್ನು ಇಷ್ಟು ಹೊತ್ತಿನಲ್ಲಿ ಹೀಗೆ ಹೊರಗೆ ಹೋಗಿ ಆಟವಾಡಲು ಬಿಡುತ್ತಿರಲಿಲ್ಲ .
12,"ಮಹಾರಾಜರೇ , ಇಷ್ಟೊಂದು ಜನರು ಕಾಶಿಯಲ್ಲಿ ಗಂಗಾಸ್ನಾನವನ್ನು ಮಾಡಿದರೂ ಅವರು ಏಕೆ ಪಾವನರು ಆಗುವುದಿಲ್ಲ ?"
23,"ಈ ಗಂಗೆಯಲ್ಲಿ ಸ್ನಾನ ಮಾಡಿದ ನಂತರ ತನ್ನ ಪಾಪವೆಲ್ಲ ಕಳೆದು ತಾನು ಶುದ್ಧ ಆದೆನು ಎಂಬ ಭಾವ ಇರುವ ಯಾತ್ರಿಕನು ನಿನ್ನನ್ನು ಆಲಂಗಿಸಿದರೆ , ನಿನ್ನ ರೋಗವು ಗುಣ ಆಗುವುದು ."
7,ನಿನ್ನ ಕಾಶಿ ಯಾತ್ರೆ ನಿಜವಾಗಿಯೂ ಫಲಕಾರಿ ಆಯಿತು .
5,ನಿನ್ನ ಜೀವನ ಪಾವನ ಆಯಿತು !
3,ನೋಡಿದ್ದೀಯಾ ಸೋಯರಾ !
11,"ಪ್ರೇಮಮಯಿ , ಭಕ್ತವತ್ಸಲ ಆದ ಭಗವಂತನು ಭಕ್ತರಿಗಾಗಿ ಏನು ಮಾಡಲು ಸಿದ್ಧ ಆಗಿದ್ದಾನೆ ."
5,ನಿಧಾನ ! ಇದು ಏನು !
6,ದೇವರ ಪೀತಾಂಬರದ ಮೇಲೆ ಮಜ್ಜಿಗೆ ಚೆಲ್ಲಿದೆಯಲ್ಲ !
5,"ರೈತ ಅಜ್ಜ , ಕೋಪಗೊಳ್ಳದಿರಿ ."
8,"ಹೊಲದಲ್ಲಿ ಪೈರು ಕೊಯ್ದು , ಕಾಳಿನ ಎಣಿಕೆ ಮಾಡಿ ."
6,ನಾನು ದೇವರ ಕಾಳನ್ನು ಹಕ್ಕಿಗಳಿಗೆ ತಿನಿಸಿದ್ದೇನೆ .
5,ನಿಮ್ಮ ಕಾಳು ಹಾಗೆ ಇದೆ .
10,"ರಾಜಾ , ನೀವು ಶಿವರಾತ್ರಿಯಂದು ಉಪವಾಸ ಮತ್ತು ಜಾಗರಣೆಯನ್ನು ಯಾಕೆ ಮಾಡುತ್ತೀರಾ ?"
4,ನಮ್ಮನ್ನು ಪರಕೀಯರು ಆಳುತ್ತಿದ್ದಾರೆ .
4,ಅವರು ಕ್ರೂರಿಗಳು ಆಗಿದ್ದಾರೆ .
8,ಕೃಷ್ಣದೇವರಾಯನು ತನ್ನ ಇಬ್ಬರು ರಾಣಿಯರೊಂದಿಗೆ ಕೈ ಮುಗಿದು ನಿಂತಿರುವ .
6,ಹಳದಿ ಮೈ ತುಂಬ ಕಪ್ಪು ಚುಕ್ಕೆ .
4,ದಷ್ಟಪುಷ್ಟವಾದ ಉದ್ದದ ಮೈ .
5,ಎಷ್ಟು ಜೋರಾಗಿ ಓಡುತ್ತೆ ಗೊತ್ತಾ ?
15,"ಸ್ವಾಮಿ , ನನ್ನ ಹತ್ತಿರ ಇರುವ ಹುಲಿ ಮರಿಯ ಎದುರಿಗೆ ನೀವು ಹಿಡಿದು ತಂದಿರುವ ಹುಲಿ ಬೆಕ್ಕಿಗೆ ಸಮಾನ !"
4,ಎಷ್ಟು ಬದಲಾಗಿ ಹೋಗಿದ್ದೀಯಾ ?
7,ನಿನ್ನ ಅಣ್ಣನಿಗಿಂತ ನಿನಗೆ ವಯಸ್ಸ ಆದಂತೆ ಕಾಣುತ್ತಲ್ಲೋ .
6,"ಅದೆಲ್ಲಾ ಬಿಡು , ಮುಗಿದುಹೋದ ಕಥೆ ."
11,ನಿಮ್ಮ ಅಮ್ಮ ತಮ್ಮ ಕೊನೆಯ ಘಳಿಗೆಯವರೆಗೂ ನೀನು ಬರುತ್ತೀಯಾ ಎಂದು ಕಾಯುತ್ತಲೇ ಇದ್ದರು .
6,ಅವರ ಯಾತನೆಯನ್ನು ನಾನು ಎಂದಿಗೂ ಮರೆಯುವಂತಿಲ್ಲ .
7,"ಮಾವಾ , ನಿಮ್ಮ ಮಗ ರಾಜೀವ ಬಂದಿದ್ದಾನೆ ."
6,"ದಿನಾ ಹಲುಬುತ್ತಿದ್ದಿರಲ್ಲಾ , ನೋಡಿ ಇಲ್ಲಿ ."
9,ಇವತ್ತಿಗೆ ನಿನಗೆ ಈ ಮನೆಯ ಋಣ ತೀರಿಹೋಯಿತು ಎಂದು ತಿಳಿದುಕೊ .
10,ನೀನು ಇನ್ನು ಯಾವುದೇ ಕಾರಣಕ್ಕೆ ಈ ಮನೆಗೆ ಬರುವ ಅಗತ್ಯ ಇಲ್ಲ .
9,ಈ ಮಾತು ನನ್ನ ಅಥವಾ ನಿನ್ನ ತಾಯಿಯ ಸಾವಿಗೂ ಅನ್ವಯಿಸುತ್ತದೆ .
8,ಅಷ್ಟು ಸುಲಭವಾಗಿ ಒಮ್ಮೆಗೆ ಇಲ್ಲಿಗೆ ಬರೋದು ಸಾಧ್ಯವಿಲ್ಲ ಅಪ್ಪಾ .
3,ಮುಂದೆ ನೋಡೋಣ .
10,ನಾನು ಇನ್ನು ಮುಂದೆ ಆಗಾಗ ಬಂದು ನಿನ್ನನ್ನು ನೋಡಿಕೊಂಡು ಹೋಗ್ತಾ ಇರ್ತೀನಿ .
5,ಇಷ್ಟು ವರ್ಷಗಳ ನಂತರ ಬಂದ್ದೀಯ .
6,ಇನ್ನು ಒಂದೆರಡು ದಿನ ಇದ್ದು ಹೋಗು .
5,ಮತ್ತೆ ಯಾವಾಗಲೋ ನೀನು ಬರುವುದು ?
6,ನಾನು ಧಿಡೀರನೆ ಬಂದಿದ್ದರಿಂದ ಹೋಗಲೇ ಬೇಕಾಗಿದೆ .
5,ಸಮಯ ಸಿಕ್ಕಾಗಲೆಲ್ಲಾ ಬರುತ್ತಾ ಇರುತ್ತೇನೆ .
6,"ನೋಡು , ಸುಮ್ನೆ ಸಿದ್ದ ಮಾಡು ."
5,ಬೆಂಗಳೂರು ಬಂದ ಮೇಲೆ ಮಾತಾಡೋಣ .
14,ಇದು ಕೇವಲ ಶಬ್ದ ಘೋಷ ಮಾತ್ರವಲ್ಲ ಮಹಾಸ್ವಾಮಿ ಇದಕ್ಕಾಗಿ ಸಾಕಷ್ಟು ಶ್ರಮ ಮತ್ತು ಹಣವೂ ವಿನಿಯೋಗ ಆಗಿದೆ .
8,ನೀವು ಹೇಗೆ ವಿದ್ಯಾಭ್ಯಾಸ ಮಾಡಿಸುತ್ತೀರಿ ಎಂಬುದನ್ನು ನಾನು ನೋಡಬೇಕಲ್ಲಾ !
3,ನೀವೇ ನೋಡಿ !
11,ಈ ನಾಡಿನಲ್ಲಿ ಗಿಣಿಗಳು ಮೂಢ ಹಕ್ಕಿಗಳಷ್ಟೇ ಅಲ್ಲ ಅವಕ್ಕೆ ಎಳ್ಳಷ್ಟೂ ಕೃತಜ್ಞತೆ ಇಲ್ಲ .
6,ಮಹಾಪ್ರಭು ಗಿಣಿಯ ವಿದ್ಯಾಭ್ಯಾಸ ಇಲ್ಲಿಗೆ ಮುಗಿದಿದೆ .
6,ಗಿಣಿಯನ್ನು ಇಲ್ಲಿ ತನ್ನಿ ನಾನು ನೋಡಬೇಕು .
6,ನೀನು ನೋಡಲಿಕ್ಕೆ ಭಿಕ್ಷುಕ ರೀತಿ ಕಾಣುತ್ತೀಯಾ .
8,ನೀನು ದೇಶವನ್ನು ರಕ್ಷಿಸುತ್ತೀಯಾ ಅಂದರೆ ನಂಬಲಿಕ್ಕೆ ಸಾಧ್ಯ ಆಗುತ್ತಿಲ್ಲ .
13,ಖಡ್ಗ ಇದ್ದರೆ ಮಾತ್ರ ಸಾಕೇ ಆ ನಿನ್ನ ಖಡ್ಗ ನನ್ನ ತಲೆಯನ್ನು ತೆಗೆಯುವಷ್ಟು ಹರಿತ ಆಗಿಲ್ಲ .
8,ಇವರು ಇನ್ನು ಮುಂದೆ ಯಾವುದೇ ಕೆಲಸಕ್ಕೂ ಉಪಯೋಗಕ್ಕೆ ಬರುವುದಿಲ್ಲ .
8,"ಸೈನಿಕರೇ , ಈ ನಾಣ್ಯವನ್ನು ನಾನು ಈಗ ಚಿಮ್ಮಿಸುತ್ತೇನೆ ."
7,"ಅದರ ಮುಂಭಾಗ ಕಂಡರೆ , ನಾವು ಗೆಲ್ಲುತ್ತೇವೆ ."
5,ಹಿಂಭಾಗ ಕಂಡರೆ ನಾವು ಸೋಲುತ್ತೇವೆ .
4,ಅದು ಸಹಜ ಮಗೂ .
8,ಸ್ವಲ್ಪ ಕಾಲ ಜೀವಿಸಿದ ನಂತರ ಎಲ್ಲವೂ ಸಾಯಲೇ ಬೇಕು .
10,"ಸರಿ ನೋಡೋಣ , ಆದರೆ ನೀನು ಈಗ ಒಳ ಉಡುಪುಗಳನ್ನು ಧರಿಸಿರುವೆ ."
7,"ಅಂದಮೇಲೆ ಕಳ್ಳ ಅದನ್ನು ಕಿತ್ತುಕೊಂಡಿಲ್ಲ , ಅಲ್ಲವೇ ?"
8,ಅಂದಮೇಲೆ ಕಳ್ಳ ಈ ಊರಿನವ ಅಲ್ಲ ಎಂಬುದು ಖಾತರಿ .
8,ಆದ್ದರಿಂದ ಈ ಪ್ರಕರಣವನ್ನು ನಾನು ತನಿಖೆ ಮಾಡಿಸಲು ಸಾಧ್ಯವಿಲ್ಲ .
5,ಇದು ನನ್ನ ಕಾರ್ಯವ್ಯಾಪ್ತಿಯಲ್ಲಿ ಇಲ್ಲ .
15,ನಾನು ರಸ್ತೆಯಲ್ಲಿ ಹೋಗುತ್ತಿದ್ದಾಗ ಆ ತನಕ ನಾನು ಭೇಟಿ ಮಾಡದೇ ಇದ್ದ ಪುರುಷನೊಬ್ಬ ಬಂದು ನನಗೆ ಮುತ್ತು ಕೊಟ್ಟ !
5,ನನಗೆ ನ್ಯಾಯ ದೊರಕಿಸಿ ಕೊಡಿ !
9,ನಿನಗೆ ನ್ಯಾಯ ಸಿಗಲೇ ಬೇಕು ಎಂಬ ವಿಷಯವನ್ನು ನಾನು ಒಪ್ಪುತ್ತೇನೆ .
12,ಆದ್ದರಿಂದ ನೀನು ಅವನಿಗೆ ಒಂದು ಮುತ್ತು ಕೊಟ್ಟು ಸೇಡು ತೀರಿಸಿಕೊ ಎಂಬುದಾಗಿ ಆಜ್ಞೆ ಮಾಡುತ್ತಿದ್ದೇನೆ !
11,ನನ್ನ ಕುರಿತಾದ ಅನಾಸಕ್ತಿಯು ಎಂಬುವುದು ನಂಬಲು ಅಸಾಧ್ಯ ಆದ ಮಟ್ಟವನ್ನು ನಾನು ಸಾಧಿಸಿದ್ದೇನೆ .
8,ತತ್ಪರಿಣಾಮವಾಗಿ ನಾನು ಯಾವಾಗಲೂ ಇತರರ ಕುರಿತಾಗಿಯೇ ಆಲೋಚಿಸುತ್ತಾ ಇರುತ್ತೇನೆ .
5,ನನ್ನ ಕುರಿತಾಗಿ ಎಂದೂ ಆಲೋಚಿಸುವುದಿಲ್ಲ .
