senlen,sentences
19,"ಎಷ್ಟು ಪ್ರಮಾಣದ ಪದಾರ್ಥಗಳನ್ನು ಕೊಳ್ಳಲಾಯಿತು, ತಯಾರಿಕೆಗೆ ರವಾನಿಸಿದ್ದು ಎಷ್ಟು ಮತ್ತು ಉಳಿಕೆ ಎಷ್ಟು ಇದೆ ಎಂಬ ವಿಷಯಗಳನ್ನು ದಾಖಲು ಮಾಡುವ ಕಾರ್ಡು ಬಿನ್ ಕಾರ್ಡು ."
6,ಇದು ದಾಸ್ತಾನು ವಿಭಾಗದ ಪ್ರಥಮ ದಾಖಲೆ .
8,ಈ ಕಾರ್ಡು ಪ್ರತೀ ಬಿನ್ನಿನ ಮೇಲೆ ತಗಲು ಹಾಕಲ್ಪಟ್ಟಿರುತ್ತದೆ .
10,ಸರ್ವ ಪದಾರ್ಥ ನಿಯಂತ್ರಣ ದಾಖಲೆಯನ್ನು ಪದಾರ್ಥ ಹತೋಟಿ ದಾಖಲೆ ಎಂದೂ ಕರೆಯಬಹುದಾಗಿದೆ .
21,ದಾಸ್ತಾನು ವಿಭಾಗದಲ್ಲಿ ಪ್ರತೀ ಪದಾರ್ಥದ ವಿವರಗಳನ್ನು ದಾಖಲು ಮಾಡಲು ಬಿನ್ ಕಾರ್ಡನ್ನು ಪ್ರಥಮ ದಾಖಲೆ ಆಗಿಸಿದ್ದರ ಜೊತೆಗೆ ಸರ್ವ ಪದಾರ್ಥ ನಿಯಂತ್ರಣ ದಾಖಲೆಯನ್ನು ದಾಸ್ತಾನು ಅಧಿಕಾರಿ ಇಡಬೇಕಾಗುತ್ತದೆ .
7,ಬಿನ್ ಕಾರ್ಡನ್ನು ಪ್ರತೀ ಬಿನ್ನಿನಲ್ಲಿ ತಗಲು ಹಾಕಿರಲಾಗುತ್ತದೆ .
13,"ಯಾವುದೇ ಸಂದರ್ಭದಲ್ಲಿ ಪದಾರ್ಥ ವಿವರಗಳನ್ನು ತಿಳಿದುಕೊಳ್ಳಬೇಕು , ಆದರೆ ಪ್ರತೀ ಬಿನ್ನಿನ ಸ್ಥಳಕ್ಕೆ ಭೇಟಿ ನೀಡಬೇಕಾಗುತ್ತದೆ ."
22,ಆದುದರಿಂದ ಈ ಅನನುಕೂಲವನ್ನು ತಪ್ಪಿಸಲು ಸರ್ವ ಪದಾರ್ಥದ ನಿಯಂತ್ರಣ ದಾಖಲೆಯನ್ನು ಇಟ್ಟು ಬಿನ್ ಕಾರ್ಡಿನಲ್ಲಿ ಪ್ರತೀ ಪದಾರ್ಥಕ್ಕೆ ಸಂಬಂಧಿಸಿದ ವಿವರಗಳನ್ನು ಈ ದಾಖಲೆಯಲ್ಲಿ ಎಲ್ಲ ಪದಾರ್ಥದ ವಿವರಗಳನ್ನು ದಾಖಲಿಸಬೇಕಾಗುತ್ತದೆ .
27,ಬಿನ್ ಕಾರ್ಡ್ ದಾಖಲೆಗೂ ಸರ್ವ ಪದಾರ್ಥ ನಿಯಂತ್ರಣ ದಾಖಲೆಗೂ ಯಾವ ವ್ಯತ್ಯಾಸ ಇಲ್ಲದಿದ್ದರೂ ಬಿನ್ ಕಾರ್ಡಿನಲ್ಲಿ ಒಂದೇ ಒಂದು ಪದಾರ್ಥದ ವಿವರಗಳು ಇದ್ದರೆ ಸರ್ವ ಪದಾರ್ಥ ನಿಯಂತ್ರಣ ದಾಖಲೆಗಳಲ್ಲಿ ಎಲ್ಲ ಪದಾರ್ಥಗಳ ವಿವರಗಳು ದಾಖಲು ಆಗಿರುತ್ತವೆ .
15,ಈ ಸರ್ವ ಪದಾರ್ಥ ನಿಯಂತ್ರಣ ದಾಖಲೆ ದಾಸ್ತಾನು ಅಧಿಕಾರಿಗೆ ಹೆಚ್ಚು ಪ್ರಯೋಜನಕಾರಿ ಆಗಿರುತ್ತದೆ ಮತ್ತು ಕೆಲಸ ಸುಲಭ ಆಗುತ್ತದೆ .
5,ಕಾಲ ವಿಳಂಬ ಆಗುವುದನ್ನು ತಪ್ಪಿಸುತ್ತದೆ .
5,ಪದಾರ್ಥಗಳ ಮೇಲಿನ ಹತೋಟಿ ಇರುತ್ತದೆ .
13,ಯಾವ ಪದಾರ್ಥ ಕೊಳ್ಳುವ ಕೋರಿಕೆ ಮಟ್ಟ ತಲುಪಿದೆ ಎಂಬುದನ್ನು ತಮ್ಮ ಕಛೇರಿಯಲ್ಲೇ ನೋಡಿಕೊಳ್ಳುವ ಕೋರಿಕೆ ಸಲ್ಲಿಸಬಹುದು .
14,ಇಲ್ಲವಾದಲ್ಲಿ ಪ್ರತೀ ಬಿನ್ನಿನ ಸ್ಥಳಕ್ಕೂ ಭೇಟಿ ನೀಡಿ ವಿವರಗಳನ್ನು ಪಡೆದುಕೊಳ್ಳುವುದು ಕಾಲ ವಿಳಂಬಕ್ಕೆ ಎಡೆ ಕೊಟ್ಟಂತೆ ಆಗುತ್ತದೆ .
22,ಸರ್ವ ಪದಾರ್ಥ ನಿಯಂತ್ರಣ ದಾಖಲೆ ಪದಾರ್ಥಗಳ ಮೇಲೆ ಹತೋಟಿ ಇಟ್ಟುಕೊಳ್ಳಲು ಸಹಾಯಕ ಆಗುವುದರ ಜೊತೆಗೆ ಸಂಸ್ಥೆ ಆಗಿಂದಾಗ್ಗೆ ತಿಳಿದುಕೊಳ್ಳಬೇಕಾಗುವ ವಿಷಯ ಏನೆಂದರೆ ಒಟ್ಟು ದಾಸ್ತಾನು ಪ್ರಮಾಣ ಮತ್ತು ಮೌಲ್ಯ .
20,ಇದು ಸಂಸ್ಥೆಯ ಲೆಕ್ಕಗಳನ್ನು ಆಖೈರು ಮಾಡಲು ಮತ್ತು ಲಾಭವೇ ಅಥವಾ ನಷ್ಟವೇ ಎನ್ನುವುದನ್ನು ತನ್ನಲ್ಲಿ ಇರುವ ದಾಸ್ತಾನಿನ ಮೌಲ್ಯದ ಆಧಾರದ ಮೇಲೆ ಸಾಲಗಳನ್ನು ಎತ್ತಲು ಯೋಜಿಸಿರುತ್ತಾರೆ .
11,ಇದಕ್ಕಾಗಿ ಒಟ್ಟು ದಾಸ್ತಾನು ಎಷ್ಟು ಇದೆ ಎಂಬುದನ್ನು ಸರ್ವ ಪದಾರ್ಥ ದಾಖಲೆಯಿಂದ ಪಡೆಯಬಹುದು .
17,ಈ ದಾಖಲೆ ಒಂದೇ ಪುಸ್ತಕ ಆಗಿರಬಹುದು ಅಥವಾ ಪ್ರತೀ ಪದಾರ್ಥಕ್ಕೆ ಒಂದು ಹಾಳೆ ಇಟ್ಟು ಒಂದು ದೊಡ್ಡ ದಪ್ತರಕ್ಕೆ ಫೈಲ್ ಮಾಡಬಹುದು .
8,ಒಂದೇ ಪುಸ್ತಕಕ್ಕಿಂತ ಪ್ರತ್ಯೇಕ ಹಾಳೆಯ ದಪ್ತರ ಅನುಕೂಲ ಆಗಿರುತ್ತದೆ .
21,ಕೊಂಡ ಪದಾರ್ಥದ ಒಟ್ಟು ಖುದ್ದು ಪ್ರಮಾಣ ದಾಖಲೆಯಲ್ಲಿ ನಮೂದಿಸಿರುವ ವಿವರಗಳ ಒಡನೆ ತಾಳೆ ಇರಬೇಕು ಅಥವಾ ದಾಖಲೆಯಲ್ಲಿ ಇರುವ ಅಂಕಿ ಅಂಶದಂತೆ ಖುದ್ದು ಪದಾರ್ಥ ಪ್ರಮಾಣ ಇರಬೇಕು .
8,ಯಾವುದೇ ಒಂದರಲ್ಲಿ ವ್ಯತ್ಯಾಸ ಕಂಡುಬಂದರೂ ಸರಿಯಾದ ಮಾಹಿತಿ ದೊರಕುವುದಿಲ್ಲ .
9,ಖುದ್ದು ಪದಾರ್ಥಕ್ಕೂ ದಾಖಲೆಯ ಅಂಕಿಗೂ ವ್ಯತ್ಯಾಸ ಕಂಡುಬರುವ ಸಾಧ್ಯತೆಗಳು ಇರುತ್ತವೆ .
6,ಈ ಸಾಧ್ಯತೆಗಳಿಗೆ ಕಾರಣಗಳು ಕೆಳಕಂಡಂತೆ ಇವೆ .
14,ಒಂದನೆಯ ಅಂಶ ಎಂದರೆ ಉತ್ಪಾದನಾ ವಿಭಾಗಕ್ಕೆ ಪದಾರ್ಥ ರವಾನಿಸುವಾಗ ತಪ್ಪಾದ ಎಣಿಕೆ ಅಥವಾ ತಪ್ಪಾದ ತೂಕ ಮಾಡಿರುವುದು .
10,ಎರಡನೆಯ ಅಂಶ ಎಂದರೆ ಪದಾರ್ಥ ಸ್ವಭಾವದ ಕಾರಣ ಕಡಿಮೆ ತೂಕ ಬರಬಹುದು .
11,ಮೂರನೆಯ ಅಂಶ ಎಂದರೆ ಅವ್ಯವಸ್ಥಿತ ಮತ್ತು ಅವೈಜ್ಞಾನಿಕ ಪದಾರ್ಥ ಜೋಡಣೆ ಮತ್ತು ದಾಖಲೆ .
3,4 ಕಳವು .
15,ದಾಸ್ತಾನು ಅಧಿಕಾರಿಯು ಪದಾರ್ಥವನ್ನು ಕೊಳ್ಳಲು ಕೋರಿಕೆ ಪತ್ರ ಸಲ್ಲಿಸಬೇಕು ಆದರೆ ದಾಖಲೆಯಲ್ಲಿ ಇರುವ ಅಂಕಿಗಳನ್ನು ಆಧಾರ ಆಗಿ ಇಟ್ಟುಕೊಳ್ಳಬೇಕಾಗುತ್ತದೆ .
10,ಏಕೆಂದರೆ ಪ್ರತೀ ಬಾರಿಯೂ ಪ್ರತೀ ಪದಾರ್ಥವನ್ನು ಎಣಿಕೆ ಮಾಡಲು ಸಾಧ್ಯ ಆಗುವುದಿಲ್ಲ .
20,"ಆದುದರಿಂದ ಯಾವುದೇ ಸಂದರ್ಭದಲ್ಲಿ ಖುದ್ದು ಪದಾರ್ಥಕ್ಕೂ ದಾಖಲು ಆದ ಅಂಕಿಗಳಿಗೂ ತಾಳೆ ಇರಬೇಕಾದರೆ , ಆಗಾಗ್ಗೆ ಖುದ್ದು ಪದಾರ್ಥವನ್ನು ಮತ್ತು ದಾಖಲೆಯ ಅಂಕಿಗಳನ್ನು ತಪಾಸಣೆ ಮಾಡಬೇಕು ."
13,ಯಾವುದೇ ವ್ಯತ್ಯಾಸ ಕಂಡುಬಂದರೆ ಖುದ್ದು ಪದಾರ್ಥದ ಪ್ರಮಾಣಕ್ಕೆ ದಾಖಲೆಯ ಅಂಕಿಗಳನ್ನು ಜಾಸ್ತಿ ಅಥವಾ ಕಡಿಮೆ ಮಾಡಿಕೊಳ್ಳಬೇಕಾಗುತ್ತದೆ .
12,ವ್ಯತ್ಯಾಸ ಕಂಡುಬಂದ ಪದಾರ್ಥ ಪ್ರಮಾಣವನ್ನು ಜಾಸ್ತಿ ಅಥವಾ ಕಡಿಮೆ ಮಾಡಲು ತಕ್ಷಣ ಸಾಧ್ಯ ಆಗುವುದಿಲ್ಲ .
9,ಖುದ್ದು ಪದಾರ್ಥ ತಪಾಸಣೆಯನ್ನು ಈ ಕೆಳಕಂಡ ಎರಡು ಪದ್ಧತಿಗಳಲ್ಲಿ ನಡೆಸಬಹುದು .
7,ಒಂದನೆಯ ಅಂಶ ಎಂದರೆ ಎಡೆಬಿಡದೆ ಮಾಡುವ ತಪಾಸಣೆ .
6,ಎರಡನೆಯ ಅಂಶ ಎಂದರೆ ವಾರ್ಷಿಕ ತಪಾಸಣೆ .
12,ಸಂಸ್ಥೆಯ ಚಟುವಟಿಕೆ ಮತ್ತು ಅನುಕೂಲಗಳಿಗೆ ಅನುಗುಣವಾಗಿ ಯಾವುದಾದರೂ ಒಂದು ಪದ್ಧತಿಯನ್ನು ಪದಾರ್ಥ ತಪಾಸಣೆಗಾಗಿ ಅಳವಡಿಸಿಕೊಳ್ಳಬಹುದು .
24,ಒಂದನೆಯ ಅಂಶ ಎಂದರೆ ಎಡೆಬಿಡದೆ ಮಾಡುವ ತಪಾಸಣೆ : ಹದಿನೈದು ದಿನಗಳಿಗೆ ಒಮ್ಮೆ ಅಥವಾ ತಿಂಗಳಿಗೆ ಒಮ್ಮೆ ಖುದ್ದು ಪದಾರ್ಥ ಮತ್ತು ದಾಖಲೆಯ ಅಂಕಿಗಳನ್ನು ತಾಳೆ ನೋಡುವುದು ಈ ಪದ್ಧತಿಯ ಕ್ರಮ .
7,ಈ ಪದ್ಧತಿಯ ತಪಾಸಣೆಯಲ್ಲಿ ಬಹಳ ಅನುಕೂಲಗಳು ಇವೆ .
10,ಅವುಗಳು ಯಾವುವು ಎಂದರೆ : ಪದಾರ್ಥ ಶಿಲ್ಕು ವ್ಯತ್ಯಾಸಗಳನ್ನು ಆಗಿಂದಾಗ್ಗೆ ಸರಿಪಡಿಸಿಕೊಳ್ಳಬಹುದು .
10,ಖುದ್ದು ಪದಾರ್ಥ ಪ್ರಮಾಣಕ್ಕೂ ದಾಖಲು ಆದ ಅಂಕಿಗೂ ಯಾವಾಗಲೂ ತಾಳೆ ಇರುತ್ತದೆ .
11,ದಾಸ್ತಾನು ಅಧಿಕಾರಿಯು ದಾಖಲೆಯ ಆಧಾರದ ಮೇಲೆ ಪದಾರ್ಥ ಕೋರಿಕೆ ಪತ್ರವನ್ನು ಸಲ್ಲಿಸುತ್ತ ಇರಬಹುದು .
20,"ಈ ಪದ್ಧತಿಯ ತಪಾಸಣೆಯಲ್ಲಿ ಪದಾರ್ಥ ಶಿಲ್ಕು ವ್ಯತ್ಯಾಸದ ಕಾರಣಗಳನ್ನು ತಕ್ಷಣ ಸರಿಪಡಿಸಿ , ಕಳವು , ಅವ್ಯವಸ್ಥಿತ ಜೋಡಣೆ ಮತ್ತು ದಾಖಲಾತಿಯ ಬಗ್ಗೆ ಕ್ರಮ ಜರುಗಿಸಬಹುದು ."
12,ಎಡೆಬಿಡದೆ ತಪಾಸಣೆ ಇದ್ದರೆ ಪದಾರ್ಥ ಜೋಡಣೆ ಮತ್ತು ದಾಖಲಾತಿಯ ಕೆಲಸಗಾರರು ಸದಾ ಎಚ್ಚರದಿಂದ ಇರುತ್ತಾರೆ .
9,ಕಾರಣ ತಮ್ಮ ಮೇಲೆ ಕ್ರಮ ಜರುಗಬಹುದು ಎಂಬ ಎಚ್ಚರಿಕೆ ಇರುತ್ತದೆ .
8,6 ) ದೈನಂದಿನ ದಾಖಲಾತಿಗಳು ಸಮಯಕ್ಕೆ ಸರಿಯಾಗಿ ಆಗುತ್ತಿರುತ್ತವೆ .
8,ಈ ಪದ್ಧತಿಯಲ್ಲಿ ಇರುವ ಅನನುಕೂಲಗಳು ಮತ್ತು ಅವುಗಳ ಪರಿಹಾರ .
20,ಈ ಪದ್ಧತಿಯಂತೆ ಎಡೆಬಿಡದೆ ತಪಾಸಣೆ ಆಗುತ್ತಾ ಇರಬೇಕಾದರೆ ದಾಸ್ತಾನು ವಿಭಾಗದಲ್ಲಿ ದಾಖಲೆಗಳು ತಪಾಸಣಾ ಅಧಿಕಾರಿಗಳ ವಶ ಇರಬೇಕಾದಾಗ ಸ್ವಲ್ಪ ಕೆಲಸಗಳು ಕುಂಠಿತ ಆಗುವ ಸಂಭವ ಇರುತ್ತದೆ .
13,"ಆದರೆ ವ್ಯವಸ್ಥಿತವಾಗಿ ತಪಾಸಣೆಯನ್ನು ನಡೆಸುತ್ತಾ ಇದ್ದರೆ , ಯಾವ ಕೆಲಸವೂ ಕುಂಠಿತ ಆಗುವ ಸಂಭವ ಇರುವುದಿಲ್ಲ ."
7,ಇಂತಹ ರೀತಿಯ ಯೋಜನೆಯನ್ನು ವೆಚ್ಚ ಶಾಸ್ತ್ರಜ್ಞನೂ ನಿರ್ವಹಿಸಿಕೊಳ್ಳಬೇಕಾಗುತ್ತದೆ .
11,"ಎರಡನೆಯ ಅನನುಕೂಲ ಎನ್ನುವುದು , ಈ ಪದ್ಧತಿಯಿಂದ ಅತಿ ವೆಚ್ಚ ಆಗಬಹುದು ಎಂದು ."
11,"ಏಕೆಂದರೆ ಪ್ರತ್ಯೇಕ ತಪಾಸಣಾ ಸಿಬ್ಬಂದಿ ಏರ್ಪಡಿಸಬೇಕಾಗಿದ್ದು , ಇವರಿಗೆ ತಗುಲುವ ಸಂಬಳ ಖರ್ಚು ."
11,ಆದರೆ ಈ ಪದ್ಧತಿಯಿಂದ ಉಂಟಾಗುವ ಅನುಕೂಲಗಳನ್ನು ಪರಿಶೀಲಿಸಿದಾಗ ಅನನುಕೂಲಗಳು ಬಹಳ ಕಡಿಮೆ ಎನಿಸುತ್ತದೆ .
26,"ಲಕ್ಷಾಂತರ ರೂಪಾಯಿ ಮಾಲನ್ನು ದಾಸ್ತಾನು ವಿಭಾಗದಲ್ಲಿ ಶೇಖರಿಸಿ ಇಟ್ಟು ಅವುಗಳ ನಿರ್ವಹಣೆ ಮತ್ತು ಲೆಕ್ಕಾಚಾರದ ಬಗ್ಗೆ ಮೇಲಿನ ಕೇವಲ ಅನನುಕೂಲಗಳಿಂದ ಎಡೆಬಿಡದ ತಪಾಸಣೆ ಪದ್ಧತಿಯನ್ನು ಅಳವಡಿಸಿಕೊಳ್ಳದೆ ಇದ್ದರೆ , ತಗುಲುವ ನಷ್ಟ ಬಹಳ ಇರುತ್ತದೆ ."
12,ವೆಚ್ಚಲೆಕ್ಕ ಶಾಸ್ತ್ರದ ತತ್ವಗಳ ಆಧಾರಕ್ಕೆ ಬೆಲೆ ಇಲ್ಲದಿದ್ದು ವೆಚ್ಚ ನಿರ್ಣಯ ವಿಭಾಗದ ಅವಶ್ಯಕತೆಯೇ ಇರುವುದಿಲ್ಲ .
7,ಇದರಿಂದಾಗಿ ಅವ್ಯವಸ್ಥೆ ಮತ್ತು ಅವೈಜ್ಞಾನಿಕ ಪರಿಸ್ಥಿತಿ ಉಂಟಾಗುತ್ತದೆ .
10,ವರ್ಷಕ್ಕೆ ಒಮ್ಮೆ ಖುದ್ದು ಪದಾರ್ಥದ ಪ್ರಮಾಣವನ್ನು ದಾಖಲೆಯ ಅಂಕಿಯೊಡನೆ ತಾಳೆ ನೋಡಬೇಕಾಗುತ್ತದೆ .
7,ಸಣ್ಣ ಉದ್ಯಮಗಳಲ್ಲಿ ಈ ಪದ್ಧತಿಯ ಕ್ರಮ ಇರಬಹುದು .
7,ಈ ಕ್ರಮದ ಉದ್ದೇಶ ಎರಡು ಬಗೆಯದು ಇರುತ್ತದೆ .
13,1 ) ವಾರ್ಷಿಕ ಲೆಕ್ಕಗಳನ್ನು ಸಿದ್ಧಪಡಿಸಲು ಬೇಕಾಗುವ ಒಟ್ಟು ಪದಾರ್ಥ ಪ್ರಮಾಣ ಮತ್ತು ಮೌಲ್ಯ ಅವಶ್ಯಕ .
10,2 ) ಖುದ್ದು ಪದಾರ್ಥ ಮತ್ತು ದಾಖಲೆಗಳ ಅಂಕಿಗಳನ್ನು ತಾಳೆ ನೋಡುವುದು .
12,ಸಂಸ್ಥೆಯು ಪದಾರ್ಥ ತಪಾಸಣೆಯ ಯಾವುದೇ ಪದ್ಧತಿಯನ್ನು ಅಳವಡಿಸಿ ಕೊಂಡರೂ ವಾರ್ಷಿಕ ತಪಾಸಣೆ ಇದ್ದೇ ಇರುತ್ತದೆ .
19,ವಾರ್ಷಿಕ ಲೆಕ್ಕಗಳನ್ನು ಆಖೈರು ಮಾಡಿ ಲಾಭವೇ ಅಥವಾ ನಷ್ಟವೇ ಎಂಬುದನ್ನು ನೋಡುವುದಕ್ಕೆ ಮತ್ತು ಒಟ್ಟು ಆಸ್ತಿ ನೋಡಲು ಈ ವಾರ್ಷಿಕ ತಪಾಸಣೆ ಅನುಕೂಲ ಆಗಿದೆ .
28,"ಈ ದೃಷ್ಟಿಯಿಂದ ಅನುಕೂಲ ಇದ್ದರೂ , ವರ್ಷದ ಆದಿಯಿಂದ ಅಂತ್ಯದವರೆಗೆ ದಾಸ್ತಾನು ವಿಭಾಗದಲ್ಲಿ ನಡೆಯುವ ಚಟುವಟಿಕೆಗಳನ್ನು ವರ್ಷದ ಕೊನೆಯಲ್ಲಿ ಅಳೆಯುವುದು ಆದರೆ ಪದಾರ್ಥ ಪ್ರಮಾಣದ ಯಾವುದೇ ವ್ಯತ್ಯಾಸಗಳಿಗೆ ಏನು ಕ್ರಮ ಜರುಗಿಸಬೇಕಾದರೂ ವಾರ್ಷಿಕ ತಪಾಸಣೆಯ ಅನಂತರವೇ ಆಗುತ್ತದೆ ."
16,"ವರ್ಷ ಮಧ್ಯದಲ್ಲಿ ಯಾವುದೇ ನಷ್ಟವು ಕಳವುನಿಂದ ಆಗಿರಬಹುದು , ಅಸ್ತವ್ಯಸ್ತ ದಾಸ್ತಾನು ಪದ್ಧತಿಯಿಂದ ಆಗಿರಬಹುದು ಮತ್ತು ಕೆಲಸಗಾರರ ಅಸಾಮರ್ಥ್ಯದಿಂದ ಇರಬಹುದು ."
27,"ಇಂತಹ ಸಂದರ್ಭದಲ್ಲಿ ತಪಾಸಣೆ ಇಲ್ಲದ ಕಾರಣ , ವಾರ್ಷಿಕ ತಪಾಸಣೆಗಾಗಿ ಕಾದು , ವಿವರಗಳನ್ನು ಪಡೆದು , ಕಾರಣಗಳನ್ನು ನೋಡಿ ಕ್ರಮ ಜರುಗಿಸುವುದು ಆದರೆ ಕೆಲಸಗಾರರಿಗೆ ತಮ್ಮ ಅಸಾಮರ್ಥ್ಯದ ತಪ್ಪುಗಳನ್ನು ಮುಚ್ಚಿಡಲು ಅವಕಾಶ ಕೊಟ್ಟಂತೆ ಆಗುತ್ತದೆ ."
12,ಮೇಲಾಗಿ ಉತ್ಪಾದನಾ ವಿಭಾಗಕ್ಕೆ ಪದಾರ್ಥವನ್ನು ಸತತವಾಗಿ ರವಾನಿಸಬೇಕಾಗಿ ಇರುವುದರಿಂದ ಇಂತಹ ಘಟನೆಗಳಿಂದ ಕುಂದು ಉಂಟಾಗುತ್ತದೆ .
9,ಇಂದಿನ ವೈಜ್ಞಾನಿಕ ಯುಗದಲ್ಲಿ ಸಂಸ್ಥೆಗಳು ಸಣ್ಣ ಅಥವಾ ದೊಡ್ಡದು ಇರಬಹುದು .
7,ಆದರೆ ವೈಜ್ಞಾನಿಕ ತತ್ವಗಳನ್ನು ಅಳವಡಿಸಿಕೊಳ್ಳುವುದು ಉತ್ತಮ ಆಗಿರುತ್ತದೆ .
13,"ಯಾವ ಉದ್ಯಮದಲ್ಲಿ ತಪಾಸಣೆಗಾಗಿ ಪ್ರತ್ಯೇಕ ಸಿಬ್ಬಂದಿಯನ್ನು ಏರ್ಪಡಿಸಲಾಗದೆ ಇದ್ದರೂ , ಇರುವ ಸಿಬ್ಬಂದಿಯನ್ನು ತಪಾಸಣೆಗಾಗಿ ಉಪಯೋಗಿಸಿಕೊಳ್ಳಬೇಕಾಗುತ್ತದೆ ."
11,ಹಾಳು ಆದ ಅಥವಾ ನಷ್ಟ ಆದ ಪದಾರ್ಥ ನಷ್ಟದಲ್ಲಿ ಎರಡು ಬಗೆಗಳು ಇವೆ .
9,ಅವುಗಳು ಯಾವುವು ಎಂದರೆ : ಸಾಮಾನ್ಯ ನಷ್ಟ ಅಸಾಮಾನ್ಯ ನಷ್ಟ .
8,ತಯಾರಿಕಾ ಸಂಸ್ಥೆಗಳಲ್ಲಿ ಪದಾರ್ಥ ನಷ್ಟ ಸಂಭವಿಸುವುದು ಅಸಾಮಾನ್ಯವೇನೂ ಅಲ್ಲ .
9,ಆದರೆ ಸಂಭವಿಸಿದ ನಷ್ಟವು ಸಾಮಾನ್ಯವೇ ಅಥವಾ ಅಸಾಮಾನ್ಯವೇ ಎನ್ನುವುದು ಪ್ರಶ್ನೆ .
4,ಒಂದು ಸಾಮಾನ್ಯ ನಷ್ಟ .
13,ವಸ್ತುಗಳನ್ನು ತಯಾರಿಸುವ ವಿವಿಧ ಹಂತಗಳಲ್ಲಿ ಪದಾರ್ಥ ಉಪಯೋಗ ಆಗುವಾಗ ಪದಾರ್ಥದ ಕನಿಷ್ಠ ಅಂಶ ಹಾಳು ಆಗುತ್ತದೆ .
7,ಈ ನಷ್ಟವು ಪದಾರ್ಥ ಸ್ವಭಾವಕ್ಕೆ ಅನುಗುಣವಾಗಿ ಇರುತ್ತದೆ .
11,ಪದಾರ್ಥ ಸ್ವಭಾವಕ್ಕೆ ಅನುಗುಣವಾಗಿ ಪದಾರ್ಥದಲ್ಲಿ ಇರುವ ಕನಿಷ್ಠ ಅಂಶ ಹಾಳು ಆಗಲೇ ಬೇಕಾಗುತ್ತದೆ .
7,ಈ ನಷ್ಟವನ್ನು ಸಾಮಾನ್ಯ ನಷ್ಟ ಎಂದು ಪರಿಗಣಿಸಲಾಗುವುದು .
8,ಇದನ್ನು ತಪ್ಪಿಸಲು ಸಾಧ್ಯ ಆಗುವುದಿಲ್ಲ ಮತ್ತು ನಿಯಂತ್ರಿಸಲು ಆಗುವುದಿಲ್ಲ .
19,"ಉದಾ : ಪೀಠೋಪಕರಣಗಳಿಗೆ ಉಪಯೋಗಿಸುವ ಮರ , ಗಾಳಿಯಲ್ಲಿ ಆವಿ ಆಗುವ ದ್ರವ ಪದಾರ್ಥಗಳು , ಗುಣಮಟ್ಟದಲ್ಲಿ ಕಡಿಮೆಯಾಗಿ ಹಾಳು ಆಗುವ ಹತ್ತಿ ಇತ್ಯಾದಿಗಳು ."
8,ಅಂದರೆ ಸಂಭವಿಸಲೇ ಬೇಕಾದದ್ದನ್ನು ಸಾಮಾನ್ಯ ನಷ್ಟ ಎಂದು ಪರಿಗಣಿಸಲಾಗುತ್ತದೆ .
7,ಈ ನಷ್ಟವನ್ನು ಹಿಡಿತದಲ್ಲಿ ಇಟ್ಟುಕೊಳ್ಳಲು ಸಾಧ್ಯ ಇಲ್ಲ .
11,ವೆಚ್ಚಲೆಕ್ಕ ಶಾಸ್ತ್ರದ ಪ್ರಕಾರ ಸಾಮಾನ್ಯ ನಷ್ಟವನ್ನು ಒಳ್ಳೆಯ ಅಂಶಗಳಿಂದ ಹೆಚ್ಚುವರಿ ಬೆಲೆಯಲ್ಲಿ ಪಡೆದುಕೊಳ್ಳಬೇಕಾಗುತ್ತದೆ .
13,ಸಾಮಾನ್ಯ ನಷ್ಟಕ್ಕಿಂತಲೂ ಹೆಚ್ಚುವರಿ ಪದಾರ್ಥ ನಷ್ಟ ಸಂಭವಿಸಿದಾಗ ಅಂತಹ ನಷ್ಟವನ್ನು ಅಸಾಮಾನ್ಯ ನಷ್ಟ ಎಂದು ಪರಿಗಣಿಸಲಾಗುವುದು .
17,"ಅಸಾಮಾನ್ಯ ನಷ್ಟ ಸಂಭವಿಸಲು ಹಲವಾರು ಕಾರಣಗಳು ಇದ್ದು , ಅವುಗಳಲ್ಲಿ ಕೆಲವು ಕಾರಣಗಳನ್ನು ನಿಯಂತ್ರಿಸಬಹುದಾಗಿದ್ದು , ಇನ್ನು ಕೆಲವುಗಳನ್ನು ನಿಯಂತ್ರಿಸಲು ಆಗುವುದಿಲ್ಲ ."
9,ನಿಯಂತ್ರಿಸಬಹುದಾದ ಕಾರಣಗಳು ಎಂದರೆ : ಒಂದು ) ಅಸಾಮರ್ಥ್ಯದ ಕೆಲಸಗಳು .
8,ಎರಡು ) ಲೋಪ ಉಳ್ಳ ಯಂತ್ರದಿಂದ ವಸ್ತು ತಯಾರಿಸುವುದು .
7,ಮೂರು ) ಕಡಿಮೆ ದರ್ಜೆ ಪದಾರ್ಥ ಉಪಯೋಗಿಸುವುದು .
10,ನಾಲ್ಕು ) ಉತ್ಪಾದನಾ ವಿಭಾಗಕ್ಕೆ ಪದಾರ್ಥವನ್ನು ಸತತವಾಗಿ ರವಾನಿಸದೆ ಅಸ್ತವ್ಯಸ್ತ ಇರುವುದು .
11,ಐದು ) ಕೊಳ್ಳುವ ವಿಭಾಗ ಮತ್ತು ದಾಸ್ತಾನು ವಿಭಾಗದಲ್ಲಿ ವ್ಯವಸ್ಥಿತ ಯೋಜನೆ ಇಲ್ಲದಿರುವುದು .
8,ಆರು ) ಉತ್ಪಾದನೆಗೆ ಸಂಬಂಧಪಟ್ಟ ವಿಭಾಗಗಳಲ್ಲಿ ಸಹಕಾರ ಇಲ್ಲದಿರುವುದು .
6,ಈ ಕಾರಣಗಳಿಂದ ಅಸಾಮಾನ್ಯ ನಷ್ಟ ಉಂಟಾಗುತ್ತದೆ .
5,ಇವುಗಳನ್ನು ವ್ಯವಸ್ಥಿತ ಯೋಜನೆಯಿಂದ ತಡೆಗಟ್ಟಬಹುದು .
9,ಅಸಾಮಾನ್ಯ ನಷ್ಟ ಸಂಭವಿಸಲು ಹಲವಾರು ನಿಯಂತ್ರಿಸಲು ಆಗದ ಕಾರಣಗಳು ಇವೆ .
18,"ಅವುಗಳು ಯಾವುವು ಎಂದರೆ : ಒಂದು ) ಪದಾರ್ಥಗಳನ್ನು ಸರಬರಾಜುದಾರರಿಂದ ಪಡೆಯಲು ಪ್ರವಾಹ ಪೀಡಿತದಿಂದ ನಿಂತುಹೋಗುವುದು , ಎರಡು ) ಬೆಂಕಿ ಅನಾಹುತದಿಂದ ."
5,ಮೂರು ) ಕಾರ್ಮಿಕರ ಮುಷ್ಕರಗಳಿಂದ .
5,ನಾಲ್ಕು ) ಯಂತ್ರ ಸಿಡಿತದಿಂದ .
5,ಐದು ) ವಿದ್ಯುಚ್ಛಕ್ತಿ ಸ್ಥಗಿತದಿಂದ .
17,"ಅಸಾಮಾನ್ಯ ನಷ್ಟವು ನಿಯಂತ್ರಿತ ಅಥವಾ ನಿಯಂತ್ರಣಕ್ಕೆ ಒಳಗಾಗದ ಕಾರಣಗಳಿಂದ ಆಗಿದ್ದರೂ , ಈ ನಷ್ಟವನ್ನು ತಯಾರಾದ ವಸ್ತುವಿನ ಒಟ್ಟು ವೆಚ್ಚಕ್ಕೆ ಸೇರಿಸಲಾಗುವುದಿಲ್ಲ ."
12,ಆದುದರಿಂದ ಅಸಾಮಾನ್ಯ ನಷ್ಟವನ್ನು ವೆಚ್ಚ ನಿರ್ಣಯ ಪುಸ್ತಕದ ಲಾಭ ಮತ್ತು ನಷ್ಟ ಖಾತೆಗೆ ವರ್ಗಾಯಿಸಬೇಕಾಗುತ್ತದೆ .
20,ಚೂರುಪಾರು ಅಥವಾ ರದ್ದಿ ಪದಾರ್ಥಗಳನ್ನು ಸಿದ್ಧ ವಸ್ತುಗಳನ್ನಾಗಿ ತಯಾರು ಮಾಡುವ ವಿವಿಧ ಹಂತಗಳಲ್ಲಿ ಪದಾರ್ಥ ಹದ ಮಾಡುವಾಗ ಬರುವ ಚೂರುಪಾರು ಅಥವಾ ರದ್ದಿ ನಷ್ಟದಲ್ಲಿ ಇರುತ್ತದೆ .
10,ಈ ಚೂರುಪಾರು ಪ್ರಸ್ತುತ ತಯಾರಿಕಾ ಸಂಸ್ಥೆಗೆ ಮತ್ತೆ ತಯಾರಿಕೆಗೆ ಉಪಯೋಗಿಸಲು ಬರುವುದಿಲ್ಲ .
10,ಆದರೆ ಬೇರೆ ತಯಾರಿಕಾ ಸಂಸ್ಥೆಗೆ ಉಪಯೋಗಕ್ಕೆ ಬರಬಹುದು ಅಥವಾ ಬರದೆ ಇರಬಹುದು .
11,ಕೆಲವು ಸಂದರ್ಭಗಳಲ್ಲಿ ಈ ಚೂರುಪಾರನ್ನು ಬೆಲೆಗೆ ಮಾರಲಾಗುತ್ತದೆ ಅಥವಾ ಬೆಲೆ ಇರದೆ ಇರುತ್ತದೆ .
15,ಪದಾರ್ಥಗಳನ್ನು ಹದ ಮಾಡುವಾಗ ಮತ್ತು ಪ್ರತೀ ವಸ್ತು ತಯಾರು ಮಾಡುವಾಗ ಚೂರುಪಾರು ಇಂತಿಷ್ಟೆ ಪ್ರಮಾಣದಲ್ಲಿ ಇರಬೇಕು ಎಂದು ನಿರ್ಧರಿಸಬೇಕಾಗುತ್ತದೆ .
7,ಅಂದರೆ ಬರುವಂತಹ ಚೂರುಪಾರುಗಳ ಪ್ರಮಾಣದಲ್ಲೂ ನಿಯಂತ್ರಣ ಇರಬೇಕಾಗುತ್ತದೆ .
8,ಚೂರುಪಾರು ಅಥವಾ ರದ್ದಿ ಮಾರಾಟದ ಬೆಲೆಯನ್ನು ಕೆಳಕಂಡಂತೆ ಪರಿಗಣಿಸಬಹುದು .
15,ಒಂದು ) ಪದಾರ್ಥದ ಚೂರುಪಾರನ್ನು ಮಾರಾಟ ಮಾಡಿದಾಗ ಬಂದಂತಹ ಬೆಲೆಯನ್ನು ತಯಾರಿಕಾ ವಸ್ತುವಿಗೆ ಉಪಯೋಗಿಸುವ ಪದಾರ್ಥ ವೆಚ್ಚದಲ್ಲಿ ಕಳೆಯಬೇಕಾಗುತ್ತದೆ .
10,ಇದನ್ನು ಪದಾರ್ಥ ಚೂರುಪಾರು ಅಥವಾ ಪದಾರ್ಥ ರದ್ದಿ ಮಾರಾಟ ಎಂದು ಕರೆಯಲಾಗುವುದು .
7,ಇದರಿಂದ ಪದಾರ್ಥ ವೆಚ್ಚ ಸ್ವಲ್ಪ ಕಡಿಮೆ ಆಗುತ್ತದೆ .
