senlen,sentences
14,ಇದರಿಂದ ನೀರು ನಲ್ಲಿಯ ಬಾಯಿಗೆ ಬಂದು ಒತ್ತಡದಿಂದ ಹೊರಹೋಗಲು ಅಶಕ್ಯವಾಗಿ ಪುನಃ ನಲ್ಲಿಯ ಬಾಯಿಯಿಂದ ಸುರಿಯಲು ಪ್ರಾರಂಭಿಸುತ್ತದೆ .
14,ಹೀಗೆ ನೀರು ನಲ್ಲಿಯ ತುಂಬ ಹೊಮ್ಮಿ ಹರಿಯುತ್ತ ಇರುವುದರಿಂದ ನೋಡುವ ಕಣ್ಣುಗಳಿಗೆ ಗಾಜಿನ ನಳಿಕೆಗಳು ಭಾಸ ಆಗುವುದಿಲ್ಲ .
5,ಇದಕ್ಕೆ ಮುಖ್ಯ ಕಾರಣ ಎರಡು .
7,1 . ತುಂಬಿ ಹರಿಯುತ್ತಿರುವ ನೀರಿನ ಪಾರದರ್ಶಕತೆ .
7,2 . ಗಾಜಿನ ನಳಿಕೆಗಳ ಸಹಜ ಪಾರದರ್ಶಕತೆ .
20,"ಪಾತ್ರೆಗೆ ಬಂದ ನೀರು ಮತ್ತೆ ಹೋಗಿ ಮತ್ತೆ ಕೆಳ ಸುರಿಯುವುದರಿಂದ ಪಾತ್ರೆಯಲ್ಲಿ ಇರುವ ನೀರು ಸ್ವಲ್ಪ ಇದ್ದರೂ ನೀರು ಒಂದೇಸಮ , ಧಾರಾಕಾರವಾಗಿ ಸುರಿಯುತ್ತಲೇ ಇರಬಲ್ಲದು ."
15,ವಿದ್ಯುತ್ ಪಂಪು ಇಲ್ಲದಿರುವ ಕಡೆಗಳಲ್ಲಿ ಅಂತಹ ಪಂಪಿಗೆ ಬದಲಾಗಿ ನಾವು ಸಾಮಾನ್ಯ ನಲ್ಲಿಗಳ ನೀರಿನ ಆಧಾರ ಶಕ್ತಿಯನ್ನಾಗಿ ಬಳಸಿಕೊಳ್ಳಬಹುದು .
6,ಚಲಿಸುವ ಆಟಿಕೆ ಮನೆಯಲ್ಲೇ ತಯಾರಿಕೆ ; .
12,ರೆಡ್ ಇಂಡಿಯನ್ ಕುದುರೆ ಸವಾರ ಮತ್ತು ಮಕ್ಕಳು ಎಂದರೆ ಯಾರಿಗೆ ತಾನೇ ಅಕ್ಕರೆ ಇಲ್ಲ ?
8,ಒಂದು ಅಥವಾ ಎರಡು ಇರುವ ಕಡೆ ಪ್ರೀತಿ ಅತಿರೇಕ .
8,ಈ ಮಕ್ಕಳಿಗೆ ಆಟದ ಸಾಮಾನುಗಳು ಎಂದರೆ ಎಲ್ಲಿಲ್ಲದ ಉತ್ಸಾಹ .
8,ಚಲಿಸುವ ಆಟಿಕೆಗಳು ಇದ್ದರಂತೂ ಮಕ್ಕಳಿಗೆ ಬೇರೆ ಏನೂ ಬೇಡ .
6,ಮಾರುಕಟ್ಟೆಗಳಲ್ಲಿ ದೊರಕುವ ಆಟಿಕೆಗಳು ಖರ್ಚಿನ ಬಾಬತ್ತು .
9,ಅದರಲ್ಲೂ ಚಲಿಸುವ ಆಟಿಕೆಗಳು ಎಂದರೆ ಇನ್ನೂ ಹೆಚ್ಚು ದುಬಾರಿ ಬೆಲೆ .
9,ಚಲಿಸುವ ಆಟಿಕೆಗಳಿಗೆ ಜಪಾನ್ ಎಲ್ಲಾ ದೇಶಗಳಿಗಿಂತ ಒಂದು ಕೈ ಮೇಲು .
10,ಜಪಾನ್ ದೇಶದ ಆಟಿಕೆಗಳಿಗೆ ಕೀ ಕೊಟ್ಟರೆ ಸಾಕು ಅವು ಕೆಲಸ ಪ್ರಾರಂಭಿಸುತ್ತವೆ .
8,ಅದರ ಚಲನೆ ಎಲ್ಲಿಯವರೆಗೆ ಎಂದರೆ ಸ್ಪ್ರಿಂಗ್ ಹಿಗ್ಗುವುದು ನಿಲ್ಲುವವರೆಗೆ .
11,ಈ ರೀತಿಯ ಚಲಿಸುವ ಆಟಿಕೆಗಳಿಗೆ ಪ್ರಪಂಚದ ಎಲ್ಲಾ ದೇಶಗಳಿಂದಲೂ ಬೇಡಿಕೆ ಇದ್ದೇ ಇದೆ .
8,ಈಗೀಗ ನಮ್ಮವರು ಎಚ್ಚೆತ್ತು ಕೆಲವೆಡೆಗಳಲ್ಲಿ ಸುಂದರ ಆಟಿಕೆಗಳನ್ನು ಮಾಡುತ್ತಿದ್ದಾರೆ .
9,ಕೆಲವು ಆಟಿಕೆಗಳು ನಮಗೆ ಬೇಕಾದಾಗ ಜೋಡಿಸಿ ಅವುಗಳಿಗೆ ಜೀವ ತುಂಬಬಹುದು .
8,ಚಿತ್ರಿಸುವುದು ಸುಲಭ ಆದರೆ ಎಲ್ಲರೂ ಮಾಡಲು ಸಾಧ್ಯ ಇಲ್ಲ .
6,ಹತ್ತು ತಿಂಗಳಲ್ಲಿ ಪೂರ್ಣ ಅಕ್ಷರಸ್ಥ ಆದನು .
7,ರಾಮಾಯಣ ಓದುವ ಹವ್ಯಾಸ ಬೆಳಸಿಕೊಂಡಿದ್ದು ಒಂದು ವಿಶೇಷ .
8,ಬೆಲ್ ಬೈಸಿಕಲ್ ಲೈಬ್ರರಿ ಸದಸ್ಯ ಆಗಿ ಪುಸ್ತಕಗಳನ್ನು ಪಡೆಯುತ್ತಿದ್ದನು .
10,ಜೊತೆಗೆ ಕೆಲವು ಪುಸ್ತಕಗಳನ್ನು ತನ್ನ ಸ್ವಂತಕ್ಕೆ ಕೊಂಡಿದ್ದು ಒಂದು ರೀತಿಯ ಹೆಚ್ಚುಗಾರಿಕೆ .
9,ನಾಟಕಗಳನ್ನು ಆಡಿ ಜನರನ್ನು ಸಂತೋಷ ಪಡಿಸುವುದು ಅವನಿಗೆ ಸಂತೋಷಕರ ಆಗಿತ್ತು .
6,ಆರ್. ಎಲ್. ಅಕ್ಕಸಾಲಿಗನಲ್ಲಿ ಕಲಿಯಲು ಪ್ರಾರಂಭಿಸಿದನು .
5,ಅನಂತರ ಚಿನ್ನದ ವ್ಯಾಪಾರದಲ್ಲಿ ತೊಡಗಿದನು .
5,ಆದ್ದರಿಂದ ಅವನು ಲೆಕ್ಕ ಇಡಲೇಬೇಕಾಯಿತು .
6,ಹೀಗೆ ಅವನು ಎರಡು ಕಡೆ ದುಡಿದನು .
9,ಆರ್. ಎಲ್. ತನಗೆ ತೋರಿದಾಗ ಜಾನಪದದ ನಾಟಕದಲ್ಲಿ ಪಾತ್ರ ವಹಿಸುವನು .
9,ಅವನೇ ಸ್ವತಂತ್ರವಾಗಿ ಒಂದು ನಾಟಕ ಮಂಡಳಿಯನ್ನು ಕಟ್ಟಿದ್ದು ಮೆಚ್ಚುವ ಸಂಗತಿ .
7,ಅವನು ಹಲವಾರು ವರ್ಷ ನಾಟಕ ಮಂಡಳಿ ನಡೆಸಿದನು .
6,ಆತ ಒಬ್ಬ ಮುಸಲ್ಮಾನನಿಗೆ ನಾಟಕ ಕಲಿಸಿದನು .
5,ಅವನೇ ಒಳ್ಳೆಯ ನೃತ್ಯಗಾರ ಆದನು .
5,ಆತ ಕಸುಬಿನಲ್ಲಿ ಮಾತ್ರ ದರ್ಜಿ .
8,ಇನ್ನು ಇಬ್ಬರು ಆರ್. ಎಲ್.ನಲ್ಲಿ ನಾಟಕ ಅಭ್ಯಾಸ ಮಾಡಿದರು .
8,ಅವರು ಸಾಮೂಹಿಕವಾಗಿ ಹಾಡಬಲ್ಲರು ಮತ್ತು ಹಾಸ್ಯದ ಪಾತ್ರದಲ್ಲಿ ಎತ್ತಿದಕೈ .
8,ಈ ಪರಿಸ್ಥಿತಿಯಲ್ಲಿ ಅವರೂ ಸಹ ಓದು ಬರೆಹ ಕಲಿತರು .
10,ಆರ್. ಎಲ್. ನಾಟಕ ಕಲಿಸುವುದರ ಜೊತೆಗೆ ಬೈಸಿಕಲ್ ರಿಪೇರಿ ಕೆಲಸವನ್ನು ಕಲಿತನು .
8,ಬೈಸಿಕಲ್ಲಿಗೆ ಬೇಕಾದ ಬಿಡಿ ಭಾಗಗಳನ್ನು ಕೊಳ್ಳುವ ಅವಶ್ಯಕತೆ ತೋರಿತು .
7,ಆದ್ದರಿಂದ ಅವನು ಇಂಗ್ಲಿಷ್ ಕಲಿಯುವುದು ಅನಿವಾರ್ಯ ಆಯಿತು .
14,ಅದರಿಂದ ಇಂಗ್ಲಿಷಿನಲ್ಲಿ ಬರೆದಿರುವ ಬಿಡಿಭಾಗಗಳ ಹೆಸರನ್ನು ಮತ್ತು ಅವುಗಳನ್ನು ತಯಾರಿಸಿದ ಕಂಪನಿಗಳ ಹೆಸರನ್ನು ಓದುವುದು ಅಭ್ಯಾಸ ಆಯಿತು .
9,"ರಾಮಾಯಣ ಓದುವುದು , ನಾಟಕದ ಹಾಡುಗಳನ್ನು ಸಂಗ್ರಹಿಸುವುದು ಅವನ ಹವ್ಯಾಸ ."
5,ಅವನ ಹತ್ತಿರ ರಾಮಾಯಣ ಇದೆ .
4,ಅದನ್ನು ಎಲ್ಲರೂ ಓದಲಾರರು .
6,ಆರ್. ಎಲ್.ಗೂ ಸಹ ಸಾಧ್ಯ ಇಲ್ಲ .
6,ಆದರೂ ಪವಿತ್ರ ಗ್ರಂಥದಂತೆ ಭಕ್ತಿಯಿಂದ ಓದುವನು .
7,ಅವನಿಗೆ ಸುಮಾರು ಎರಡು ಡಜನ್ ನಾಟಕಗಳು ಬರುತ್ತವೆ .
8,"ಕೆಲವು ಪೌರಾಣಿಕ , ಐತಿಹಾಸಿಕ ಮತ್ತು ಪ್ರವಾಸಕ್ಕೆ ಸಂಬಂಧಪಟ್ಟವು ."
10,ಈಗ ಆರ್. ಎಲ್.ಗೆ ನಗರದ ನಾಗರಿಕರಿಂದ ಹಿಂದಿ ಮಾತನ್ನು ಆಡುವುದು ತಿಳಿದಿದೆ .
10,ಅಕ್ಷರ ಪ್ರಚಾರದ ಯಶಸ್ಸಿನ ಬಗ್ಗೆ ಕೇವಲ ಅಂಕಿ ಸಂಖ್ಯೆಗಳನ್ನು ಕೊಡುವುದು ರೂಢಿ .
10,ಆದ್ದರಿಂದ ಜನಸಾಮಾನ್ಯರಲ್ಲಿ ಅಕ್ಷರ ಪ್ರಚಾರ ವಿಚಾರದಲ್ಲಿ ಒಂದು ತೆರನಾದ ಅಪನಂಬಿಕೆ ಇದೆ .
7,ಮೇಲೆ ತಿಳಿಸಿದ ನಿದರ್ಶನಗಳು ಅಂತಹ ಅಪನಂಬಿಕೆಯನ್ನು ಹೋಗಲಾಡಿಸಬಲ್ಲವು .
7,ಜೊತೆಗೆ ಕಾರ್ಯಕ್ರಮದ ಬಗ್ಗೆ ಹೆಚ್ಚಿನ ವಿಶ್ವಾಸ ಮೂಡುವುದು .
10,ಮೇಲಾಗಿ ವಯಸ್ಕರ ಶಿಕ್ಷಣ ಹೆಚ್ಚಿನ ಹುರುಪಿನಿಂದ ಸೇವೆ ಸಲ್ಲಿಸಲು ಪ್ರೋತ್ಸಾಹಿತರು ಆಗುವರು .
12,ಆದ್ದರಿಂದ ರಾಜ್ಯ ಸಂಪನ್ಮೂಲ ಕೇಂದ್ರಗಳು ಈ ದಿಶೆಯಲ್ಲಿ ಹೆಚ್ಚಿನ ಮಾಹಿತಿ ಸಂಗ್ರಹಿಸಲು ಉದ್ಯುಕ್ತರು ಆಗತಕ್ಕದ್ದು .
13,ಸ್ಥಳೀಯ ತಳಿಗಳು ಐದು ವರ್ಷಕ್ಕೆ ಫಲ ಕೊಡಲು ತೊಡಗಿದರೆ ಇದು ಮೂರನೆಯ ವರ್ಷದಿಂದಲೇ ಫಸಲು ಕೊಡುತ್ತದೆ .
4,ತುದಿಯು ಸ್ವಲ್ಪ ಕುಗ್ಗಿರುತ್ತದೆ .
9,ಎಲೆಗಳು ವಿಶಾಲ ಆಗಿದ್ದು ಬಹು ಹೆಚ್ಚು ಉಪಪತ್ರಗಳು ಉಳ್ಳವು ಆಗಿರುತ್ತದೆ .
7,ಈ ಉಪಪತ್ರಗಳು ಅಚ್ಚ ಹಸಿರು ಬಣ್ಣದವು ಆಗಿರುತ್ತವೆ .
8,ಕಾಯಿಗಳೂ ಅಚ್ಚ ಹಸಿರು ಬಣ್ಣದವು ಆಗಿದ್ದು ದೃಢವಾಗಿ ಇರುತ್ತವೆ .
30,"' ಮಂಗಳ ' ತಳಿಯನ್ನು ತಾಯಿಯಾಗಿಯೂ ' ಶ್ರೀವರ್ಧನ್ ' ' ಸ್ಥಳೀಯ ' ಮತ್ತು ' ತೀರ್ಥಹಳ್ಳಿ ' ಬಗೆಗಳನ್ನು ತಂದೆಯಾಗಿಯೂ ವೃದ್ಧಿಸಿದ ಸಮ್ಮಿಶ್ರ ತಳಿಗಳಲ್ಲಿ , ' ಮಂಗಳ ಶ್ರೀವರ್ಧನ್ ' ತಳಿ ಉತ್ತಮ ತಳಿ ಆಗಿದೆ ."
13,"ಎತ್ತರ ಬೆಳೆಯುವುದರಲ್ಲೂ , ಕಾಂಡದ ಸುತ್ತಳತೆಯಲ್ಲೂ , ಎಲೆಗಳ ಸಂಖ್ಯೆಯಲ್ಲೂ ಉತ್ತಮ ಆದದ್ದು ಎಂದು ಕಂಡುಬಂದಿದೆ ."
6,ಬೀಜ ಚುನಾವಣೆ - ಸಸಿ ತಯಾರಿಕೆ .
5,ಅಡಿಕೆಯನ್ನು ಬೀಜದಿಂದ ವೃದ್ಧಿ ಮಾಡಲಾಗುತ್ತದೆ .
9,ಇದು ಬಹುವಾರ್ಷಿಕ ಬೆಳೆ ಆದ್ದರಿಂದ ಯೋಗ್ಯವಾದ ಬಿತ್ತನೆ ವಸ್ತುವನ್ನು ಆರಿಸಿಕೊಳ್ಳಬೇಕು .
10,ಈ ವಿಷಯದಲ್ಲಿ ಸಾಕಷ್ಟು ಎಚ್ಚರಿಕೆ ವಹಿಸಿ ತಕ್ಕ ಕಾರ್ಯಕ್ರಮವನ್ನು ಕೈಗೊಳ್ಳುವುದು ಅವಶ್ಯ .
7,ಈ ಕಾರ್ಯಕ್ರಮದಲ್ಲಿ ಎರಡು ಪ್ರಮುಖ ಹಂತಗಳು ಇವೆ .
11,"ತಾಯಿಮರಗಳು ಮತ್ತು ಬೀಜದ ಆಯ್ಕೆ , ಸಸಿಗಳ ಉತ್ಪಾದನೆ ಮತ್ತು ಅವುಗಳ ಆಯ್ಕೆ ."
6,ತಾಯಿ ಮರಗಳು ಮತ್ತು ಬೀಜದ ಆಯ್ಕೆ .
12,ಮೊದಲು ಬೇಗ ಮತ್ತು ಸ್ಥಿರವಾದ ಅಧಿಕ ಫಲವನ್ನು ಕೊಡುತ್ತಿರುವ ರೋಗರಹಿತವಾದ ತಾಯಿ ಮರಗಳನ್ನು ಗುರುತಿಸಬೇಕು .
10,ಅಡಿಕೆಕಾಯಿ ಚೆನ್ನಾಗಿ ಮಾಗಿ ಹಣ್ಣು ಆದಾಗ ಮಾತ್ರವೇ ಮರದಿಂದ ಗೊಂಚಲುಗಳನ್ನು ಕೀಳಬೇಕು .
8,ಅದು ಸಾಮಾನ್ಯವಾಗಿ ಡಿಸೆಂಬರ್ - ಜನವರಿ ತಿಂಗಳುಗಳಲ್ಲಿ ಆಗಿರುತ್ತೆ .
12,ಗೊಂಚಲುಗಳನ್ನು ಕಿತ್ತು ಮರದ ಮೇಲಿನಿಂದ ನೆಲಕ್ಕೆ ಬಿಸಾಡದೆ ಹಗ್ಗದ ಸಹಾಯದಿಂದ ಕೆಳಗೆ ಇಳಿಸುವುದು ಅವಶ್ಯ .
22,"ಅನಂತರ ಆ ಗೊಂಚಲಿನಲ್ಲಿ ಇರುವ ವಿಕೃತ ಕಾಯಿಗಳನ್ನೂ ಅತಿ ಚಿಕ್ಕ ಕಾಯಿಗಳನ್ನೂ ಮತ್ತು ತೂಕ ಕಡಿಮೆ ಇರುವ ಕಾಯಿಗಳನ್ನು ತಿರಸ್ಕರಿಸಿ , ಚೆನ್ನಾಗಿ ಮಾಗಿದ ಹಣ್ಣುಗಳನ್ನು ಮಾತ್ರವೇ ಆರಿಸಿಕೊಳ್ಳಬೇಕು ."
23,"ತೂಕ ಹೆಚ್ಚು ಇರುವ ಕಾಯಿಗಳನ್ನು ನೆಟ್ಟರೆ ಅವು ಬೇಗ ಮೊಳಕೆ ಒಡೆದು , ಹೆಚ್ಚಿನ ಮೊಳಕೆಯ ಶೇಕಡ ಅಂಶ ದೊರೆತು ಸದೃಢ ಆರೋಗ್ಯಯುತವಾದ ಸಸಿಗಳು ದೊರೆಯುವುದು ಸಂಶೋಧನಾ ಪ್ರಯೋಗಗಳಿಂದ ತಿಳಿದುಬಂದಿದೆ ."
12,"ಆದ್ದರಿಂದ , ದಪ್ಪವಾದ , ಒಳ್ಳೆಯ ತೂಕ ಉಳ್ಳ ಬೀಜದ ಕಾಯಿಗಳನ್ನು ಗೊಂಚಲುಗಳಿಂದ ಆರಿಸಿಕೊಳ್ಳಬೇಕು ."
11,"ಅವುಗಳನ್ನು ಆದಷ್ಟು ಬೇಗ ಅಂದರೆ , ಒಂದು ವಾರದ ಒಳಗೇ ನೆಡುವುದು ಒಳ್ಳೆಯದು ."
3,ಸಸಿಗಳ ಉತ್ಪಾದನೆ .
9,ಪ್ರಾಥಮಿಕವಾಗಿ ನರ್ಸರಿ ಆರಿಸಿದ ಬೀಜದ ಕಾಯಿಗಳನ್ನು ಸ್ವಲ್ಪ ಮಡಿಯಲ್ಲಿ ನೆಡಬೇಕು .
17,ಒಳ್ಳೆಯ ಆರೋಗ್ಯವಾದ ಸಸಿಗಳನ್ನು ಪಡೆಯಲು ಬೀಜಗಳನ್ನು ಸುಮಾರು ಐದರಿಂದ ಆರು ಸೆಂ. ಮೀ. ದೂರದಲ್ಲಿ ಅವುಗಳ ತೊಟ್ಟು ಮೇಲಕ್ಕೆ ಮಾಡಿ ನೆಡಬೇಕು .
8,ಅವುಗಳನ್ನು ಮುಚ್ಚುವಂತೆ ಮಾತ್ರ ಮರಳನ್ನು ಮೇಲೆ ಹರಡಿದರೆ ಸಾಕು .
6,ಸಸಿ ಮಡಿಗಳಿಗೆ ದಿನವೂ ನೀರು ಹಾಕುತ್ತಿರಬೇಕು .
9,ಕಾಯಿಗಳನ್ನು ಪೂರ್ಣವಾಗಿ ಮುಚ್ಚುವಂತೆ ಅವುಗಳ ಮೇಲೆ ಸೋಗೆಯನ್ನು ಹರಡುವುದೂ ಒಳ್ಳೆಯದು .
9,ಸಾಧಾರಣವಾಗಿ 6ರಿಂದ 8 ವಾರದ ಒಳಗೆ ಬೀಜದಿಂದ ಮೊಳಕೆ ಒಡೆಯುತ್ತದೆ .
9,ಹೆಚ್ಚು ಎತ್ತರದ ಪ್ರದೇಶಗಳಲ್ಲಿ ಮೊಳಕೆ ಒಡೆಯಲು ಹೆಚ್ಚು ಸಮಯ ಹಿಡಿಯುತ್ತದೆ .
12,ಹೀಗೆ ಮೊಳಕೆ ಎದ್ದ ಸಸಿಗಳನ್ನು ಸಾಧಾರಣ ಮೂರು ತಿಂಗಳು ಕಳೆಯುವವರೆಗೆ ಪ್ರಾಥಮಿಕ ನರ್ಸರಿಯಲ್ಲೇ ಬಿಡಬೇಕು .
8,ಆಗ ಆ ಸಸಿಗಳಲ್ಲಿ ಎರಡು ಮೂರು ಎಲೆಗಳು ಕಾಣಿಸಿಕೊಂಡಿರುತ್ತವೆ .
7,ಸಸಿಮಡಿಯನ್ನು ತಯಾರಿಸುವ ಮುಂಚೆ ನೆಲವನ್ನು ಚೆನ್ನಾಗಿ ಉಳಬೇಕು .
17,"ಸಸಿಮಡಿಯ 150 ಸೆಂ. ಮೀ ಅಗಲ , 15 ಸೆಂ. ಮೀ. ಎತ್ತರ ಮತ್ತು ಸಾಕಷ್ಟು ಉದ್ದ ಇರುವಂತೆ ಸಿದ್ಧ ಮಾಡಬೇಕು ."
12,"ಹೆಕ್ಟೇರಿಗೆ 5 ಟನ್ನಿನಂತೆ , ಮಡಿಗೆ ಕೊಟ್ಟಿಗೆ ಗೊಬ್ಬರವನ್ನು ಹಾಕಿ ಮಣ್ಣಿನಲ್ಲಿ ಚೆನ್ನಾಗಿ ಬೆರಸಬೇಕು ."
13,ತದನಂತರ ಸಸಿಗಳನ್ನು 30 ಸೆಂ. ಮೀ. 30 ಸೆಂ. ಮೀ. ದೂರದಲ್ಲಿ ಮಳೆಗಾಲಕ್ಕಿಂತ ಮುಂಚೆಯೇ ನೆಡಬೇಕು .
8,ಭಾಗಶಃ ನೆರಳು ಹಾಗೂ ಬೇಸಿಗೆಯಲ್ಲಿ ನೀರು ಹಾಯಿಸುವುದು ಅವಶ್ಯ .
19,"ಸಕಾಲಿಕವಾಗಿ ಕಳೆ ಕೀಳುವುದು ಮತ್ತು ಸಸಿಗಳ ಬೇರುಗಳಿಗೆ ರಕ್ಷಣೆಯಾಗಿ ಅರ್ಧ ಕೊಳೆತ ಹುಲ್ಲು , ಎಲೆ , ಮಣ್ಣು ಮೊದಲಾದವುಗಳ ಮಿಶ್ರಣವನ್ನು ಹೊರಿಸುವುದು ಒಳಿತು ."
30,"ಭಾಗಶಃ ನೆರಳಿಗೋಸ್ಕರ ನರ್ಸರಿಯಲ್ಲಿ ಚಪ್ಪರವನ್ನು ಹಾಕಿ ಅದರ ಮೇಲೆ ತೆಂಗಿನ ಅಥವಾ ಅಡಿಕೆಯ ಓಲೆಗಳನ್ನು ಹರಡಬಹುದು ಅಥವಾ ತೊಂಡೆಕಾಯಿ ಬಳ್ಳಿಯನ್ನೂ ಚಪ್ಪರದ ಮೇಲೆ ಬೆಳೆಸಿ ಹರಡಬಹುದು ಅಥವಾ ಮುಳ್ಳು ಜೀರಂಗಿ , ಅಗಸೆ ಮುಂತಾದ ಹಸಿರು ಸೊಪ್ಪು ಗಿಡಗಳನ್ನು ಬೆಳೆಸಬಹುದು ."
4,ಬಾಳೆಯನ್ನೂ ನೆರಳಿಗೋಸ್ಕರ ಬೆಳೆಸಬಹುದು .
13,ಹಾಗೆ ಬಾಳೆಯನ್ನು ಬೆಳೆಸುವುದಾದರೆ ಅದನ್ನು 6 ತಿಂಗಳು ಮುಂಚೆಯೇ 2.7 2.7 ಮೀ. ಅಂತರದಲ್ಲಿ ನೆಡಬೇಕು .
14,"ಬಾಳೆ ಮತ್ತು ತೊಂಡೆಕಾಯಿ ಬಳ್ಳಿಯು ನೆರಳು ಕೊಡುವುದು ಮಾತ್ರ ಅಲ್ಲ , ಬೆಳೆಗಾರನಿಗೆ ಒಳ್ಳೆಯ ವರಮಾನವನ್ನೂ ಕೊಡುತ್ತದೆ ."
11,ಮಳೆಗಾಲ ಬಹು ಜೋರು ಆದಾಗ ನೀರು ಹರಿದು ಹೋಗುವಂತೆ ಸಸಿಮಡಿಯಲ್ಲಿ ಸೌಕರ್ಯವನ್ನು ಉಂಟುಮಾಡಿರಬೇಕು .
6,ಬೇಸಿಗೆ ಕಾಲದಲ್ಲಿ ಸಸಿಮಡಿಯಲ್ಲಿ ನೀರು ಹಾಕಲೇಬೇಕು .
3,ಸಸಿಗಳ ಆಯ್ಕೆ .
18,ಎರಡನೆಯ ನರ್ಸರಿಗಳಲ್ಲಿ ಸಸಿಗಳು ಒಂದು ವರ್ಷ ಬೆಳೆದ ನಂತರ ಅಥವಾ 12ರಿಂದ 18 ತಿಂಗಳು ಪ್ರಾಯ ಆದಾಗ ತೋಟದಲ್ಲಿ ನೆಡಲು ಯೋಗ್ಯ ಆಗಿರುತ್ತವೆ .
12,ಇವು ಸಾಕಷ್ಟು ಎತ್ತರ ದಪ್ಪ ಕಾಂಡ ಉಳ್ಳದ್ದೂ ಮತ್ತು ಕನಿಷ್ಠಪಕ್ಷ 5 ಎಲೆಗಳನ್ನಾದರೂ ಹೊಂದಿರಲೇಬೇಕು .
9,ಬೇರುಗಳಿಗೆ ಅಂಟಿಕೊಂಡಿರುವ ಮಣ್ಣಿನ ಸಮೇತ ಈ ಸಸಿಗಳನ್ನು ನೆಡಲು ತೆಗೆಯಬೇಕು .
6,ಮೊದಲು ತೋಟಕ್ಕೆ ಜಾಗ ಆಯ್ಕೆ ಮಾಡಿಕೊಳ್ಳಬೇಕು .
5,ಅಡಿಕೆ ಒಂದು ತೋಟದ ಬೆಳೆ .
16,"ನಿಂತ ನೀರು , ಬಲು ಗಟ್ಟಿಯಾದ ಕೆಳಮಣ್ಣು , ಅನಾವೃಷ್ಟಿ , ದಕ್ಷಿಣದ ಬಿಸಿಲು ಇವುಗಳನ್ನು ಅಡಿಕೆ ಮರವು ಸಹಿಸುವುದಿಲ್ಲ ."
30,"ಆದ್ದರಿಂದ ಅಡಿಕೆ ಕೃಷಿಗೆ ಜಾಗವನ್ನು ಆಯ್ಕೆ ಮಾಡುವಾಗ ಮುಖ್ಯವಾಗಿ ಗಮನದಲ್ಲಿ ಇಡಬೇಕಾದ ಅಂಶಗಳು ಎಂದರೆ : ಹಿತವಾದ ನೀರಾವರಿ ಸೌಕರ್ಯ , ಸಾಕಷ್ಟು ಬಸಿಕಾಲುವೆ , ನೇರವಾಗಿ ತಾಗುವ ಬಿಸಿಲು , ರಕ್ಷಣೆ ಮತ್ತು ಆಳವಾದ ಹಾಗೂ ಫಲವತ್ತಾದ ಮಣ್ಣು ."
21,"ಸಾಧಾರಣವಾಗಿ ಈ ಕಾರಣದಿಂದಲೇ ನದಿ ತೀರ , ಬೆಟ್ಟಗಳ ಮಧ್ಯದಲ್ಲಿನ ಕಣಿವೆಗಳು , ಬೆಟ್ಟದ ಇಳಿಜಾರು ಪ್ರದೇಶ ಇಂತಹ ರಕ್ಷಣೆ ಉಳ್ಳ ಪ್ರದೇಶಗಳನ್ನೇ ಅಡಿಕೆ ಕೃಷಿಗೆ ಆಯ್ದುಕೊಳ್ಳಲಾಗುತ್ತದೆ ."
3,ಸಸಿ ನೆಡುವುದು .
18,ಅನೇಕ ಅಡಿಕೆ ಸಂಶೋಧನಾ ಕೇಂದ್ರಗಳಲ್ಲಿ ನಡೆಸಿದ ಪ್ರಯೋಗಗಳಿಂದ ಸಸಿಗಳ ವಯಸ್ಸು ಹಾಗೂ ಅವುಗಳನ್ನು ನೆಡುವ ಆಳ ಇವುಗಳ ಬಗ್ಗೆ ಫಲಪ್ರದವಾದ ಸೂಚನೆಗಳು ದೊರೆತಿವೆ .
17,"ಸಾಧಾರಣವಾಗಿ , ಒಂದು ಎರಡು ವರ್ಷ ವಯಸ್ಸಿನ ಸಸಿಗಳು , ಮೂರು ವರ್ಷ ಅಥವಾ ಅದಕ್ಕಿಂತ ಹೆಚ್ಚು ವಯಸ್ಸಿನ ಸಸಿಗಳಿಗಿಂತ ಒಳ್ಳೆಯವು ."
10,"ಕಿತ್ತು ನೆಡುವ ಸಮಯದಲ್ಲಿ , ಕನಿಷ್ಠ ಐದು ಎಲೆಗಳು ಆದರೂ ಇರಬೇಕು ."
21,"ಒಂದು ವರ್ಷ ವಯಸ್ಸು ಆದಾಗ ಕಾಂಡದ ಸುತ್ತಳತೆ 20 ಸೆಂ. ಮೀ. ಕಡಿಮೆಯುಳ್ಳ , ಎರಡು ವರ್ಷಗಳು ಆಗಿಯೂ ನಾಲ್ಕು ಗಂಟುಗಳು ಆದರೂ ಇಲ್ಲದಿದ್ದ ಸಸಿಗಳನ್ನು ನಿರಾಕರಿಸಬೇಕು ."
13,"ಹೀಗೆ ಆಯ್ಕೆ ನಂತರವೂ ಸಸಿಗಳು ಆರು ವರ್ಷದ ಒಳಗಾಗಿ ಕಾಯಿ ಬಿಡದಿದ್ದರೆ , ಅವುಗಳನ್ನು ಬದಲಾಯಿಸಬೇಕು ."
11,ಚೆನ್ನಾಗಿ ನೀರು ಬಸಿದು ಹೋಗುವ ಮಣ್ಣಿನಲ್ಲಿ ಮೇ - ಜೂನಿನಲ್ಲಿ ಸಸಿ ನೆಡಬೇಕು .
12,ಜೇಡಿಮಣ್ಣು ಪ್ರದೇಶಗಳಲ್ಲಿ ಆದರೆ ನೀರು ನಿಲ್ಲದ ಸಮಯವನ್ನು ನೋಡಿ ಆಗಸ್ಟ್ - ಸೆಪ್ಟೆಂಬರಿನಲ್ಲಿ ನೆಡಬೇಕು .
26,"ಸಸಿಗಳು ಸೂರ್ಯನ ತಾಪದಿಂದ ಸುಟ್ಟು ಹೋಗುವ ಹಾಗೂ ಗಾಳಿಯ ಹೊಡೆತಕ್ಕೆ ಬಲಿ ಆಗುವ ಸಾಧ್ಯತೆ ಹೆಚ್ಚು ಆದ್ದರಿಂದ , ಅವುಗಳನ್ನು ನೆಡುವಾಗ ಅವುಗಳಿಂದ ಆಗಬಹುದಾದ ಅಪಾಯವನ್ನು ಕಡಿಮೆ ಮಾಡಲು ಸೂಕ್ತ ಸಾಲು ವಿಧಾನಗಳನ್ನು ಅನುಸರಿಸಬೇಕಾಗುತ್ತದೆ ."
8,"ಅಲ್ಲದೆ , ಅಡಿಕೆ ಸಸಿಗಳ ನಡುವಿನ ಅಂತರ ಮುಖ್ಯ ."
13,"ಇದು ಮಣ್ಣಿನ ಫಲವತ್ತು , ಆಳ , ತೇವ ಮತ್ತು ಬಸಿಕಾಲುವೆ ಸೌಕರ್ಯ ಇವುಗಳನ್ನು ಅನುಸರಿಸಿರುತ್ತದೆ ."
12,ಈ ವಿಷಯದಲ್ಲಿ ವಿಟ್ಲದಲ್ಲಿ ಇರುವ ಕೇಂದ್ರ ತೋಟಗಳ ಸಂಶೋಧನಾ ವಲಯದವರು ಕೆಲವು ಪ್ರಯೋಗಗಳನ್ನು ನಡೆಸಿದ್ದಾರೆ .
27,"ಒಳ್ಳೆಯ ಬೆಳೆಯನ್ನು ಪಡೆಯಲು ನೆಡುವ ಅಂತರ 2.7 2.7 ಮೀಟರುಗಳು ಇರಬೇಕು ಎಂದು , ಚದರ ರೀತಿಯಲ್ಲಿ ಸಸಿಗಳನ್ನು ನೆಡುವಾಗ ಸಾಲುಗಳು ಉತ್ತರ ದಕ್ಷಿಣವಾಗಿ ಪಶ್ಚಿಮ ದಿಕ್ಕಿಗೆ 35 ಡಿಗ್ರಿಯಲ್ಲಿ ವಾಲಿರಬೇಕು ಎಂದು ಶಿಫಾರಸ್ಸು ಮಾಡಿದ್ದಾರೆ ."
6,ನೀರು ಹರಿದುಹೋಗುವ ಮಣ್ಣಿನಲ್ಲಿ ಆಳವಾಗಿ ನೆಡಬೇಕು .
8,ಹೆಚ್ಚಿನ ಜಲಪಾತಳಿ ಇರುವ ಪ್ರದೇಶಗಳಲ್ಲೂ ಸಸಿಗಳನ್ನು ಗುಂಡಿಗಳಲ್ಲಿ ನೆಡಬೇಕು .
5,ಎತ್ತರಿಸಿದ ದಿಣ್ಣೆಗಳ ಮೇಲೂ ನೆಡಬೇಕಾಗಬಹುದು .
4,ಇದು ಬಹು ವಿರಳ .
24,ವಿಟ್ಲದಲ್ಲಿನ ಸಂಶೋಧನಾ ಆಲಯದಲ್ಲಿ ನಡೆದ ಪ್ರಯೋಗಗಳಿಂದ ತಿಳಿದು ಬಂದಿರುವಂತೆ 30 ಸೆಂ. ಮೀ. ಮತ್ತು 60 ಸೆಂ. ಮೀ. ಆಳದಲ್ಲಿ ಸಸಿಗಳನ್ನು ನೆಡುವುದಕ್ಕಿಂತ 90 ಸೆಂ. ಮೀ. ಆಳದಲ್ಲಿ ನೆಡುವುದು ಒಳ್ಳೆಯದು .
9,ಆಗ ಸಸಿಗಳು ಚೆನ್ನಾಗಿ ಆರೋಗ್ಯವಾಗಿ ಬೆಳೆದು ಬೇಗ ಹೂವುಗಳನ್ನು ಬಿಡುತ್ತವೆ .
5,ಗಿಡದ ಇಳುವರಿ ಹೆಚ್ಚು ಆಗಿರುತ್ತದೆ .
20,"ಆದ್ದರಿಂದ , ಅಡಿಕೆ ಸಸಿಗಳನ್ನು ನೆಡುವಾಗ 2.7 ಮೀ. ಅಂತರದಲ್ಲಿ 90 ಸೆಂ. ಮೀ. - 90 ಸೆಂ. ಮೀ. ಅಳತೆ ಉಳ್ಳ ಗುಂಡಿಗಳನ್ನು ತೆಗೆಯಬೇಕು ."
20,"ಮರಳು , ಹುಡಿಮಣ್ಣು , ಕಳಿತ ಕೊಟ್ಟಿಗೆ ಗೊಬ್ಬರ ಇವುಗಳಿಂದ ಗುಂಡಿಯನ್ನು ತಳದಿಂದ 50 ಸೆಂ. ಮೀ. - 60 ಸೆಂ. ಮೀ. ವರೆಗೆ ತುಂಬಿಸಬೇಕು ."
10,ಸಸಿಗಳನ್ನು ಈ ಗುಂಡಿಯ ಮಧ್ಯದಲ್ಲಿ ನೆಟ್ಟು ಅದರ ಕತ್ತಿನವರೆಗೆ ಮಣ್ಣನ್ನು ತುಂಬಬೇಕು .
6,ನಂತರ ಸುತ್ತಲು ಮಣ್ಣನ್ನು ಚೆನ್ನಾಗಿ ಅದುಮಬೇಕು .
17,"ಎಳೆಯ ಸಸಿಯ ಕಾಂಡಗಳು ಬಹು ದುರ್ಬಲ ಆದ್ದರಿಂದ , ಮೊದಲಿನ ಎರಡು ಮೂರು ವರ್ಷಗಳು ಸುಡುಬಿಸಿಲಿನಿಂದ ಅಂದರೆ ನವೆಂಬರಿನಿಂದಲೇ ಸಸಿಗಳನ್ನು ಕಾಪಾಡಬೇಕು ."
16,"ಸೂರ್ಯನ ಬೆಳಕಿಗೆ ಒಡ್ಡಿರುವ ಕಾಂಡದ ಭಾಗವನ್ನೆ ತೆಂಗು ಅಥವಾ ಅಡಿಕೆಯ ಗರಿಗಳಿಂದಲೋ , ಒಳ್ಳೆಯ ಅಪಾರದರ್ಶಕ ಪಾಲಿಥಿನ್ ಫಿಲ್ಮಿನಿಂದಲೋ ಮುಚ್ಚಬೇಕು ."
