wordcontent,sentences,index
त्याचा,"या चर्चेला उत्तर देताना जलसंपदा राज्यमंत्री सुनील देशमुख यांनी कोकणातील विशिष्ट भौगोलिक परिस्थितीमुळे मोठ्या प्रमाणावर पाटबंधारे प्रकल्प उभारता येत नाहीत असे सांगितले ; मात्र रायगड जिल्ह्यातील सिंचनाच्या अनुशेषाबाबत चुकीचा अहवाल दिला असेल तर त्याचा फेरसर्व्हे केला जाईल , असे त्यांनी जाहीर केले .",1017
त्याचा,मान्यता मिळाल्यानंतर त्याचा पहिला टप्पा पाच वर्षांत पूर्ण होणे अपेक्षित आहे .,1071
त्याचा,हलकर्णी औद्योगिक वसाहतीत दोनशे मेगावॉट वीजनिर्मिती प्रकल्प येऊ पाहत असून लवकरच त्याचा निर्णय होईल .,1448
त्याचा,"सोहराबुद्दीन शेख , त्याची पत्नी कौसरबी आणि त्याचा मित्र तुलसीराम प्रजापती यांना बनावट चकमकीत ठार करण्यात आल्याचे प्रकरण गाजत आहे .",1572
त्याचा,त्याचा जीवनकाल फक्त ४५ दिवसांचा असतो .,1871
परत,एका शब्दावर मात्र मी परत परत अडखळत होते - ' डॉक्टरकाका ' हे संबोधन मात्र मला मुळीच आवडले नाही त्या नावाने त्यांना हाक मारायची नाही असे मी अगदी पक्के ठरवून टाकले .,137
परत,गुन्हे शाखेतील अधिकाऱ्यांच्या सूचनेनुसार अवलानी यांचे पैसे परत मिळविण्यासाठी आणि अधिकाऱ्यांना लाच देण्यासाठीची रक्कम मिळविण्यासाठीही १२ एप्रिलला अवलानी शुक्‍लांना भेटला आणि ही रक्कम घेऊन येत असताना पोलिसांनी त्याला पकडले .,877
परत,तेव्हाच ही रक्कम अवलानी याला परत मिळाली असती तर हा खटला उभाच राहिला नसता .,878
परत,नंतर पूर्ण हवा भरलेल्या बोटीत ( ज्या जीपने गंगाकिनारी आणतात ) परत परत सूचनापत्र !,931
परत,परत प्रवास सुरू होतो .,946
परत,पण धनुष्यातून सुटलेला बाण आणि ओठांतून निघालेला शब्द कधीच परत येत नाही .,1163
अधिकारी,"मेगाब्लॉकमुळे प्रवाशांची गैरसोय टाळण्यासाठी सोमवारी एसटीच्या ठाणे ते कल्याण या मार्गावर २५ ते ३० गाड्या सोडण्यात येणार असल्याचे ठाणे विभागीय अधिकारी फाळके यांनी ""सकाळ'ला सांगितले .",31
अधिकारी,"त्यांना बिल्डर , अधिकारी कोण जबाबदार आहेत , त्यांच्यावर काय कारवाई करता येईल , याबाबत समितीने अहवाल द्यायचा आहे . समितीच्या कार्यकक्षेबाबतच्या प्रस्तावित अधिसूचनेला न्यायालयाने संमती दिली असून त्यानुसार अधिसूचना जारी केली जाणार आहे .",51
अधिकारी,त्यातील एकाला प्राधिकरणाचा मुख्य कार्यकारी अधिकारी होण्याची संधी असेल .,115
अधिकारी,"कामगार व मालक यांच्यातील वाद तडजोडीने किंवा समझोत्याने मिटविले जावेत , या हेतूने औद्योगिक कलम कायद्यातील तरतुदीनुसार कन्सिलिएशन ऑफिसर म्हणून सहायक कामगार आयुक्त व सरकारी कामगार अधिकारी यांची नेमणूक प्रत्येक जिल्ह्यासाठी केली आहे .",129
अधिकारी,"विद्यापीठात भौतिकशास्त्रात पीएच . डी . करणारे , विद्यार्थी सेनेचे कार्यकर्ते तुकाराम सराफ यांनी वृत्त समजताच त्याची माहिती अग्निशमन अधिकारी , पोलिसांना दिली .",373
अधिकारी,"चार कोटी ७७ लाख रुपयांच्या या विम्याचा हप्ताही विद्यापीठाने भरलेला आहे , अशी माहिती विद्यापीठाच्या मालमत्ता विभागातर्फे कनिष्ठ अधिकारी व्ही . एल . कावळे यांनी दिली .",379
विमानतळ,"या विमानांच्या उड्डाणांचे आणि उतरण्याचे वेळापत्रक उपलब्ध वेळेत कसे सामावून घ्यायचे , हाच विमान कंपन्या व विमानतळ प्राधिकरणासमोर मोठा पेच असेल .",4096
विमानतळ,नूतनीकरणासाठी रोज काही तास विमानतळ बंद ठेवावा लागेल .,5279
विमानतळ,पायरटन बेटाच्या जवळचे विमानतळ सात किलोमीटरच्या अंतरावर जामनगरमध्ये आहे .,8947
विमानतळ,माडायिप्पाराहून विमानतळ आहे करिप्पूर आंतरराष्ट्रीय विमानतळ ११८ किमी. अंतरावर आहे .,9342
विमानतळ,मलयाल कलाग्राममहून सर्वात जवळचे विमानतळ - करिप्पूर आंतराष्ट्रीय विमानतळ असून ते ६४ किमी. दूर आहे .,9352
विमानतळ,मुषप्पिलंगाडु बीचहून सर्वात जवळचे विमानतळ मंगळूर १४० किमी. दूर आहे तर करिप्पूर आंतरराष्ट्रीय विमानतळ १०३ किमी. दूर आहे .,9363
आपले,दालनात असलेल्या महापालिकेच्या बोधचिन्हाखाली त्यांनी आपले आसन हलविले .,233
आपले,"तिने आपले विचार व्यक्त करणारे एकच सुरेख पत्र डॉक्टरांना लिहून समजावले , आणि ती कायमची दूर झाली .",319
आपले,अमेरिका आपले उत्पादन वाढवित आहे .,342
आपले,"अटक झालेले आरोपी आपले नाव घेणार आणि पोलिस अटक करण्यासाठी येणार , या भीतीमुळे त्या सराफाने श्रीगोंद्याचे दुकान बंद करून दौंड ( जि . पुणे ) येथे दुकान सुरू केल्याची माहितीही पोलिसांना मिळाली ; मात्र दौंडमध्ये दुकानदाराला शोधायचे कसे , असा प्रश्‍न त्यांच्यासमोर पडला .",791
आपले,"यावेळी गोमंतक मराठी भाषा परिषदेचे अध्यक्ष रामनाथ ग . नाईक , मोहन कामत , प्रा . कृष्णाजी कुलकर्णी , उमेश पारकर , रामनाथ देसाई , चंद्रकांत पवार , संतोष कामडी , मंगेश बोंगाळे , गोविंद कुलकर्णी यांनी आपले विचार व्यक्त करताना मराठीला राजभाषेचे स्थान प्राप्त करून देण्याचा निर्धार व्यक्त केला .",854
आपले,डॉक्टरांनी आपले मोठे बंधू भाऊसाहेबांच्याद्वारा वडिलांच्या कानावर ही गोष्ट घातली .,1157
शहर,"राष्ट्रवादी पुरस्कृत शहर विकास आघाडी तीन , अपक्ष दोन असे मिळून ' राष्ट्रवादी ' कडे सध्या आठ नगरसेवक असल्याचे श्री. कुऱ्हाडे यांच्याकडून सांगण्यात आले .",1615
शहर,जिल्ह्यात काही ठिकाणी पडलेल्या दरोड्यांप्रकरणी आज तीन संशयितांना शहर पोलिसांनी ताब्यात घेतले .,3044
शहर,"दरम्यान , या तिघांना ताब्यात घेतल्यानंतर संबंधित समाजातील लोकांनी येथील शहर व ग्रामीण पोलिस ठाण्याच्या आवारात गोंधळ करण्याचा प्रयत्न केला .",3046
शहर,नंतर लोकांनी शहर पोलिस ठाण्याकडे मोर्चा वळविला .,3053
शहर,"महसूल विभागाशिवाय जिल्हा परिषदेबाबत २८ , ग्रामीण पोलिसांबद्दल १७ , महापालिकेबाबत १७ , पोलिस आयुक्तालयाबाबत ( शहर पोलिस ) १४ , उपनिबंधक सहकारी संस्था कार्यालयाबाबत १२ , वीज मंडळाबाबत आठ व अन्य २३ तक्रारी आहेत .",3776
शहर,मोसमी पावसाने शहर व परिसरात जोर धरला असून जनजीवन विस्कळित झाले आहे .,4412
वेळ,अपघातांच्या आणि अशा बातम्या देण्याची नेहमी वेळ येणारे पत्रकारदेखील अतिशय सुंदर उभारणी झालेल्या या वास्तूची झालेली दुरवस्था पाहून हळहळत होते .,365
वेळ,कोल्हापूरला बाबांच्या . जाण्याची वेळ नोव्हेंबरमध्ये उगवली .,661
वेळ,डॉक्टरांच्या ट्रेनची वेळ झाली होती .,710
वेळ,इरावतीबाई सारख्या पत्रातून डॉक्टरांना वडिलांना सांगायला इतका का वेळ लागतोय याची चौकशी करायच्या .,1153
वेळ,ती वसूल करण्यासाठी पुरेसा सेवकवर्ग नेमला तर ही वाढ करण्याची वेळ प्रशासनावर येणार नाही .,1515
वेळ,पाक व्यवस्थापकांनी हीच वेळ सकाळी १०.४५ असल्याचे सांगितले होते .,2086
१०,रात्री १० नंतर काही जणांचे मोबाईल सुरू झाले .,607
१०,या राज्यांनी जून १० ते १५ ऑगस्ट अशी ६७ दिवस मासेमारीवर बंदी घालण्यास विरोध दर्शविला आहे .,823
१०,या बैठकीत १० जून ते ३१ जुलै अशी बंदी घालण्यास हिरवा कंदील दाखविला आहे .,830
१०,राज्यात यांत्रिक बोटींद्वारे मासेमारी करण्यास १० जून ते १५ ऑगस्ट या कालावधीत बंदी असते .,841
१०,त्यापैकी १० जणांना शनिवारी ( ता . ३१ ) उपचारासाठी महापालिकेच्या कूपर रुग्णालयात दाखल करण्यात आले .,1039
१०,त्यांच्यावर आरे डेअरीतील युनिट १६ मधील दवाखान्यात उपचार करण्यात आले होते ; मात्र तेथील डॉक्‍टरांनी विद्यार्थ्यांची रक्‍ततपासणी केल्यानंतर त्यापैकी १० जणांना कूपर रुग्णालयात दाखल करण्यास सांगितले होते .,1042
तू,तू आजारी असे चोरून सांगितले .,135
तू,"कडाडतच ते म्हणाले - "" मला वाटलं होतं तू हे सगळं झूठ आहे म्हणून सांगशील .",695
तू,तू माझा फार मोठा अपेक्षाभंग केला आहेस .,696
तू,"सर्व सहचरींतर्फे "" मुक्तपीठ ' मधील "" हताश आई ' ला सांगावे असे वाटते , की तू अजिबात हताश होऊ नकोस .",996
तू,"तो यायला तयार नसेल , तरी तू जा .",998
तू,"मला आठवतंय , मी लहान असताना मला ताई - भाऊंकडे ( आजी - आजोबांकडे ) रहायला ठेवून तू दोन वर्षे कोसबाडला कोर्ससाठी गेली होतीस .",2362
पिके,"त्यामुळे शेतकऱ्यांनी खासगी सावकारांकडून कर्जे काढून विहिरींवर वीज पंप बसविले , महागडे बी - बियाणे , खते खरेदी करून पिके घेतली .",1291
पिके,"मात्र , पाण्याअभावी हातची पिके जात असल्यामुळे पिकांसाठी कर्जाऊ घेतलेल्या रकमा सावकाराला परत करता येतील का , या विवंचनेत बळिराजा सापडला आहे .",1292
पिके,तोपर्यंत त्या भागातील पिके अर्धवट जळालेली असतात .,1304
पिके,"मध्यरात्री पावसाचा मोठा जोर वाढल्याने ओढ्या नाल्यांच्या पात्राबाहेर पाणी जाऊन अनेक ठिकाणी शेतींचे ताली तुटून शेतात पाणी गेले आहे , तसेच सलग पाच दिवस जोराचा पाऊस असल्याने शेतांमध्येही पाणी साचून पिके पिवळी पडू लागली आहेत .",5543
पिके,क्रमाने पिके बदलल्यामुळे जंतूंच्या लोकसंख्येची पातळी कमी होण्याची शक्यता असते .,6300
पिके,"संधी पीक पद्धतीमध्ये , जेव्हा जमिनीत पुरेसे पाणी असते व खात्रीलायक पेरणीची संधी असते तेव्हा पिके घेतली जातात .",6321
बाजूला,"दुसऱ्या बाजूला कोकणातील सिंचन प्रकल्प मार्गी लावण्यासाठी पाच हजार ६७६ कोटी रुपयांची गरज असताना या अर्थसंकल्पात फक्त ११७ कोटी ४७ लाख रुपयांची तरतूद करण्यात आली आहे , त्यामुळे कोकणातील या प्रश्‍नाकडे शासनाचे पूर्णपणे दुर्लक्ष झाले आहे , असे त्यांनी सांगितले .",1015
बाजूला,शिवाजी पार्क येथील महापौर निवासाच्या बाजूला असलेला महापालिकेच्या अखत्यारीतील महात्मा गांधी तरणतलाव हा ११ नोव्हेंबर २००५ पासून दुरुस्तीच्या नावाखाली बंद होता .,2459
बाजूला,वातानुकूलित बोगीच्या दोन्ही बाजूला दारांमध्ये बंदूकधारी पोलिस आणि दोन बोगींमधील जागेमध्येही पोलिस असल्याने बोगीला पोलिसांच्या गाडीचेच स्वरूप आल्यासारखे वाटत होते .,2774
बाजूला,तिथेच पुढच्याच बाजूला एक मोकळी बस उभी होती .,3130
बाजूला,"एका बाजूला उंचच उंच शिवालिक पर्वतरांगा NULL , तर दुसऱ्या बाजूला खोल दरी NULL .",3383
बाजूला,चारी बाजूला असलेल्या त्यांच्या जाड कडा सुरीने कापून घ्या .,3393
डॉक्टर,मी त्यांना नुसतं ' डॉक्टर ' एवढंच म्हणायचं .,138
डॉक्टर,डॉक्टर तिला स्वतंत्रपणे हातही उचलून दाखवू शकले नाहीत .,282
डॉक्टर,डॉक्टर काही बाबतीत माझे ऐकू लागले .,292
डॉक्टर,आत्ती आणि डॉक्टर नेहमीसारखे कामात NULL .,296
डॉक्टर,"रिझर्व्ह बँकेचे काम तर निव्वळ डॉक्टर होते , म्हणूनच होऊ शकले , नाही तर जायलाच मिळाले नसते .",298
डॉक्टर,"स्टेशनसमोर येताना डॉक्टर म्हणाले - - "" डब्यापर्यंत चल ना .",714
प्रवास,ठाकुर्लीनंतर कल्याणपर्यंतचा प्रवास आठ ते दहा मिनिटांचा आहे ; मात्र कामामुळे चार ते पाच तास लागत आहेत .,26
प्रवास,सोमवारी मुंबईला जाणारे बहुतांशी प्रवासी एसटीने भिवंडी बायपासमार्गे प्रवास करण्याची शक्‍यता आहे .,28
प्रवास,"नवी मुंबईत जाणारे नवी मुंबई , कल्याण परिवहनच्या बसने प्रवास करण्याच्या शक्‍यतेमुळे या बसना प्रचंड गर्दी होणार आहे .",29
प्रवास,"पहिला परदेशीचा प्रवास आणि तोही डॉक्टारांच्याबरोबर , मी भलतीच खुशीत होते .",299
प्रवास,गंगेच्या काठच्या कॅम्पपासून सुरवात केली तर चार तास प्रवास होतो .,940
प्रवास,परत प्रवास सुरू होतो .,946
त्यांचा,म्हणूनच मुलीचे लग्न हा आता संस्कार नाही तर तो त्यांचा अंत्यसंस्कार ठरत आहे .,182
त्यांचा,त्यांचा विवाह ही आता काळा पैसा गोरा करण्याची सोय झाली आहे .,183
त्यांचा,ते खपविण्यासाठी भारत व चीनच्या बाजारपेठेवर त्यांचा डोळा आहे .,343
त्यांचा,सव्वाबाराच्या सुमारास त्यांना आग लागल्याचा निरोप आला तेव्हा त्यांचा विश्वास बसला नाही .,372
त्यांचा,त्यामुळे डॉक्टर काशिनाथ घाणेकरही हीरो म्हणून हवेत असा त्यांचा आग्रह होता .,730
त्यांचा,"त्यांनी अंतर्गत सुरक्षा मंत्रालयाला दिलेल्या अहवालात वूल्मर यांचा खून झाल्याचा एकही सबळ पुरावा सापडला नसून , त्यांचा मृत्यू नैसर्गिकरीत्याच झाला असल्याचे म्हटले आहे .",1077
दक्षिण,"हे खग्रास चंद्रग्रहण संपूर्ण भारतासह अंटार्टिका , आशिया , युरोप , दक्षिण , मध्य व उत्तर अमेरिकेसह जपान , चिनचा काही भाग , रशिया , फिलिपाईन्स , इंडोनेशिया येथून दिसेल .",552
दक्षिण,"दक्षिण अमेरिका , अटलांटिक महासागर , अंटार्टिकामधून ते दिसेल .",563
दक्षिण,"मात्र दक्षिण गुजरात , सौराष्ट्र व कच्छ भागात मुसळधार सुरूच होती .",1364
दक्षिण,सोळा कोटी वर्षांपूर्वी दक्षिण गोलार्धातील गोंडवन नामक संयुक्त खंडांचा एक भाग भारतीय उपखंडाने व्यापलेला होता .,1633
