wordcontent,sentences,index
मध्य,"हे खग्रास चंद्रग्रहण संपूर्ण भारतासह अंटार्टिका , आशिया , युरोप , दक्षिण , मध्य व उत्तर अमेरिकेसह जपान , चिनचा काही भाग , रशिया , फिलिपाईन्स , इंडोनेशिया येथून दिसेल .",552
मध्य,मध्य भारतात गेल्या काही वर्षांत डायनासोरची हजारो अंडी जीवाश्‍मांच्या स्वरूपात सापडली आहेत .,1630
मध्य,साधारणतः मध्य भारतामधील दहा हजार चौरस किलोमीटरच्या भागात गेल्या काही वर्षांमध्ये डायनासोरची हजारो अंडी जीवाश्‍मांच्या स्वरूपात सापडलेली आहेत .,1634
मध्य,कारण मध्य भारतामध्ये इतर जगाच्या तुलनेत एकूण सापडलेल्या अंड्यांचे जीवाश्‍म कमी असले तरी त्यांच्यामधील विविधता लक्षणीय आहे .,1674
मध्य,"महाराष्ट्र , मध्य प्रदेश , उत्तर प्रदेश , राजस्थान , हरियाणा , दिल्ली , पंजाब अशा सात राज्यांतून दोन हजार किलो मीटरचा प्रवास पूर्ण करीत २९ मार्च रोजी यात्रा वाघा सीमेपर्यंत पोहोचली .",2501
चांगली,ती विवाहित स्त्री चांगली तिशी उलटलेली होती .,323
चांगली,"असे असले तरी येथील नाट्यचळवळीस रसिक चांगली साथ देत होते ; परंतु जिल्ह्यात बंदिस्त नाट्यगृह नसल्याने व्यावसायिक रंगभूमीवरील कलाकार , निर्माते कोकणच्या दिशेने वळत नव्हते .",1823
चांगली,जिल्ह्यातील सांस्कृतिक विकासाला चांगली दिशा मिळाली आहे .,1841
चांगली,यामुळे जिल्ह्यात उद्‌भवलेल्या अतिरिक्त उसाचे गाळप करण्यास कारखान्याने चांगली मदत केली असल्याचेही श्री . काळे यांनी सांगितले .,2685
चांगली,"इरावतीबाई म्हणाल्या म्हणे की , निदान मुलगी तरी चांगली शोधली आहे .",2867
चांगली,"या राजवाड्याच्या देखभालीची जबाबदारी राज्य शासन व सार्वजनिक बांधकाम विभागाकडे आहे , असे स्पष्ट करून श्री . भोसले म्हणाले , "" सध्या या राजवाड्याची अवस्था फारशी चांगली नाही .",3334
भारताच्या,"नेताजी सुभाषचंद्र बोस यांच्याबाबत आपल्याकडे कोणतीही माहिती नाही , असे "" रिसर्च अँड ऍनॅलिसिस विंग ' ( रॉ ) या भारताच्या प्रमुख गुप्तचर संघटनेने प्रथमच जाहीर केले आहे .",581
भारताच्या,"त्या जाहीर झाल्या , तर भारतात मोठी तीव्र प्रतिक्रिया उमटेल आणि भारताच्या मित्रदेशांबरोबरच्या संबंधांनाही हानी पोचेल .",593
भारताच्या,आता यानुसार निंबस ; तसेच खासगी वाहिन्यांना भारताच्या प्रत्येक सामन्याचे थेट प्रक्षेपण करत असताना दूरदर्शनलाही क्‍लीन लाइव्ह फीड देणे बंधनकारक होणार आहे .,623
भारताच्या,भारताच्या सानिया मिर्झाने जागतिक क्रमवारीत एक क्रमांक प्रगती केली आहे .,1959
भारताच्या,भारताच्या शिखा ओबेरॉयचा २३२वा क्रमांक आहे .,1966
भारताच्या,"लोकमान्य टिळक आणि महात्मा गांधी यांनी भारताच्या स्वातंत्र्यलढ्याला एक वेगळे वळण दिले , म्हणूनच त्या काळात सर्व जाती धर्मातील नेते या लढ्यात भाग घेऊ शकले .",2237
शांत,घरात मात्र वातावरण वरवर शांत असलं तरी त्याखाली अस्वस्थता दबलेली होती .,1125
शांत,"महर्षी कर्वे तसे शांत प्रवृत्तीचे , प्रसिद्धीपासून दूर राहणारे NULL .",1685
शांत,महापालिका निवडणुकीच्या मतदानादरम्यान विविध पक्षांच्या गटांतील मारामाऱ्या तसेच दगडफेकीच्या काही घटनांमुळे आज शांत वातावरणाला गालबोट लागले .,1913
शांत,आजी वारल्यानंतर हसरी - खेळती अश्‍विनी शांत आणि विक्षिप्त झाली .,5103
शांत,गहू हे प्रामुख्याने मध्य अक्षांश गवताळ प्रदेशांतील पीक आहे आणि त्याला शांत हवामान व मध्यम स्वरूपाचा पाऊस लागतो .,7223
शांत,"थोडक्यात गव्हाच्या पिकाला मध्यम स्वरूपाच्या पावसासह शांत हवामान , सपाट व चांगल्या प्रकारे निचरा झालेले सपाट क्षेत्रे , सुपीक रवाळ लोम माती आणि भरपूर पाणी पुरवणारे उत्तम सिंचन , एचवायव्ही बियाणे , रासायनिक खते व यांत्रिकरण ह्या सर्व घटकांच्या समायोजनाची गरज असते .",7233
दिवसांत,या प्रश्‍नावर युनियनने विनंतीपत्र दिल्यास आठ दिवसांत संबंधित अधिकाऱ्यांची बैठक घेण्याचे आश्‍वासन डावखरे यांनी दिले आहे .,195
दिवसांत,"या मागण्या सोडविण्याबाबत संघटनेने विनंतीपत्र दिल्यास , येत्या आठ दिवसांत परिवहन समितीचे सभापती , महापालिका आयुक्त , प्रवासी संघटना आणि संबंधित अधिकाऱ्यांची बैठक घेण्यात येईल .",209
दिवसांत,पंचवीस दिवसांत दुसऱ्यांदा हा संच बंद पडला आहे .,451
दिवसांत,१ ) पंचवीस दिवसांत दुसऱ्यांदा बंद,467
दिवसांत,"शासकीय आकडेवारीनुसार गेल्या दोन दिवसांत सुमारे ८५ , तर गेल्या २४ तासांत ३० जणांचा मृत्यू झाला आणि सुमारे ४५ हजार लोक विस्थापित झाले आहेत .",1353
दिवसांत,गेल्या दोन दिवसांत मुंबई व महाराष्ट्राकडे जाणाऱ्या २६ रेल्वेगाड्या रद्द करण्यात आल्या .,1359
अथवा,ही जरी माझी परिस्थिती असली तरी कधी एका शब्दाने अथवा कृतीनेही मी माझे डॉक्टरांविषयीचे प्रेम डॉक्टरांच्याजवळ व्यक्त केले नव्हते .,286
अथवा,""" बाबांनी तुला सांगितलंय की मला फोन करू नकोस अथवा भेटू नकोस मला कुठं तसं सांगितलंय की तुला फोन करायचा नाही किंवा भेटायचं नाही म्हणून "" !",1111
अथवा,"अमेरिकेतील शासनाच्या अपंगांबद्दलचे कायदे व आधुनिक शिक्षण पद्धतीमुळे अल्पदृष्टी असूनही , ऋताने कधी अंधांची काठी अथवा ब्रेल लिपीला हात लावला नाही .",1244
अथवा,पेय थंड अथवा गरम ठेवण्यासाठी थर्मासचा उपयोग केला जातो .,3436
अथवा,वसाहत अथवा इमारत दुरुस्तीसाठी सरकार थेट सार्वजनिक बांधकाम विभागाकडे ( पीडब्ल्यूडी ) पैसे देते .,4540
अथवा,याबरोबरच दुरुस्तीचे काम पूर्ण झाल्यानंतर ते योग्य प्रकारचे आहे अथवा नाही याचाही अभिप्राय या पोलिस अधिकाऱ्यांना देण्यास आयुक्तांनी सांगितले आहे .,4545
तरीही,"मात्र , तरीही प्रत्येकाने सर्वस्व पणास लावले , असे पथकाचे समन्वयक डॉ. चंचलकुमार हल्दर यांनी सांगितले .",979
तरीही,तरीही पहिल्या दिवसापासून फक्त स्थायी समितीवरील नियुक्तीच चर्चेचा केंद्रबिंदू ठरली आहे .,1273
तरीही,"तरीही याही वर्षी योग आलाच नाही , ' असे अनुभव पुरोहित उल्हास देव यांनी सांगितले .",1478
तरीही,"पॅकिंग तसेच असते , त्यावर अठरा ग्रॅम असे प्रिंटही केले जाते , मात्र तरीही ग्राहकांच्या ते कधी लक्षात येत नाही .",2012
तरीही,तरीही ते सर्रास पाच रुपये पाकीटप्रमाणे विकले जातात .,2019
तरीही,"पुण्यात राहणाऱ्या , कामानिमित्त येथे आलेल्या किंवा शिकण्यासाठी पुणे निवडलेल्या युवा पिढीची अशा पार्ट्यांबाबतची प्रतिक्रिया "" त्यात काय मोठे ? ' अशी काहीशी असली , तरीही बहुसंख्य पालकांना मात्र तसे वाटत नाही , असेच या सर्वेक्षणातून स्पष्ट झाले आहे .",2070
उपयुक्त,"पाण्याचा अमर्याद वापर , नासाडी आणि अपव्यय या सर्वावर शेतकऱ्यांच्या सिंचन व्यवस्थापनाने अंकूश राहणार असल्याने कायद्याचे काटेकोर पालन झाल्यास तो अतिशय उपयुक्त ठरणार आहे .",3807
उपयुक्त,पहिल्या डावात १०४ धावांनी पिछाडीवर पडलेल्या पाकिस्तानला आज तळाच्या फलंदाजांच्या उपयुक्त खेळामुळे दुसऱ्या डावात ३०२ धावांपर्यंत मजल मारता आली .,5296
उपयुक्त,ही पद्धती प्रामुख्याने बियाणांच्या तपासणीसाठी तसेच कमी प्रमाणातील बियाणांसाठी उपयुक्त आहे .,6884
उपयुक्त,संरोपणाचा उद्देश कडधान्यांच्या बियाणांवर पुरेश्या अनेक जीवाणूंचे योग्य प्रमाणातील आवरण शेतात जलद आणि परिणामकारक ग्रंथीकरणासाठी उपयुक्त ठरते .,6885
उपयुक्त,"आशियामध्ये तृणधान्ये व काही कडधान्याचे पीक यासाठी वापरले जाणारे सामान्य , प्राण्यांद्वारे केलेले वेधन आणि नांगरणीतील बदल हे वृत्तीय गवताच्या बियाणासाठी उपयुक्त नसते परंतु रेग्राससाठी वापरले जाऊ शकते .",7018
उपयुक्त,हे एक काटक पीक आहे आणि कोरडवाहू दुष्काळी प्रवण क्षेत्रे व सॉडिक स्थितीसाठी अगदी उपयुक्त आहे .,7175
तेथील,"परंतु , मराठवाडा आणि नाशिक येथील जोडण्या या मेनस्वीचवरून कार्यान्वित करण्यात आल्यामुळे , तेथील मोबाईल लवकर सुरू होऊ शकले नाही .",608
तेथील,"कर्नाटकमध्येही या प्रकारचा कायदा करण्यात आला होता ; पण तेथील उच्च न्यायालयाने तो रद्द ठरविला असल्याने राज्यात हा प्रस्तावित कायदा लागूच करू नये , अशी मागणी मुख्यमंत्री आणि राज्यातील सर्व आमदारांना पत्राद्वारे केली आहे , असे त्यांनी नमूद केले .",886
तेथील,त्यांच्यावर आरे डेअरीतील युनिट १६ मधील दवाखान्यात उपचार करण्यात आले होते ; मात्र तेथील डॉक्‍टरांनी विद्यार्थ्यांची रक्‍ततपासणी केल्यानंतर त्यापैकी १० जणांना कूपर रुग्णालयात दाखल करण्यास सांगितले होते .,1042
तेथील,त्या वेळी त्यांचे क्रेडिट कार्ड तेथील कर्मचाऱ्याकडे राहिले .,1521
तेथील,"ते पुढे म्हणाले , "" "" परग्रहावर जीवसृष्टी असेल , तर तेथील वायू वेगळा असू शकतो .",1551
तेथील,"तेथील सृष्टीला ऑक्‍सिजनऐवजी दुसरा वायू जीवनावश्‍यक वाटत असेल ; मात्र जीवसृष्टी असेलच , तर आपल्याला त्याचे फायदे व तोटेही होऊ शकतात .",1552
नदी,तिबेटमधून चीनमध्ये व नंतर तेथून म्यानमार व थायलंडमध्ये सालवीन नदी वाहत जाते .,397
नदी,एकही धरण नसलेली जगातील ही एकच नदी आहे .,398
नदी,डोंगराच्या ह्या बाजूला एक सुंदर नदी आहे .,7907
नदी,पूर्णा नदी गवामधून वाहते .,8204
नदी,नर्मदा नदी गंगेएवढी / इतकी पवित्र समजली जाते .,8786
नदी,रजप्पा छिन्नमस्तिका मंदिर दामोदर नदी आणि भेडा नदी ( भैरवी नदीच्या ) संगम स्थानावर वसलेले आहे .,9044
महापालिकेच्या,"ते म्हणाले , की या संपूर्ण प्रकरणाची आपण माहिती घेतली असून महापालिकेच्या प्रयोगशाळेत मेसमधील अन्नाचे नमुने पाठविण्यात आले आहेत .",192
महापालिकेच्या,दालनात असलेल्या महापालिकेच्या बोधचिन्हाखाली त्यांनी आपले आसन हलविले .,233
महापालिकेच्या,"विशेष हेतूने दालनातील आसनव्यवस्था बदलली नसून महापालिकेच्या बोधचिन्हाखाली आसन असावे , असे महापौर झाल्यापासून वाटत होते , असे डॉ. राऊळ यांनी सांगितले .",236
महापालिकेच्या,त्यापैकी १० जणांना शनिवारी ( ता . ३१ ) उपचारासाठी महापालिकेच्या कूपर रुग्णालयात दाखल करण्यात आले .,1039
महापालिकेच्या,महापालिकेच्या कायद्यानुसार कर संदर्भातील प्रस्ताव स्थायी समितीपुढे मांडणे प्रशासनावर बंधनकारक आहे ; परंतु प्रशासनाने हा प्रस्ताव मुदतीत सादर केला नाही .,1496
महापालिकेच्या,महापालिकेच्या कर आकारणी - कर संकलन खात्याच्या कारभाराचा आणखी एक अजब नमुना समोर आला आहे .,1533
ठाकरे,पवारांशी असलेल्या जुन्या मैत्रीचा दाखला देत शिवसेनाप्रमुख बाळासाहेब ठाकरे यांनी आज केंद्रीय कृषीमंत्री शरद पवार यांच्यापुढे पुन्हा एकदा मैत्रीचा हात पुढे केला .,406
ठाकरे,पवार हा उमदा माणूस आहे ; मात्र ते कधी काय डावपेच खेळतील हे सांगता येत नसल्याचेही ठाकरे म्हणाले .,414
ठाकरे,महाराष्ट्र नवनिर्माण सेनेचे अध्यक्ष राज ठाकरे यांनी अलीकडेच बिहारींसंदर्भात केलेल्या विधानासंदर्भात बाळासाहेबांना प्रतिक्रिया विचारण्यात आली होती ; मात्र त्यांनी त्यावर भाष्य करण्यास नकार दिला .,416
ठाकरे,"मराठा विद्या प्रसारक समाज संस्थेचे सरचिटणीस आमदार डॉ. वसंत पवार , चिटणीस मोठाभाऊ भामरे , उपसभापती ऍड . नितीन ठाकरे , संचालक मोहन पिंगळे , अशोक बच्छाव , प्राचार्य डॉ. व्ही . बी . गायकवाड उपप्राचार्य डॉ. एम. एन. जाचक , विद्यार्थिनी प्रतिनिधी लहानू जाधव आदी व्यासपीठावर उपस्थित होते .",1945
ठाकरे,उद्धव ठाकरे,3217
ठाकरे,"त्यामुळे राज्यातील काळोखाला कॉंग्रेस राष्ट्रवादी - कॉंग्रेसचे नाकर्ते धोरणच जबाबदार आहे , असा आरोप शिवसेनेचे कार्याध्यक्ष उद्धव ठाकरे यांनी रविवारी ( ता . २२ ) तुळजापूर येथे पत्रकारांशी बोलताना केला .",3220
लवकर,"परंतु , मराठवाडा आणि नाशिक येथील जोडण्या या मेनस्वीचवरून कार्यान्वित करण्यात आल्यामुळे , तेथील मोबाईल लवकर सुरू होऊ शकले नाही .",608
लवकर,"यामुळे विकासाला गती मिळून लवकर कामे सुरू करणे शक्‍य होईल , असे बेंजामिन यांनी सांगितले .",1710
लवकर,मलाही लवकरात लवकर गाण्याची इच्छा आहे .,2317
लवकर,"गणपतीचे वाहन मूषक असल्याने त्याची मदत घेऊन अमिताभने आपली मागणी सिद्धिविनायकाकडे केली असावी , असा अर्थ काढून अन्‌ तोच धागा पकडून संबंधित वक्ते म्हणाले , "" पुण्यात श्रीमंत दगडूशेठ हलवाई गणपतीपर्यंत आपली मागणी पोचवायची झाल्यास "" तात्यां'च्या माध्यमातून केली की लवकर पोचते !",2613
लवकर,आदित्यला लवकरात लवकर खासगी रुग्णालयात हलवायचे होते .,3093
लवकर,उसाचा प्रश्‍न लवकर सोडवावा अन्यथा आंदोलन करण्याचा इशारा यापूर्वीच शिवसेनेने दिला आहे .,3227
