wordcontent,sentences,index
आपला,"पण ज्या वेळेला तिला आपला पती , संसार , विवाहिता म्हणून आपला समाजात असलेला दर्जा आणि हे प्रकरण चव्हाट्यावर आले तर होणारी मानहानी या सर्वांचे भान आले तेव्हा पुढे अधिक न वाहवण्याचा तिने खंबीर निर्णय घेतला .",316
आपला,"त्यावर बोलताना बाळासाहेब म्हणाले , की शिवसेनेने राष्ट्रवादी कॉंग्रेसशी युती करण्याला आपला विरोध नाही .",411
आपला,भारतीय संघाची पोस्टर्स जाळत क्रीडाप्रेमींनी आपला राग व्यक्‍त केला .,418
आपला,"मात्र , शिवसेनेने आपला पाठिंबा कोणाला द्यायचा , हे अद्याप निश्‍चित केलेले नाही .",576
आपला,सर्व जगापासून आपला संबंध तुटतो .,924
आपला,मात्र आपला उमेदवार अद्याप निश्‍चित नसल्याचे आणि त्याबाबत चर्चेची प्रक्रिया सुरू असल्याचे सांगून कॉंग्रेसने मार्क्‍सवाद्यांच्या उत्साहावर पाणी पाडले .,985
येतो,"आजूबाजूचा निसर्ग न्याहाळत असतानाच महत्त्वाचा पॉइंट "" रोलर कोस्टर "" येतो .",948
येतो,"शेवटचा टप्पा "" वॉल "" येतो .",954
येतो,ज्युरासिक काळ हा साधारणतः १४.४ ते २०.४ कोटी वर्षांमध्ये येतो .,1677
येतो,"भारतीय व्यापाऱ्यांकडे पाकिस्तानी बासमती तांदूळ कसा येतो , याचे उत्तर देण्याचे मात्र या उत्पादकाने टाळले .",1889
येतो,हा प्रश्‍न मनात येतो तेव्हा यातून निघण्याच्या खूपच कमी वाटा असल्याचे जाणवते .,2412
येतो,"सकाळी नऊ वाजता ड्रेसिंग करायला येतो , असे सांगितले पण आले रात्री १२ वाजता .",3111
त्यावर,त्यावर १४ ऑक्‍टोबर २००४ला न्यायालयाने उद्योगनगरी स्थापण्याचा आदेश शासनाला दिला .,95
त्यावर,त्यावर मतदारसंघांच्या पुनर्रचनेचे कारण शासनाने पुढे केले .,97
त्यावर,"त्यावर बोलताना बाळासाहेब म्हणाले , की शिवसेनेने राष्ट्रवादी कॉंग्रेसशी युती करण्याला आपला विरोध नाही .",411
त्यावर,महाराष्ट्र नवनिर्माण सेनेचे अध्यक्ष राज ठाकरे यांनी अलीकडेच बिहारींसंदर्भात केलेल्या विधानासंदर्भात बाळासाहेबांना प्रतिक्रिया विचारण्यात आली होती ; मात्र त्यांनी त्यावर भाष्य करण्यास नकार दिला .,416
त्यावर,"त्यावर भाष्य करताना बाळासाहेब म्हणाले , की आता सेहवागने बर्म्युडाविरोधात शतक ठोकले आहे .",419
त्यावर,मग त्याची आरती करणार की त्यावर बल्लेबल्ले करून नाचणार ?,420
जिल्ह्यातील,जालना जिल्ह्यातील रॉकेल वितरणात सुधारणा करण्यासाठी ठोस उपाय योजण्याचे आदेश राष्ट्रवादी कॉंग्रेसचे नेते व पालकमंत्री राजेश टोपे यांनी दिले आहेत .,380
जिल्ह्यातील,"श्री . टोपे म्हणाले , की जिल्ह्यातील जनतेच्या रॉकेल वितरणाबाबत तक्रारी आहेत .",384
जिल्ह्यातील,आपल्याकडे आणि जिल्ह्यातील अन्य लोकप्रतिनिधींकडे याबाबतीत लोक वारंवार तक्रारी करतात .,386
जिल्ह्यातील,"रायगड जिल्ह्यातील सिंचन क्षेत्रातील अनुशेष चुकीचा मांडला असेल , तर त्याचा फेरसर्व्हे करण्यात येईल , अशी घोषणा जलसंपदा राज्यमंत्री डॉ. सुनील देशमुख यांनी शुक्रवारी ( ता . ३० ) विधानसभेत केली .",1010
जिल्ह्यातील,"या चर्चेला उत्तर देताना जलसंपदा राज्यमंत्री सुनील देशमुख यांनी कोकणातील विशिष्ट भौगोलिक परिस्थितीमुळे मोठ्या प्रमाणावर पाटबंधारे प्रकल्प उभारता येत नाहीत असे सांगितले ; मात्र रायगड जिल्ह्यातील सिंचनाच्या अनुशेषाबाबत चुकीचा अहवाल दिला असेल तर त्याचा फेरसर्व्हे केला जाईल , असे त्यांनी जाहीर केले .",1017
जिल्ह्यातील,जामखेड येथे शनिवारी रात्री पडलेला दरोडा या वर्षातील जिल्ह्यातील पहिलाच दरोडा आहे .,1225
जाणार्‍या,येणार्‍या - जाणार्‍या लोकांची मात्र हा मजकूर वाचून करमणूक होत होती .,4054
जाणार्‍या,मका हा इतर चारा म्हणून वापरल्या जाणार्‍या तृणधान्यापेक्षा बायोमास निर्मितीसाठी जास्त मोठ्या प्रमाणात वापरला जातो .,6242
जाणार्‍या,"जमीनीवरील मूगापासून मिळवले जाणार्‍या मूगाच्या स्टार्च वापर पारदर्शक सेलोफेन न्यूडल्स बनविण्यासाठी केला जातो ( बियांचे न्युडल , बियांचे धागे , ग्लास न्यूडल्स् फेन्सीतुंगहून म्हणूनही प्रसिद्ध आहेत ) .",6277
जाणार्‍या,राजस्थानमध्ये डाळ करण्यासाठी ही वापरली विशेषतः बाटीबरोबर खाण्याकरता केल्या जाणार्‍या डाळीसाठी वापरतात .,6416
जाणार्‍या,"वळवणी आणि हलवून पसरवून टाकणे ह्या नेहमी हाताने केल्या जातात , जरी घोड्याद्वारे खेचल्या जाणार्‍या डंप-रेक्स , स्वीप्स आणि टेडिंग यंत्रे ही गवतकापणीयंत्रांसोबत समांतर तयार केली जात असली तरी , आणि नंतर यांत्रिक कर्षणासाठी जुळवून घेतली जात तरी ( वापरली गेली असली तरी",6454
जाणार्‍या,जाणार्‍या दुधारी पात्याचे गवतकापणीयंत्र सुरू करण्यात आले होते आणि लगेचच मोठ्या शेतीचे प्रमुख गवतकापणीयंत्र बनले .,6539
रूपात,डायनासोरचे अंडे प्रथम फ्रान्समध्ये जीवाश्‍माच्या रूपात १८६९ मध्ये मिळाले होते .,1668
रूपात,"केशरी शिरा असलेले पिवळ्या पाकळ्या , वाटाण्यासारखा आर्चिज् हायपोजिआ झुडपांच्या गुच्छांच्या रूपात जमिनीवर उगवतात .",6442
रूपात,"ही उत्पादने धान्याच्या रूपात , मुरवैरणीच्या रूपात किंवा नळ्यांच्या रूपात दुभत्या जनावरांना व मांसासाठी वाढविलेल्या जनावरांना दिले जाते .",6496
रूपात,"अमोनिया हा नंतर दुसर्‍या रूपात अमोनियममध्ये ( NH4+ ) रूपांतरित होतो , जो पुढील प्रतिक्रियेद्वारे ( काही ) वनस्पतींद्वारे वापरण्याजोगा असतो .",6585
रूपात,ते मिष्टान्न ( चिक्की ) किंवा गोड नाश्ताच्या रूपात देखील शुद्ध साखर आणि गूळ प्रक्रियाकरून छोटे तुकडेकरून वापरले जातात .,7464
रूपात,"काही वृत्तीय , स्टोलोनिफिअरस किंवा र्‍हिजोमाटस प्रजाती , किंवा मोठी कडक किंवा डहाळीदार गवते सामान्यतः नैमित्तिक भाज्यांच्या रूपात प्रसिद्ध आहेत .",7670
शकता,याच पद्धतीनी जॅमच्या ऐवजी सॉस लावूनही तुम्ही सॅंडविच बनवू शकता .,3398
शकता,कलापर्यटनात खुल्या निसर्गात तुम्ही तुमच्या आवडत्या कलाकाराच्या सहवासात दीर्घ काळ राहू शकता .,3554
शकता,मोर्चाच्या वेळी ही पिके रस्त्यातदेखील फेकू शकता : ही पद्धत युरोपिअन युनिअनमध्ये सर्वसामान्य आहे .,6799
शकता,"लक्षात ठेवा की हा शब्द ह्या माध्यमाने कापता येणार्‍या किंवा कापू शकता येणार्‍या पिकाच्या जळण्याला / ज्वलनाला लागू पडत नाही , उदाहरणार्थ ऊस .",6801
शकता,; गळून पडलेली पाने नंतर झाडून टाकू शकता .,7280
शकता,"तूर ह्या खूप दुष्काळरोधी ( दुष्काळ प्रतिरोधी ) असतात , म्हणून त्या ६५० मिमि. वार्षिक पावसापेक्षा कमी असलेल्या क्षेत्रांमध्ये उगवू शकता .",7361
श्री.,"फा. सॉलोमन रॉड्रीग्ज , सिस्टर सांतान नागो , सि. ब्लेसिना , फादर फ्रान्सिस डाबरे व पत्रकार मायकल घोन्सालवीस यांचा सत्कारही श्री. धर्माधिकारी यांच्या हस्ते करण्यात आला .",186
श्री.,असे श्री. कुमार यांनी या पत्रात म्हटले आहे .,588
श्री.,श्री. धर मात्र ' रॉ ' च्या उत्तराबाबत समाधानी नाहीत .,590
श्री.,"परंतु , मोबाईल सेवेचा कार्यभार सांभाळणारे उपसरव्यवस्थापक श्री. लोढा हे नुकतेच येथे रुजू झाल्यामुळे , त्यांना नेमकी समस्या कुठे आहे , याचा शोध घेणे अवघड गेले .",603
श्री.,"श्री. भांडवलकर यांना मारहाण केली , तर त्यांच्या वयोवृद्ध मातुःश्री मालनबाई यांच्या कानातील दागिन्यांसह उजवा कान कापून नेला .",1197
श्री.,"दरम्यान , रस्त्यालगतच्या डॉ.गिते यांचे घर फोडण्याचा प्रयत्न झाला ; परंतु श्री. राजगुरू यांचा मुलगा मधुसूदन तेथे एकटाच झोपलेला होता .",1200
पर्यटकांना,जिल्ह्यात येणाऱ्या पर्यटकांना पाचगणी - महाबळेश्‍वर व कोयना धरणाशिवाय फारशी माहिती मिळत नाही .,2624
पर्यटकांना,"शासनाने या संग्रहालयांची माहिती बेवसाईट , तसेच जाहिरात करून केल्यास जास्तीत - जास्त पर्यटकांना या संग्रहालयांकडे आकर्षित करता येईल .",2626
पर्यटकांना,कोनीफर्स येथे पर्यटकांना थांबायचे असेल तर ते थांबू शकतात .,8890
पर्यटकांना,ह्या बेटावर ना कुठे जेवणाची योग्य सोय आहे आणि ना पिण्याच्या पाण्याची म्हणून पर्यटकांना येथे येण्याआधीच पाणी आणि जेवणाची योग्य व्यवस्था केली पाहिजे .,8981
पर्यटकांना,""" गिरीडिह एक अत्यंत प्राचीन तसेच सुंदर शहर जे मनोरम पर्वत आणि पर्वतांच्या कुशीत वसलेले आहे , तसेच सुरूवातीपासूनच भटकंती करणार्‍या मुख्यत्वेकरून पश्चिम बंगालपासून पर्यटकांना आपल्याकडे आकर्षित करते . """,9059
पर्यटकांना,उसरी धबधब्याचे रमणीय दृश्य हजारो पर्यटकांना दररोज आकर्षित करते .,9088
सेवा,"भारत संचार निगम लिमिटेडचा नागपुरातील मेनस्वीच बिघडल्याने आज ( ता. १ ) सकाळपासून बी. एस. एन. एल. ची विदर्भ , मराठवाडा आणि नाशिक येथील मोबाईल सेवा कोलमडली .",595
सेवा,या स्वीचमध्ये अचानक बिघाड निर्माण झाल्यामुळे बीएसएनएलची मोबाईल सेवा कोलमडली .,601
सेवा,"या दरम्यान कधी सेवा सुरू होत होती तर कधी बंद , काही जणांना ' एसएमएस ' ची देवाण - घेवाण करणे शक्‍य होत होते .",605
सेवा,काही ग्राहकांनी सांगितल्यानुसार गेल्या तीन - चार दिवसांपासून मोबाईल सेवा बिघडली होती .,606
सेवा,खासगी कंपन्यांच्या तुलनेत प्रचंड मागणी असूनही सेवा देण्यात बीएसएनएल मागे पडत असल्याचे चित्र होते .,610
सेवा,"त्यामुळे स्वीचवरील भार वाढल्यामुळे सेवा कोलमडली आहे , असा अंदाज काही अधिकाऱ्यांनी व्यक्‍त केला .",612
भव्य,लवकरच या भव्य वास्तूचे कामही सुरू होईल .,910
भव्य,"डोंबिवली स्थानकात त्यांचे भव्य स्वागत करण्यात आले , तसेच उपस्थितांनी त्यांचा सत्कारही केला .",2105
भव्य,इथे अलकनंदा व भागीरथी या दोन भव्य नद्यांचा संगम आहे .,3386
भव्य,"प्रचंड खळाळती , थोडीशी रौद्रच भासणारी अलकनंदा आणि स्वच्छ सौम्य भागीरथी NULL ! मग भव्य गंगा NULL .",3388
भव्य,दुसऱ्या एका भव्य मैदानात फक्त त्याच शिक्षण संस्थेच्या सभासदांना प्रवेश होता .,3738
भव्य,महाराष्ट्र राज्य पर्यटन विकास महामंडळाच्या वतीने पर्यटकांसाठी सोलापूरलगत भव्य रिसॉर्ट उभे करण्यासाठी जागा शोधण्याचे काम सुरू आहे .,3768
ठेवले,"औंढ्याच्या शासकीय विश्रामगृहावर दोन पोलिस बंदोबस्तासाठी ठेवले असते , तर हा प्रकार घडलाच नसता असेही श्री . घुगे यांनी सांगितले .",502
ठेवले,काय करून ठेवले होते हे त्यांनी ?,639
ठेवले,"कॅप्टन डी. जे. सिंग , सुभेदार मारुती खंडागळे , हवालदार त्शेरींग अँगचोक , हवालदार बलवंतसिंग नेगी , हवालदार अमरदेव भट आणि शिपाई सचिन पाटील यांनी स्थानिक वेळेनुसार पहाटे सहा वाजता एव्हरेस्टवर पाऊल ठेवले .",967
ठेवले,"दरम्यान , पूरग्रस्तांना मदतीचे काम स्थानिक पोलिस आणि लष्कराने आजही सुरू ठेवले .",1356
ठेवले,तर नव्या नाटकाविषयीही बोलून ठेवले होते .,2892
ठेवले,राजघराण्याकडे असलेले संदर्भ ग्रंथ ठेवले जातील .,3347
वनस्पती,"तसेच , वनस्पती ह्या मुळाचा निःस्त्राव आणि इतर रसायने तयार करतात जी त्यांची मृदा परिस्थिती / वातावरण तसेच त्यांचा तण परिस्थिती / वातावरण योग्य रीतीने हाताळते .",6331
वनस्पती,"ही उभी , अर्ध किंवा मागे ओढली गेलेली , दाट वार्षिक औषधी वनस्पती आहे .",6404
वनस्पती,"कापणीसाठी पात्याच्या मागच्या बाजूची रुंदी ही १० सेंमी किंवा त्यापेक्षा कमी असते , परंतु जाड खोड असलेले पदार्थ वनस्पती हाताळ्यासाठी अधिक रुंद असू शकते .",6506
वनस्पती,"आहारात नसलेल्या सॅपोनिन्सच्या स्रोतांत अल्फाअल्फा , सूर्यफूल , औषधी वनस्पती व बारबास्को ह्यांचा समावेश असतो .",6606
वनस्पती,"कधीकधी , एखादी पोषक वनस्पती खूप अशक्त होऊन मरून जाते .",6690
वनस्पती,सध्या हा कीटक पेरसियाच्या सायट्रस वर्गातील वनस्पती पिकणार्‍या क्षेत्रांमध्ये मोठ्या प्रमाणात पसरलेला आहे .,6708
आपली,मुलींकडे पाहण्याची नजर आपली अद्यापही कोती आहे .,181
आपली,आपली मुलगी म्हणून काही खास वागणे तिचे माझ्याशी नसायचे .,670
आपली,या निवडणुकीत सत्तारूढ आघाडीच्या विजयासाठी निर्णायक ठरणार्‍या मायावतींच्या बहुजन समाज पक्षाने आपली भूमिका स्पष्ट करण्याबद्दल अद्याप फारसा उत्साह दाखविलेला नाही .,986
आपली,या ग्रंथामागील आपली भूमिका स्पष्ट करताना डॉ. टिकेकर यांनी हाडाचा पत्रकार असल्यामुळे हे लेखन शक्‍य झाल्याचे सांगितले .,1386
आपली,त्यातून आपली अधिक प्रगती होऊ शकेल ; मात्र त्याचबरोबर पृथ्वीवरील वातावरण चांगले असल्याने ते येथे येतील व वसाहतवादाची समस्या निर्माण होईल .,1554
आपली,मात्र शिवसेनेने आपली भूमिका अद्याप जाहीर केलेली नाही .,1616
